absolute,block,md,topic
Is this any good? Otherwise recommendations pls!,Is this any good? Otherwise recommendations pls!,My room is  3.96m max x 3.61m and I'm in the United Kingdom!,air purifiers
Small Intelligent purifier? Apple compatible?,Small Intelligent purifier? Apple compatible?,"My wife has been sneezing and coughing. I’d really like an air purifier that, during the day, would go to high power if the house is empty, or medium power if the room is empty but we’re still at home. Then low or off depending on the clock.",air purifiers
Dyson BP04  - Still a bad deal for 600 USD?,Dyson BP04  - Still a bad deal for 600 USD?,"I haven’t been part of this community for long, but I’ve seen mixed reviews of the Dyson BP04. My local dealer has it on sale for 600 USD. Is that a good deal for its performance?",air purifiers
Cat smell with Oransi Mod jr and Mod?,Cat smell with Oransi Mod jr and Mod?,"I was wondering if these air filters are just poor, or if there might be another recommendation people would suggest?",air purifiers
Assitance in picking an air purifier.,Assitance in picking an air purifier.,"I have multiple cats, and I live near a main road with a bus stop right under my apartment.I don't have allergies. but I cook alot (so there is smoak), and I have a sensetive nose to smell.",air purifiers
Which air purifier and humidifier has been Worth it for everyday use?,Which air purifier and humidifier has been Worth it for everyday use?,"I'd like to stay around a $450 budget, including replacement filters and normal operating costs. Quiet operation and reliability matter more to me than extra smart features.",air purifiers
Dehumidifier that isn't also an air purifier?,Dehumidifier that isn't also an air purifier?,"Any options for just washable ""lifetime"" filters?",air purifiers
Colorado wildfire season filter,Colorado wildfire season filter,Our first day of smoke is here and I need a filter for my home since this season will probably be a doozy. I've been looking for something for my asthma and the wildfire smoke and if it help with any allergies that would be great as well. I dont need a smart filter or anything like that if it makes things more expensive. We live in a tiny 1 bedroom probably around 500sq ft in size. No pets!,air purifiers
To buy air purifiers or not,To buy air purifiers or not,"I sometimes get a stuffy nose, but not a big issue, or maybe I’m just used to it. I know air purifiers don’t really do visible dust, so that’s not why I’m considering getting purifiers. Sometimes there is a musty smell in the basement; it comes and goes. And I’m just worried about basement funk in general, so it’s always in the back of my mind to keep clean air (I open the windows multiple times a week).",air purifiers
"Best air purifier for strong incense odor (bedroom, odor-focused)","Best air purifier for strong incense odor (bedroom, odor-focused)","My neighbor is an incense lover and a chain smoker. I really hate the smell, and the  is .",air purifiers
Any recommendations for mold? So many options feel like marketing BS,Any recommendations for mold? So many options feel like marketing BS,"I’m not trying to buy random trendy stuff, I just want something that actually works.",air purifiers
Would multiple smaller units be better than one large unit?,Would multiple smaller units be better than one large unit?,"For example, the Coway AP 1512 Mighty, on sale for $150, provides a CADR of 240.",air purifiers
What SMOKE filter brand is better,What SMOKE filter brand is better,The smoke filter I use is for the levoit 300. Smoke and Voc filter. I use Filter Monster brand. I don't actually smoke in the 300sq o use it to get rid of the initial smoke smell before I get outside.,air purifiers
Air Purifier Buying Advice,Air Purifier Buying Advice,I'm in the southeastern USA and I'm looking for advice on buying an air purifier.,air purifiers
Luggable Ultra Air Purifier 5-fan template,Luggable Ultra Air Purifier 5-fan template,Cleanairkits is sending me a replacement part.,air purifiers
Is it true that purifiers with less than 150 CADR are ineffective for allergies?,Is it true that purifiers with less than 150 CADR are ineffective for allergies?,"Edit: I saw a recommendation of CADR being at least half the area of our room. If my room is 250 squarefeet, that would mean around 125CADR, which would get close to the cheaper national unit that gives 120CADR. But I also read the recommendation of the CADR being higher than the one recommended if we are talking about allergies, so my question stands the same.",air purifiers
"Looking for: carbon filter for hvac system, small unit for kitchen to remove vocs from gas range","Looking for: carbon filter for hvac system, small unit for kitchen to remove vocs from gas range",We are hoping to install activated carbon filters into our hvac system.,air purifiers
cordless air purifier recommendations?,cordless air purifier recommendations?,"i have a trip planned where i'll be driving & camping in a tent overnight, and where i live it's wildfire season, so the air quality may suddenly become awful at any time. i have asthma & get migraines when the smoke is bad, so it's not ideal to be sleeping in a tent if it does happen to get really smokey out.",air purifiers
I'm looking for something to deal with dust in an enclosed office (no windows) that is quiet,I'm looking for something to deal with dust in an enclosed office (no windows) that is quiet,I've heard about Luggable and I might go in that direction but I'm wondering if there are any other or better solutions for things I can put at my cubicle or floor to help me breathe easier.,air purifiers
"Filter/Purifier for ~250 s/f College Dorm, Including Bathroom","Filter/Purifier for ~250 s/f College Dorm, Including Bathroom",Bottom line?,air purifiers
Recommended air quality control device on a budget? (<200 EUR),Recommended air quality control device on a budget? (<200 EUR),I am reading a lot of mixing/conflicting recommendations (or for devices that are no longer available like the VINDSTYRKA ).,air purifiers
Need Help Choosing Air Purifier for Individual with Severe Chronic Lung Disease and Allergies,Need Help Choosing Air Purifier for Individual with Severe Chronic Lung Disease and Allergies,"I am currently trying to figure out which air purifier to buy for my apartment; however, all my online research has only left me more confused about which brand and model would work best for me.",air purifiers
Why core 200S is twice the price of Vital 200S,Why core 200S is twice the price of Vital 200S,I was looking for an Air Purifier for a bedroom that is around 9m² in France. That bedroom was letting a lot of dust and cat's hair in the air and I really need to do something about this.,air purifiers
Deciding on Air Purifier for VOCs from new couch,Deciding on Air Purifier for VOCs from new couch,It's difficult for me to open the windows to vent because of how much it has been raining. I'm worried about the humidity build up along with the water damage to the window areas.,air purifiers
MERV 12 Filters worth using for wildfire smoke?,MERV 12 Filters worth using for wildfire smoke?,"If i'm understanding this correctly, tt seems like they will filter some of the 0.3-1.0 micron particles - just not as effectively as MERV 13. If these filters will be running continuously, will they eventually reach a higher level of filtration? Or - will the smaller particles just pass through indefinitely?",air purifiers
"Calculating my Living Room's volume (and Recommendations would be nice!) - Wildfire smoke, pet odors, etc.","Calculating my Living Room's volume (and Recommendations would be nice!) - Wildfire smoke, pet odors, etc.","The room is oddly shaped to say the least. house is a split level, with a large main living room. the ceiling slopes from 8' against the outer wall, going up to ~12' on the opposite wall in the center of the house. there's then a cutout in the wall at the top of the half stairs, leading into a hallway. there's very little separation between the living room and hallway. i have no clue where to begin calculating the volume of the living room. i went to art school, i'm terrible at math. how can i calculate this weird room (or would you folks be so kind as to calculate for me?)",air purifiers
Higher quality splurge for wildfire smoke,Higher quality splurge for wildfire smoke,"apartment is 732 ft² , 9 foot ceilingsOne bedroom I keep the doors between bathroom, living /open floor plan kitchen room and bedroom open throughout most of the day . bedroom is 140 ft² USA . No specific budget rnTIA",air purifiers
Will this DIY air purifier setup work? Is it worth the hassle? More details in post,Will this DIY air purifier setup work? Is it worth the hassle? More details in post,I plan to plug a air purifier in there and want to know if I can do it cheaper and more effective since I heard most purifiers can't handle too much VOC which is my primary concern.,air purifiers
Levoit Eleva 300x Thoughts?,Levoit Eleva 300x Thoughts?,"Looking for an air purifier for a studio apartment in the US, aprox 350 sq ft. Mainly looking to reduce dust and wildfire smoke, but odor reduction would be nice as well (would love if my apartment didn't smell like what I cooked two days ago). I almost always have my window open as well since there is no circulation when it's closed, but am hoping with an air purifier I could close it occasionally without it getting too stuffy feeling. I know for true odor management you need an expensive purifier with pounds of carbon, but those are out of my price range. Thinking this might work since the carbon filters are seperately replaceable and seem robust (at least pellets not a coating). Also looking at the Core 400s since you can get 1.5lbs of carbon in the smoke filter for the 400s, but filters are significantly more expensive and have a shorter life and are combined with the particle filters. Thinking with the Elva I could stock up on carbon filters and replace those more frequently.",air purifiers
Levoit Core 300 fails to lower HCH0 and TVOC's (and probably most commercial grade purifiers). Any alternatives?,Levoit Core 300 fails to lower HCH0 and TVOC's (and probably most commercial grade purifiers). Any alternatives?,The results from a small 3x3 bedroom are as follows:,air purifiers
What air purifier to buy?,What air purifier to buy?,"This is completely new territory for me so I'm completely lost. I've seen people recommend Coway, Levoit etcetera.",air purifiers
Levoit eleva 300x air purifier,Levoit eleva 300x air purifier,Room size is about 200-250 square feet,air purifiers
Air Purifier Good for Bedroom and Litter Box,Air Purifier Good for Bedroom and Litter Box,Any recommendations?  I was looking at Blueair but read that they are not that good with odor control. I looked at Shark but there is no way to set controls without being at the unit.,air purifiers
Feedback on Philips 3200 (vs Levoit 600S vs Xiaomi Elite),Feedback on Philips 3200 (vs Levoit 600S vs Xiaomi Elite),-------,air purifiers
Is it better to have a powerful purifier or two normal ones in different rooms?,Is it better to have a powerful purifier or two normal ones in different rooms?,"in my room which is small, but so that it absorbs as much dust as it can because it is where I am most interested in the room being clean",air purifiers
Will an air purifier help with stale air in a poorly ventilated apartment?,Will an air purifier help with stale air in a poorly ventilated apartment?,"The biggest issue is that I only have windows on one side of the apartment, so I can't create a cross breeze by opening windows on opposite sides. I can open my windows, but there isn't much airflow.",air purifiers
Apartment complex put in 3 A230's and said we need to change the filters ourself and upkeep.,Apartment complex put in 3 A230's and said we need to change the filters ourself and upkeep.,the apartment is about 550 square feet I reckon.  Currently one in kitchen and living room.  Open floor.,air purifiers
Title: Brondell PR50-W Died Immediately After Installing Genuine Replacement Filters – Anyone Else Experience This?,Title: Brondell PR50-W Died Immediately After Installing Genuine Replacement Filters – Anyone Else Experience This?,"Since then, I have:Removed and reinstalled all filters multiple times",air purifiers
Need Guidance Please! Feeling Discouraged.,Need Guidance Please! Feeling Discouraged.,What are the best options here?,air purifiers
Would getting an air purifier work for me?,Would getting an air purifier work for me?,"The reason im considering this is because someone advised it would help with the smell in my room, my neighbours smoke a lot of interesting substances and it leaves a foul odour in my room through the vent or window if its open and takes a long time to leave my room. im also worried about it seeping into my belongings which I was also told a purifier could help prevent. Another reason is also I get a lot of quick dust build up in my room and its getting too much to deal with.",air purifiers
Spilt some water over my air purifier,Spilt some water over my air purifier,"Am i good or will the filter get damp and be less effective? I only bought the filter last month. idk why im so clumsy with water recently spilt a lot over my desk the other day but thats irrelevant, I just hope the filter doesnt get damaged. I cant check it now as its midnight and I dont want dust going everywhere to inspect it",air purifiers
corsi rosenthal or air purifier?,corsi rosenthal or air purifier?,follow up question: what filter should i use for the corsi rosenthal? merv 13?,air purifiers
Recommendation for Controlling Pet Odor?,Recommendation for Controlling Pet Odor?,Request specifications:,air purifiers
Are air purifiers a waste if you keep windows and doors open?,Are air purifiers a waste if you keep windows and doors open?,"Idk if it matters but, no pets and non-smokers. TIA!",air purifiers
"Neighbors weed smell coming into my house through open windows - US, <700SF, $500 or less","Neighbors weed smell coming into my house through open windows - US, <700SF, $500 or less","Bedroom is less than 200SF. Our houses are close together, but no walls are shared - these are single family homes. The current offender is across the street and the weed they smoke is pungent and drifts over 50 feet into my home.",air purifiers
Levoit Core Mini - size of DC barrel plug?,Levoit Core Mini - size of DC barrel plug?,Thanks in advance!,air purifiers
Questions about vital 200s air purifier?,Questions about vital 200s air purifier?,"I 3D print hopefully a lot now that I impolse bought a u1 my u1 is expensive new toy...anyways before my mom somewhat took over the room my printers are in (no I don't print when she uses it and she doesn't anymore), my mom got me this air purifier, but things happened, she had to take over the room, we store some stuff in it and I haven't set it up until now. I already have the common IKEA modded air filter and generally use the safer plastics so I don't worry to much but my 2 questions are, is it any good and is the sensor gonna be accurate for if I 3D print or some of the more nasty stuff I may never even use but maybe? I know better then to just 100% trust manufacturers on should be fine especially when I don't know the brand.",air purifiers
Coway airmega 150 Auto mode too sensitive?,Coway airmega 150 Auto mode too sensitive?,It is slightly annoying as the sound is too much every other 5 mins. Can someone with same model confirm that this happens?,air purifiers
<100ft rooms - is vital 200s overkill,<100ft rooms - is vital 200s overkill,"But following this logic, I could as well buy one of those :",air purifiers
I shopped new cars yesterday and the odors were really disconcerting. Found this in physics articles,I shopped new cars yesterday and the odors were really disconcerting. Found this in physics articles,"also see the Wiki, it’s quite detailed",air purifiers
Purifier recommendations for bedroom?,Purifier recommendations for bedroom?,I live in Ontario in Canada. It’s a medium size bedroom. I’m unsure of the dimensions unfortunately.,air purifiers
Honeywell 50250-S HEPA Air Purifier filter,Honeywell 50250-S HEPA Air Purifier filter,country: usa,air purifiers
"Clean Air Kits total ownership chart is wrong, understates cost by factor 10","Clean Air Kits total ownership chart is wrong, understates cost by factor 10",The correct total cost of ownership per year according to the stated (generous) assumptions on the left is ($310+2×$59+3×81 kWh×$0.22/kWh)/3×(402/40cfm)​≈$16 not the $1-2 that seem to be plotted.,air purifiers
Which air purifier should I get?,Which air purifier should I get?,I just want something to help reduce my dust levels in my room. All the surfaces get lined with dust so easily! I have a German shepherd. No allergies concerns.,air purifiers
"I read the sticky, but...","I read the sticky, but...","Are there any good solutions to this, or does this still fall under the, ""air purifiers don't do dust"" thing. I was just thinking since I just need it to do a little area, right next to the sweater breakdown, that maybe this could be possible.",air purifiers
AC0650 lässt sich nicht koppeln,AC0650 lässt sich nicht koppeln,"Heute wurde mein AC0650 von Philips geliefert. Leider lässt er sich nicht koppeln. Er wird in der App angezeigt, aber wenn ich ihnkoppeln will, dann bekomme ich nur eine Meldung, dass das koppeln schief ging. Ich habe mein 5g netz auf 2,4 gesetz. Ich habe iPv6 ausgestellt. Ich habe WPA2 eingestellt. Mein Passwort hat keine Sonderzeichen. Ichhabe das Gerät mehrmals auf Werkseinstellungen gesetzt, habe mehrmals die App deinstalliert und neu installiert. Ich weiß nicht mehr weiter. Hat hier irgendjemand eine Lösung für das Problem?",air purifiers
AllerAir ... created bad odors in my home!! Anyone else experience this?,AllerAir ... created bad odors in my home!! Anyone else experience this?,"FYI, I believe AllerAir is going to investigate the lapse in fragrance-free protocol in production as well. They should! :)",air purifiers
Deciding on which levoit model as a pet owner,Deciding on which levoit model as a pet owner,Would anyone have an alternative suggestion for a different Levoit model?,air purifiers
"New here, looking for an air purifier.","New here, looking for an air purifier.",I live in upstate New York (BUF) and am looking to get one for my room since I live in student apartments. The room is pretty small and has an ensuite. I’d say about 130sq ft room.,air purifiers
Best brand that indicates maintenence?,Best brand that indicates maintenence?,"Budget is flexible within reason especially if I can get it someplace that has financing interest free for 6 to 12 months like lowe's, home depot, amazon, manufacturer sites that use secondary like Affirm or Klarna or paypal credit, etc.",air purifiers
Brondell P700 vs Winix 5500,Brondell P700 vs Winix 5500,I understand Winix is a great unit off the bat,air purifiers
Am I crazy or can I actually tell an obvious difference?,Am I crazy or can I actually tell an obvious difference?,Well I posted again yesterday asking if I should get the air purifiers I liked the look of and had the performance capable of covering the two rooms I stay in (one for each room). Mixed opinions but I decided to order them on Amazon for only $165 each with next day shipping.,air purifiers
"Help - wife suffering from acute allergies, need purifier advice","Help - wife suffering from acute allergies, need purifier advice","Multiple doctors have been helpless - various antihistamine pills and creams, including with steroids. The only thing that ever helped, once during a severe outbreak, was a steroids shot in the hospital, but it's obviously not a long-term solution.",air purifiers
Stay Away From Mila Air...,Stay Away From Mila Air...,"I'm in the US. Just wanted a single purifier for my bedroom, which is about 10x10x15 to filter out pollen and dust for a few hundo.",air purifiers
BARNAKL ceiling fan filters as an ADD ON,BARNAKL ceiling fan filters as an ADD ON,Anyone have experience with these as an ADD on to your existing purifier setup? I have MCAS so getting as much stuff not making it’s way onto or into my body is the goal.,air purifiers
Air flow and efficiency in filtering,Air flow and efficiency in filtering,"For example, if you have a Hepa 13 capturing 99.97% of particles vs merv 13 capturing 75% of the same particles.",air purifiers
Small Intelligent purifier? Apple compatible?,Small Intelligent purifier? Apple compatible?,I can do that with a smart light. Can I do it with an intelligent air purifier? One that works well?,air purifiers
Dyson BP04  - Still a bad deal for 600 USD?,Dyson BP04  - Still a bad deal for 600 USD?,"I’ve seen that most people tend to recommend the Airmega ProX or similar models, but those are usually in the 1,000 USD price range. I was just wondering whether the BP04 is a good choice for 600 USD, or if there are still much better alternatives at that price.",air purifiers
Cat smell with Oransi Mod jr and Mod?,Cat smell with Oransi Mod jr and Mod?,"I have a two-bedroom in New York City, and I'm trying to improve the overall air quality, but also deal with the cat smell (like I previously spoke to).",air purifiers
Assitance in picking an air purifier.,Assitance in picking an air purifier.,My budget is an equivelent for machine that sale $200 and under in the US. The machine will move between my bedroom (15sqm) and my open space living room-kitchen (35-40sqm).,air purifiers
Which air purifier and humidifier has been Worth it for everyday use?,Which air purifier and humidifier has been Worth it for everyday use?,"I've spent a lot of time reading reviews, but they seem pretty inconsistent. what are you using, and would you choose the same one again? thanks",air purifiers
Dehumidifier that isn't also an air purifier?,Dehumidifier that isn't also an air purifier?,located in New Zealand,air purifiers
Colorado wildfire season filter,Colorado wildfire season filter,"I've tried to do some reddit research but just understand it all (or really even care to). I just want something that will help filter out the bad in this season especially since we don't have ac because were in the high alpine so keeping the windows open is usually essential, at least at night. My budget is around $150 or so.  Saw a blue air 311i was on sale which caught my attention but some people said it was good some said it was bad. Just any advice on this front would be great.",air purifiers
To buy air purifiers or not,To buy air purifiers or not,"My ideal range would be around $300, but willing to spend more if performance is necessary, but also I’m a sucker for aesthetics and really don’t want an eye sore in my rooms.",air purifiers
"Best air purifier for strong incense odor (bedroom, odor-focused)","Best air purifier for strong incense odor (bedroom, odor-focused)","I’m in France and looking for an air purifier for a bedroom of about ~. My budget is around , plus  if needed.",air purifiers
Any recommendations for mold? So many options feel like marketing BS,Any recommendations for mold? So many options feel like marketing BS,I have seen listing sites but a ton of them are fake sponsored stuff.,air purifiers
Would multiple smaller units be better than one large unit?,Would multiple smaller units be better than one large unit?,"And the Coway  AP 2015 Airmega 400, on sale for $350, provides a CADR of 330.",air purifiers
What SMOKE filter brand is better,What SMOKE filter brand is better,$25 every 2 months With 2 pre-filter changes the smell out in 15-20 minutes on almost the highest setting.,air purifiers
Air Purifier Buying Advice,Air Purifier Buying Advice,The two rooms I'm mainly looking to cover are:,air purifiers
"Looking for: carbon filter for hvac system, small unit for kitchen to remove vocs from gas range","Looking for: carbon filter for hvac system, small unit for kitchen to remove vocs from gas range",We are also looking for a small activated carbon unit that we can use while cooking on our gas range/oven.,air purifiers
cordless air purifier recommendations?,cordless air purifier recommendations?,i know an air purifier will only do so much in a tent environment but i think it would be better than nothing,air purifiers
I'm looking for something to deal with dust in an enclosed office (no windows) that is quiet,I'm looking for something to deal with dust in an enclosed office (no windows) that is quiet,"Thanks,",air purifiers
"Filter/Purifier for ~250 s/f College Dorm, Including Bathroom","Filter/Purifier for ~250 s/f College Dorm, Including Bathroom","Looking for a smaller, but effective unit for the daughter and her roommate.",air purifiers
Recommended air quality control device on a budget? (<200 EUR),Recommended air quality control device on a budget? (<200 EUR),So I was wondering if anyone had any recommendations given:,air purifiers
Need Help Choosing Air Purifier for Individual with Severe Chronic Lung Disease and Allergies,Need Help Choosing Air Purifier for Individual with Severe Chronic Lung Disease and Allergies,"Due to a congenital disorder, I suffer from severe respiratory difficulties as a result of both restrictive and obstructive lung diseases.  However, most of the online reviews/suggestions for APs don’t seem to be written by or for individuals with diagnosed chronic lung disease.",air purifiers
Why core 200S is twice the price of Vital 200S,Why core 200S is twice the price of Vital 200S,Though... I found core 200S at 100€ and Vital 200S at 230€. They're not doing the same job ? They have the same filter ? It's a question only a question of CADR ?,air purifiers
