absolute,block,md,topic
Is an air fryer actually worth buying on a small budget?,Is an air fryer actually worth buying on a small budget?,"I'm a university student and I work part time so I don't have a lot of time or money. I've been thinking about getting an air fryer because everyone says they're faster than an oven and use less electricity. My apartment is also really small and the oven makes the whole place unbearably hot during the summer. I can barely stand it on these hot days. The problem is that the good air fryers seem pretty expensive. I don't cook anything fancy, just chicken, potatoes, frozen food, vegetables, pasta and simple meals but I'm not sure if I should keep using my oven, save up for a better air fryer or buy a used one if I find a good deal.",air fryer
nan,nan,nan,air fryer
nan,nan,nan,air fryer
Replacing Broken IP Vortex Plus - Suggestions please,Replacing Broken IP Vortex Plus - Suggestions please,"The door hinge on ours has just broken. Seems I cannot get a new door anywhere (I've looked all over). Even though it's discontinued, some stores have them in stock for $190 CAD but lack of support really bothers me now.",air fryer
"Advertisement: Announcing Paper, the canvas for teams and agents",nan,nan,air fryer
I ate French Fries after 5 months because I was avoiding oily food for weightloss. Airfried one tastes nearly same as deep fried imo.,I ate French Fries after 5 months because I was avoiding oily food for weightloss. Airfried one tastes nearly same as deep fried imo.,nan,air fryer
Sugar cookies,Sugar cookies,"Hello! My oven is broken and I have a PowerXL Vortex Pro air fryer and really want to make sugar cookies, I have the tube of premade Pillsbury sugar cookie dough. Could someone give me the best time and temperature or setting to make cookies? I want to make a big square cookie on the bottom of the air fryer if possible, if it won’t cook right please lmk! I would prefer them soft not crunchy. Thank you!!",air fryer
Airfryer deviled eggs,Airfryer deviled eggs,nan,air fryer
What healthy meals can you make with only an air fryer and microwave?,What healthy meals can you make with only an air fryer and microwave?,nan,air fryer
Made ribs with my homemade mango sauce and put it in my cheap azz Chefman airfryer with some fresh cut pineapple. How does it look?!,Made ribs with my homemade mango sauce and put it in my cheap azz Chefman airfryer with some fresh cut pineapple. How does it look?!,nan,air fryer
Adopting Blue Apron meals for air fryer,Adopting Blue Apron meals for air fryer,"I get Blue Apron meals delivered and many of them, especially the ones that come with proteins call for frying. I’m done with that. I am now working on figuring out the best ways to air fry, pork, chicken, fish, and even steak.I think the air fryer can do it",air fryer
"Advertisement: Nieuw: internet en TV. Kies tussen internet en TV of internet only, alles met gemak geregeld.",nan,nan,air fryer
Baking in the gourmia GAF858? Can I turn the fan off?,Baking in the gourmia GAF858? Can I turn the fan off?,"I want to be able to use my airfryer as a toaster oven for basic baking, but it dries the tops of everything out on the ""bake"" setting because the fan is still running. I made biscuits this morning using a baking try, the tops looked like cement and the bottoms were so moist they were almost steamed.",air fryer
Cheesy bacon fries,Cheesy bacon fries,nan,air fryer
"I know an airfryer is not the best to bake, but why is my bread always hardened when i attempt to bake it?","I know an airfryer is not the best to bake, but why is my bread always hardened when i attempt to bake it?","I've flattened them, reduced the temperature and increased the timings but I still cannot get that soft bready texture",air fryer
Made another Pork Loin Roast!,Made another Pork Loin Roast!,nan,air fryer
"Exploding glass, Costco vs Sharkninja site","Exploding glass, Costco vs Sharkninja site","I noticed that both of the redditors I saw who posted about it had gotten theirs from Costco, and when I compared the Pro 6-in-1 on Costco's app vs the Sharkninja site, the model numbers are different.",air fryer
Finally cooked a full meal in the air fryer,Finally cooked a full meal in the air fryer,nan,air fryer
What’s one cooking skill you wish someone had explained sooner?,What’s one cooking skill you wish someone had explained sooner?,What’s one cooking question you’ve always been embarrassed to ask?Nothing is too simple. I promise I won’t judge—I’ll explain it like we’re standing in a kitchen together.,air fryer
"Advertisement: Nu 2 Gbit/s & TV Start 9 maanden van 66,40 voor 28,20 i.c.m Vodafone. Met Wifi Garantie.",nan,nan,air fryer
"I tested air fryer eggs 3 ways — fried, sunny-side up, and hard-boiled","I tested air fryer eggs 3 ways — fried, sunny-side up, and hard-boiled",nan,air fryer
Something Simple,Something Simple,nan,air fryer
Favorite Plant-Based Air Fryer Comfort Food Recipes?,Favorite Plant-Based Air Fryer Comfort Food Recipes?,I’m trying to eat more plant-based and just got an air fryer. Does anyone have any favourite tofu or other plant-based air fryer recipes that feel like comfort food?,air fryer
Typhur Dome 2 Settings Defined,Typhur Dome 2 Settings Defined,Typhur Dome 2 Settings,air fryer
Cake day but instead of cake here’s chicken for you all.,Cake day but instead of cake here’s chicken for you all.,nan,air fryer
Airfryer Sourdough Brioche,Airfryer Sourdough Brioche,nan,air fryer
Do I have to use this tray/plate thing every time?,Do I have to use this tray/plate thing every time?,nan,air fryer
Cooking corn in husks in air fryer?,Cooking corn in husks in air fryer?,Is this doable? If so how do I go about it?  Thank you!,air fryer
Advertisement: Een eigen tablet voor kleine ontdekkers: ontdek VTech-speelgoed.,nan,nan,air fryer
How often are package directions just plain wrong?,How often are package directions just plain wrong?,nan,air fryer
Bread sticks to the baking sheet,Bread sticks to the baking sheet,nan,air fryer
Air Fryer Cheesy Bread,Air Fryer Cheesy Bread,nan,air fryer
Airfyer Birthday Cake !,Airfyer Birthday Cake !,nan,air fryer
Help! My Ninja air fryer can’t open!,Help! My Ninja air fryer can’t open!,nan,air fryer
My Roommate Airfryer Condition,My Roommate Airfryer Condition,nan,air fryer
Cookies turning out to be raw,Cookies turning out to be raw,"I tried to bake a single air fryer cookie at 150 degrees Celsius .I preheated the air fryer and spread out the cookie dough asw, put a chocolate chunk inside, dough around it and flattened.Used an aluminium foil that didnt cover the entire bottom just the reqquired amt for the cookie. I baked for about 15 min but it was still raw so put it back in for another 5 min but nothing on the inside seemed to change",air fryer
First attempt at Yorkshire Pudding,First attempt at Yorkshire Pudding,nan,air fryer
No Worries for Omlettes in Cosori TurboBlaze with Springform or Silicone Pans,No Worries for Omlettes in Cosori TurboBlaze with Springform or Silicone Pans,nan,air fryer
Looking for replacement for Beautiful 9QT air fryer basket divider,Looking for replacement for Beautiful 9QT air fryer basket divider,They don’t sell replacement parts (I called customer service) and I can’t find any listings online. Anyone here have one to spare? I’d be willing to pay for it. Suggestions are welcome as well!,air fryer
Air fryer completely changed my Sandwich game,Air fryer completely changed my Sandwich game,"I really really like sandwiches but l am the type who can’t do cold,  untoasted sandwiches. This didn’t fit my diet and severely upped my daily caloric intake. But one day l tried making sandwich in airfryer and realised it crisped the bread without any oil or butter.  You can also control how much crispy you want it by reducing the time, so it’s not literal toast but fulfils the need of getting it a little warm. No more choosing between cold, soggy bread or bread with extra oil and butter on it!!!!!!",air fryer
Didn’t realize you could bake stuff in an air fryer!,Didn’t realize you could bake stuff in an air fryer!,nan,air fryer
I Made Air Fryer Fried Chicken with Crispy Fried Onions Instead of Flour and Egg,I Made Air Fryer Fried Chicken with Crispy Fried Onions Instead of Flour and Egg,nan,air fryer
Honey chipotle chicken thighs,Honey chipotle chicken thighs,nan,air fryer
My new lazy meal. Refrigerates well. Breakfast Eggs.,My new lazy meal. Refrigerates well. Breakfast Eggs.,nan,air fryer
"this easy recipe of onion rings, cook up fantastic in the air fryer","this easy recipe of onion rings, cook up fantastic in the air fryer",nan,air fryer
Made macaroni schotel :),Made macaroni schotel :),nan,air fryer
Perfect Chicken Wings in Air Fryer 😋😋,Perfect Chicken Wings in Air Fryer 😋😋,nan,air fryer
"cooked these on my philips air fryer, what am i doing wrong? soaked in ice water then dried and set for 180 degrees for 16 minutes with a brush of olive oil.","cooked these on my philips air fryer, what am i doing wrong? soaked in ice water then dried and set for 180 degrees for 16 minutes with a brush of olive oil.",nan,air fryer
Got my first AF. I have questions though!,Got my first AF. I have questions though!,Google is unhelpful and I don't trust it:,air fryer
Perfectly toasted slivered almonds in my Ninja Flip,Perfectly toasted slivered almonds in my Ninja Flip,nan,air fryer
How can I cook broccoli in the air fryer without burning it?,How can I cook broccoli in the air fryer without burning it?,Anytime I try to cook broccoli in the air fryer it gets burned.,air fryer
Ceramic or Teflon,Ceramic or Teflon,Hey guys! I’m looking for a new air fryer and want to know if ceramic or teflon coating holds up better against peeling and flaking over time. Which one is more durable?,air fryer
Protein Snacks that taste good once cooled,Protein Snacks that taste good once cooled,"Looking for good snack ideas that you can meal prep and then eat cold (a quick boost at work) I've seen roasted chickpeas that I'm trying to figure out how to get it right. Anyone got other suggestions, maybe something like a fridge Raiders equivalent ​?",air fryer
One of my new favorite things is Boneless Country style pork ribs. Not the prettiest picture.,One of my new favorite things is Boneless Country style pork ribs. Not the prettiest picture.,nan,air fryer
New favorite thing,New favorite thing,nan,air fryer
No Worries for Omlettes in Cosori TurboBlaze with Springform or Silicone Pans,No Worries for Omlettes in Cosori TurboBlaze with Springform or Silicone Pans,nan,air fryer
"Advertisement: Create impactful presentations with AI-powered insights, standout content creation, and seamless collaboration.",nan,nan,air fryer
Advertisement: Soms voelt iets onmogelijk… totdat het wél lukt. Met die overtuiging wekken we fossielvrije stroom op uit wind en zon.,nan,nan,air fryer
One of my new favorite things is Boneless Country style pork ribs. Not the prettiest picture.,One of my new favorite things is Boneless Country style pork ribs. Not the prettiest picture.,nan,air fryer
Basket vs Oven type - Toast vs Space,Basket vs Oven type - Toast vs Space,"I am going crazy.    I wanted a better Air fryer we had the cusinart over looking jawn, and it go so dirty (yes, my kids suck at cleaning up sometimes), we moved, I tossed it.   I was looking at the 2 basket ones so that its easier to clean.    We have a TINY TINY kitchen.    The basket ones, don't apparently toast toast well or eggos, which apparently is a goto breakfast .     Is there a unicorn out that that does that? or a unicorn that would be an oven type one that is easier to clean,   I am going nuts",air fryer
My chicken thighs,My chicken thighs,nan,air fryer
What is the best Tot?,What is the best Tot?,"What are the best tater tots for air fryers, and best cooking time and stuff. I’ve been using the Walmart brand for 9 minutes at 375 F after letting them defrost, but I’m curious if there are any other recommendations.",air fryer
"Advertisement: De zonoplossingen van Vattenfall helpen je om de stroom die je opwekt zoveel mogelijk zelf te verbruiken, slim en passend bij jouw situatie. Met een thuisbatterij of zonnestroomboiler is de zon weer welkom. Voelt als nieuwe energie.",nan,nan,air fryer
Jalapeño Poppers with diced onions for the first time!,Jalapeño Poppers with diced onions for the first time!,nan,air fryer
Cleaning air fryer after EACH use ... but....,Cleaning air fryer after EACH use ... but....,"I noticed something. I always take the basket over to the sink, fill with hot water, soap, wash, dry, put back after EACH use. I also try to wipe the upper part as best I can with a clean wet dishcloth  after it cools. I noticed when I was drying the basket after I washed it, the crisper tray mostly, had this weird bit of what looks like baked on gunk that absolutely will not come off.. but you have to look really closely to see it... Please tell me this is baked on grease and if so, how do I get it off? I guess part of me is paranoid the coating is coming off or something, but I don't think that's what it is... I guess I thought washing it after every use would prevent this from happening but I guess not?",air fryer
Tuna melt…,Tuna melt…,nan,air fryer
My airfryer caught flame should I still eat the food???? (NOT A JOKE POST),My airfryer caught flame should I still eat the food???? (NOT A JOKE POST),nan,air fryer
Typher,Typher,Just ordered a Typher air fryer ? Can not wait till it arrives,air fryer
Crispy Pro air fryer,Crispy Pro air fryer,Looking for extra containers for this device so I can meal prep 5 days a week where can I buy it from?,air fryer
Foil in the Ninja Dual fryer?,Foil in the Ninja Dual fryer?,I am going to air fry some burgers.  I read conflicting information on whether it is okay to lay foil underneath the racks?  Thanks,air fryer
How do I clean this?,How do I clean this?,nan,air fryer
What are some of the best airfryer accessories you’ve bought?,What are some of the best airfryer accessories you’ve bought?,nan,air fryer
"Philips Series 3000 Airfryer repeatedly shuts off completely — issue confirmed by MediaMarkt, but Philips found no fault","Philips Series 3000 Airfryer repeatedly shuts off completely — issue confirmed by MediaMarkt, but Philips found no fault","Hi everyone,I’m hoping someone can help me because I’m getting pretty frustrated with my Philips Series 3000 Airfryer.The problem is that the airfryer randomly shuts off completely while I’m using it. It’s not just that the heating stops or that it pauses — the entire device turns off. The display goes completely black, as if it has lost all power.At first, I thought it might be something with the power outlet at home, so I tested it in another outlet. The problem still happened. I also made sure it wasn’t an issue with an extension cable or something similar.Because the problem continued, I brought it back to MediaMarkt, where I bought it. A MediaMarkt employee tested the airfryer in the store himself, and during that test the airfryer also shut off completely. So the problem was not only happening at my home — it was also happening in the store.After that, MediaMarkt sent it to Philips for inspection. Philips checked the airfryer and said they could not find any problem. Because of that, they didn’t repair or replace anything.However, when I got the airfryer back and tested it at home, it still had exactly the same issue. It still randomly turns off completely.The airfryer is around one year old, so it is not an old device. It has been used normally. It is not extremely dirty, and I don’t believe dirt is the cause, because the entire device loses power when it happens.What makes this situation confusing is that the problem has already been confirmed in the store by an employee, but Philips says they cannot find anything wrong with it.I would like to ask:Has anyone else had this problem with a Philips Series 3000 Airfryer?Could this be a power supply issue, overheating protection, or an internal defect?What should I do if Philips says there is no problem, but the airfryer clearly still does not work correctly?Is it reasonable to ask MediaMarkt for a replacement after the first inspection did not solve the issue?I would really appreciate any advice or experiences from people who have had a similar situation.",air fryer
Advertisement: 3D AI is getting better. Use code rtRODIN to test for free.,nan,nan,air fryer
Air fryer chicken breast cubes always turning out dry/rubbery no matter what. Need help.,Air fryer chicken breast cubes always turning out dry/rubbery no matter what. Need help.,"Hey everyone,",air fryer
Finally upgraded my air fryer,Finally upgraded my air fryer,"After using a basic air fryer, I decided to upgrade to a glass air fryer. I really like being able to check on my food without interrupting the cooking proxess. I got fritaire For those who have one what recipes really show off? I'd appreciate any reco or tips!",air fryer
First time air fryer use,First time air fryer use,"I have some breaded chicken tenders & I am thinking I might want to give the air fryer a try. How long would I want to cook them & at what temperature? (It was my deceased wife's fryer so I've been reluctant to use it, but it's been over 2 years so I ought to say least try it). I don't have a clue on where to get instructions for using the contraption, Google has too many options & is a bit overwhelming.",air fryer
Reheating salmon cakes?,Reheating salmon cakes?,"During salmon season I catch dozens of fish. If they're spawned out I flake the meat and often turn it into fish cakes, incorporating bread crumbs, egg whites, vegetables, herbs, and spices. They're around 2 cm (3/4 in) thick and 10 cm (4 in) wide. I like to freeze them and oven heat them through the winter but I got an air frier from a friend and how long will it take to reheat them from frozen? I would love the crispy texture they have when fresh even in December!",air fryer
Need chicken ideas for ninja foodi xl grill please,Need chicken ideas for ninja foodi xl grill please,"I don’t use the plug in food thermometer but was wondering if anyone had a ninja foodi xl grill, when doing chicken, what stats do you use? Bake, grill or air fryer, temp and time? Trying to eat healthier and add chicken to my nutrition so any tips help.",air fryer
How have air fryers changed the way people think about fried food?,How have air fryers changed the way people think about fried food?,nan,air fryer
Reheating Burrito's,Reheating Burrito's,"Hello, I tried to figure out how to reheat my frozen meal prep burrito's but I can't seem to find an answer online. I have an airfryer but no microwave. In the airfryer is a cooked beef spread with tomatosauce, onions and cheese. All cooked together. My airfryer doesn't have any special settings. The last time I reheat one was on like 180 degrees for 15 mins. The outside got nice and crispy (which I didn't want), and the inside was still frozen cold.",air fryer
solutions to mozarella sticks popping,solutions to mozarella sticks popping,I buy mozzarella sticks. they pop; cheese all over. solutions?,air fryer
Air fryer plug stuck in socket,Air fryer plug stuck in socket,nan,air fryer
Airfryer-curious dork looking for advice,Airfryer-curious dork looking for advice,"So, I’m a middle-aged bachelor living in a basement apartment who has gotten by for a while with a microwave and a small minifridge, but I’m coming into $200 this weekend that I was thinking about spending on an air fryer - after doing some research, I’m contemplating picking up a 5.5-quart Ninja AF161 Max XL air fryer this weekend to keep on my (large) work desk since half the stuff I keep cooking in my microwave (pizza rolls, frozen burritos, etc) keep crowing on the packaging about how much better they’d be in an air fryer.",air fryer
Advertisement: Your AI inference doesn't need to leave the EU,nan,nan,air fryer
Air-Fryer Spelt bread,Air-Fryer Spelt bread,nan,air fryer
"Recipes to meal prep, freeze and then air fry when wanting to eat them","Recipes to meal prep, freeze and then air fry when wanting to eat them","Hi allI’m a caregiver to my disabled partner and I’d like to find a way to provide a quick and easy lunch or dinner that she can make herself if I’m away or for when I’m tired and can’t cook, that can be stored in the freezer and cooked from frozen in the air fryer with minimal prep. I want to take some of the pressure off myself to cook all the meals as I’ve been told I’m approaching burnout if I can’t find some shortcuts to make things easier on myself and offload some responsibilities. Otherwise when I’m not doing well we’re just eating frozen pizzas, muesli bars, cereal, toast etc.  which is technically fine but I can’t imagine it’s good for either of us. Neither of us are a huge fan of microwave meals as they inevitably have an odd texture and go watery when reheated in the microwave after already having been cooked.",air fryer
Tuna melt…,Tuna melt…,nan,air fryer
Air fryer plug stuck in socket,Air fryer plug stuck in socket,nan,air fryer
Soft-Boiled Eggs,Soft-Boiled Eggs,nan,air fryer
The humble grilled cheese,The humble grilled cheese,nan,air fryer
Banana Bread,Banana Bread,nan,air fryer
My airfryer identifies as a microwave,My airfryer identifies as a microwave,nan,air fryer
"Air-fried [Chicken], Kale Salad, & Sweet Potatoes","Air-fried [Chicken], Kale Salad, & Sweet Potatoes",nan,air fryer
Is the gourmia digital air fryer supposed to have this inaccessible paper under it?,Is the gourmia digital air fryer supposed to have this inaccessible paper under it?,nan,air fryer
Airfryer Shokupan for Grandma,Airfryer Shokupan for Grandma,nan,air fryer
"Meatball, Sweet Potatoes, Tomato and Black Bean Dinner!","Meatball, Sweet Potatoes, Tomato and Black Bean Dinner!",nan,air fryer
Advertisement: VAT & Shipping on US. Packs on you!,nan,nan,air fryer
Mahi over wild rice with lemon peper broccoli,Mahi over wild rice with lemon peper broccoli,nan,air fryer
Airfryer peeling off,Airfryer peeling off,"So i have had this airfryer for 4 years and when my mom came over she thought it was too dirty and used some idk what chemicals to clean it, and when i found the basket it was submerged in a tub with all the grease that came off it. But also what i presume is the coating also peeled off, i heard is teflon so i am not sure if i can still use it now. Any ideas on what to do now? The model is a 4L Xiaomi airfryer if it helps",air fryer
Rhubarb crumble,Rhubarb crumble,nan,air fryer
Quick Question,Quick Question,Is it safe to line an air fryer basket with aluminum foil for bacon or other greasy food?,air fryer
Crispy hot honey garlic chicken bites?,Crispy hot honey garlic chicken bites?,There was a post on here about two weeks ago and the recipe looked good so I saved it. I wanted to make these and the post shows it had been deleted by the moderators. Does anyone know why or where I may be able to find this recipe?,air fryer
For the Cosori TurboBlaze owners,For the Cosori TurboBlaze owners,When do you use the air fry setting vs the bake setting? The air fry setting seems to be way too strong while the bake setting seems to give much more even/consistent cook and crisp.,air fryer
About to buy my first air fryer,About to buy my first air fryer,nan,air fryer
Air Fryer Chicago Thin Crust Pizza,Air Fryer Chicago Thin Crust Pizza,nan,air fryer
Measurements,Measurements,Since I can’t seem to find it anywhere online can anybody give me the measurements of the baskets of PHILIPS NA231/00 Airfryer 2000 Series 6.2L and of the whole basket of PHILIPS NA150/00 Airfryer 1000 Series Flexible Basket 7.1L? Thanks!,air fryer
Using your air fryer for microwave meals?,Using your air fryer for microwave meals?,"My family and I don't have a microwave and we just bought a new air fryer, we saw that we could potentially use it to heat microwaved meals type of boxes. Since most microwaved meals can be made in the oven, I assume it's not a danger to use the air fryer for heating them up? So, if that's the case, should we cook it inside the original box or drop it on a liner / silicone mold or something else? Thank's a lot :)",air fryer
Advertisement: Your AI agents need job descriptions. Seriously.,nan,nan,air fryer
Basket Fryer that toasts?,Basket Fryer that toasts?,"I am sure i am just dumb, but are there any that toast, we don't have a toaster, and i have an egggo obsessed kid.   We had the cussinart before, and moved and thought the baskets are better.",air fryer
Dual Stacked Air Fryers?,Dual Stacked Air Fryers?,Has anyone tried or have any of these:,air fryer
Grinding noise on Philips 7000 combi,Grinding noise on Philips 7000 combi,"Hi, I have a Philips 7000 combi air fryer. When I cook something small in it, like dried bread or something with fine spices, the fan at the top picks up the spices or crumbs and starts making a grinding noise.",air fryer
Edt luma air fryer sellng without BIS ISI mark,Edt luma air fryer sellng without BIS ISI mark,"It thought its illegal to sell air fryer without BIS certification in India. Edt luma doenst have isi mark. I called for the physical demo, and it didnt have isi mark. But they are selling on Amazon! How is that possible?",air fryer
Air fryer eggs on avocado toast,Air fryer eggs on avocado toast,nan,air fryer
Do people actually preheat the air fryer?,Do people actually preheat the air fryer?,And if so then how long do you wait until it's hot?,air fryer
