absolute,block,md,topic
Overwhelmed and Need Help on Deciding,Overwhelmed and Need Help on Deciding,"I have a issue with just buying what has the most reviews, and obviously bit me in the butt this time. What would you experts recommend?",vacuum cleaners
Need help with cordless vacuum decision!!,Need help with cordless vacuum decision!!,"I don’t anticipate moving to a large or heavily carpeted home anytime soon. For such a small space and frequent use, I’m looking at cordless options. I know this sub loves Sebo and Miele but I don’t think I’m at a point in life where I need to buy my forever vacuum haha. When I own a place I can make the investment and demote my apartment vacuum. I am looking for:",vacuum cleaners
Vacuum Cleaner Advice,Vacuum Cleaner Advice,We would really appreciate the help!!!!,vacuum cleaners
New home vacuum suggestion,New home vacuum suggestion,Thanks in advance.,vacuum cleaners
Vacuum mop combo buy advice,Vacuum mop combo buy advice,"For context, I want it for 50m2 flat, most of the flooring is hard floor, with some tiles and a lot of rugs, because of our greyhound. So i would like one that has a rug and hardfloor modes, such as the Bissell, but with stronger suction. I don´t mind cordless, but I would actually prefer a cleaner with cord. Another thing I dislike about our current model is the fact, that it leaves a few cm gap uncleaned against the wall, because of its design. I understand that this will be a thing with every combo model, but still would be nice if a new vacuum could leave smaller gap. It would also be a nice addition if the model could also pose as a vacuum only, if I wanted to vacuum a bit of debris or something.",vacuum cleaners
Is a Miele Compact C2 Electro+ worth it for $135?,Is a Miele Compact C2 Electro+ worth it for $135?,"I currently use a Hoover PowerXL vacuum which is not bad, but something lighter like a canister vacuum means my wife can easily use it around the house too.",vacuum cleaners
Buying help,Buying help,Vacuum NEEDS a light. Attachments and a long cord are also important.,vacuum cleaners
Searching for a Central vacuum dust pan,Searching for a Central vacuum dust pan,I realize there are those dust pan things that are built into the wall trim (which I do not have).  But does a (non-built-in) accessory exist that is intended to attach to your vac hose and rest on the floor like a traditional dust pan (giving me a much wider target when sweeping to the vacuum)?,vacuum cleaners
Sebo E2 Turbo vs. Miele Guard M1 parquet xl,Sebo E2 Turbo vs. Miele Guard M1 parquet xl,A) are these the right picks for my flooring situation,vacuum cleaners
DYSON- Worst vacuum company ever?,DYSON- Worst vacuum company ever?,It’s really frustrating to see a brand charge premium prices while offering poor product durability and even poorer accountability when something goes wrong.,vacuum cleaners
Shopping for grandma.,Shopping for grandma.,LightweightHas attachmentsHas a lightNot a Dyson ballNot a Dyson stickAround $400,vacuum cleaners
Shark Powerdetect Upright Question about detect mode,Shark Powerdetect Upright Question about detect mode,"The detect mode where it lights up purple for heavily soiled areas and increases power triggers every other second and I spent hours going over the same room, even going as far as letting the vacuum sit in place inch by inch to deep clean the area and in the end was still unable to pass through an area without the detect mode triggering. I tried cleaning all of the sensors and it didn't make a difference.",vacuum cleaners
Moving away from Dyson - Miele or sebo?,Moving away from Dyson - Miele or sebo?,"I have all hard wood, aside from one carpeted bedroom. Need something powerful and long lasting.",vacuum cleaners
Vacuum recommendations,Vacuum recommendations,I was looking at BJ's but they only have like the shark and when I looked on here those have really bad reviews.,vacuum cleaners
Stick Vac Recommendation in Australia,Stick Vac Recommendation in Australia,Appreciate any stick vac recos as well! Thanks everyone,vacuum cleaners
Dear Dyson Customer Support,Dear Dyson Customer Support,Charge lasts approximately 4 minutes,vacuum cleaners
What's the hardest stain you've ever asked your robot to clean?,What's the hardest stain you've ever asked your robot to clean?,"This got me curious—what’s the toughest stain your robot vacuum has ever tried to clean? Coffee? Ketchup? Pet stains? Or something even worse? Did it eventually succeed, or did you end up having to grab a sponge and admit defeat?",vacuum cleaners
Recommendation for Small Apartment (update),Recommendation for Small Apartment (update),"Please, help a man out. 🙏",vacuum cleaners
So I went to my vacuum dealer to buy a Sebo E3 today…,So I went to my vacuum dealer to buy a Sebo E3 today…,"However when I was testing out the Miele vs the Sebo I noticed a huge difference in how much more comfortable and maneuverable the Miele was. The Miele was so easy to twist and turn the powerhead, whereas the Sebo didn’t really respond very much while turning it. That is ultimately what sold me on that. I knew that the ease of use would be a huge factor for my wife.",vacuum cleaners
Looking for reccomendations,Looking for reccomendations,"I would really prefer an upright. Space is tight, canister vacuums are frustrating to use when vacuuming larger areas in my experience (have used a couple of older miele's). I also really hate dealing with bags. I know that they do a better job of containing everything but I'd rather deal with taking the canister outside to dump it than deal with bags. But I could be persuaded otherwise on both accounts I think if there's a good enough reason. Normally I would fall down a rabbit hole and spend weeks learning way too much about the modern vacuum market but I felt it was better to poll the brain trust here.",vacuum cleaners
Mind blown!!,Mind blown!!,"Since a lot of you seemed to recommended it, especially seeming like you guys’ are knowledgable people in the space. All I can truly say is THANK YOU SOOOO MUCH!!!",vacuum cleaners
Is Sebo really more worth than Miele without the warranty ?,Is Sebo really more worth than Miele without the warranty ?,"Though, in my country Sebo doesn't offer more than 2 years warranty and powered head doesn't seem that much useful for me since all my house is just hard floor.",vacuum cleaners
Considering my first bagged vacuum,Considering my first bagged vacuum,"I know it seems that it depends on the model you get, but my only concern is the amount of dog hair in my home MIGHT make me go through more bags than the normal household. I vacuum about every 4-5 days with a little spot sweeping here and there. Looking at something like a Sebo or Miele canister model, maybe Kenmore 600 series if I can't make the money happen.",vacuum cleaners
"Miele vs Numatic, 900sqft, hardwood with thin area rugs, weekly vacuuming.","Miele vs Numatic, 900sqft, hardwood with thin area rugs, weekly vacuuming.","Numatic James vs Miele Classic C1 or Compact C2, whichever is made in the EU. Those are the two I'm looking at as both seem to match what I want.",vacuum cleaners
Need advice on Vacuum for Home for Allergy,Need advice on Vacuum for Home for Allergy,"Note: I had to rehome my dog this week after finding out my son had a major dog allergy. My dog didn’t shed, so pet hair is not a factor in my decision on vacuums, but microscopic dander was an issue on carpeted areas.",vacuum cleaners
Need a new vaccum cleaner,Need a new vaccum cleaner,I know many recommend a cord options but what are the best options for me? Budget is under $600 to pair with my current shark that still “works”,vacuum cleaners
Shark EZ RV912S Flashing Red Battery 3 Times on Dock: New Battery Didn't Fix It,Shark EZ RV912S Flashing Red Battery 3 Times on Dock: New Battery Didn't Fix It,Product Link:,vacuum cleaners
I want to buy a Miele vacuum cleaner but can't decide which model.,I want to buy a Miele vacuum cleaner but can't decide which model.,What Miele model do you recommend?,vacuum cleaners
Commercial Grade Mop Vacuum?,Commercial Grade Mop Vacuum?,I am coming off of the Tineco S7 PRO and don't think I will be buying it again.,vacuum cleaners
Best vacuum for my situation,Best vacuum for my situation,"-2600 sqft 2 floor house-4 pets (2 cats, 2 large dogs); all are heavy shedders-Base floor is all hardwood/tile, but approx 50% or slightly more covered in low to medium pile area rugs (wife loves them)",vacuum cleaners
"Cheated on my Sebo E3: play stupid games, win stupid prizes","Cheated on my Sebo E3: play stupid games, win stupid prizes","Here’s where it gets ugly, shortly after finishing the common areas I began to wheeze and cough. Then when my chest tightened I knew what was up, this stupid vacuum just destroyed my indoor air and gave me an asthma flare.",vacuum cleaners
Too much suction,Too much suction,"For reference, currently using a Samsung Jet 75. It does pretty well but I always feel like it’s lacking on the carpet.",vacuum cleaners
Improving sebo e1 and recommendations for a stick vacuum (wool loop pole),Improving sebo e1 and recommendations for a stick vacuum (wool loop pole),"I’m actually pretty disappointed in its performance, really struggles with long hair.  (Any recommendations on how to improve this).",vacuum cleaners
Repair or Replace...,Repair or Replace...,"I would be looking for something in under $300 and would probably stick with a corded option. I am not sold on the battery stick vacuums yet. I know the budget is limiting, but I am not convinced we need more than that. Any suggestions or recommendations?",vacuum cleaners
Searching for a daily vacuum,Searching for a daily vacuum,"At this point, I do not even care about the price point. I care about it doing what it needs to do. Pick up dog hair, dirt, crumbs.",vacuum cleaners
Looking for Recommendations,Looking for Recommendations,"Use case: I have a 2 story home with 2 dogs and a cat. Shedding isn't a HUGE deal because my dogs are poodles and my cat doesn't shed too too much, but I would like something that can handle the occasional hair clean up. Our house is 99% hardwood, we just have 2 medium-sized area rugs.",vacuum cleaners
Sebo D4--worth upgrade for pets?,Sebo D4--worth upgrade for pets?,Thanks!,vacuum cleaners
Best budget corded atick or light upright WITH attachments?,Best budget corded atick or light upright WITH attachments?,I tried a mighty mite but was cheap and kinda lucky.,vacuum cleaners
Save my from Dyson,Save my from Dyson,"However…. My lovely partner cannot/will not wind cord back properly, so it ages and degrades pretty quick.",vacuum cleaners
Vacuum recs for carpet and hardwood?,Vacuum recs for carpet and hardwood?,"Right now, I've been looking at Sebo or Miele, but open to other brands if you know of anything better! Budget is flexible, but of course, looking for the best bang for my buck. Thank you :)",vacuum cleaners
Roborock F25 GT Gen 2 or Dreame H14 Pro?,Roborock F25 GT Gen 2 or Dreame H14 Pro?,The Dreame is currently about €30 more expensive than the Roborock where I live.,vacuum cleaners
"Looking for a Vacuum, ideally $150 or under. TIA.","Looking for a Vacuum, ideally $150 or under. TIA.",",",vacuum cleaners
Wool area rug help,Wool area rug help,I am really stuck in this rabbit hole. Thanks!!,vacuum cleaners
"Purchase recommendation Please. UK, Cordless, Upto £500, No pets, Laminate floor","Purchase recommendation Please. UK, Cordless, Upto £500, No pets, Laminate floor","We already have a corded Vacuum for downstairs, and would like to have a cordless one for upstairs.",vacuum cleaners
"Cordless stick vacuum recommendations, Samsung, Miele, Dreame, Bosch?","Cordless stick vacuum recommendations, Samsung, Miele, Dreame, Bosch?","Again any insight would be greatly appreciated, thanks.",vacuum cleaners
Help me decide between the Shark CH951 and Vacmaster cordless pet vaccum,Help me decide between the Shark CH951 and Vacmaster cordless pet vaccum,#NAME?,vacuum cleaners
I’m back and need a vacuum,I’m back and need a vacuum,"I don’t have the budget for a Sebo D4 and from what I hear it’s very heavy. I need something pretty light, highly effective on hardwood and carpet, well filtered and bagged, and any features need to be actually usable. Onboard tool storage and pet odor management preferred.",vacuum cleaners
Which to get?,Which to get?,"I'm considering getting my first robot vacuum mop combo. Im just a student and will not be able to spend a lot, I would prefer to spend no more than $200-300.",robot vacuums
Roller mop or spinning mop for a home with a toddler and a puppy?,Roller mop or spinning mop for a home with a toddler and a puppy?,"My kid is almost two now. He gets fidgety while eating, so crumbs and jam usually end up on the floor. Plus, we recently adopted a goldie puppy, so the cleaning has definitely gotten heavier.",robot vacuums
Just upgrade from Ecovacs X2 to X12,Just upgrade from Ecovacs X2 to X12,"I've been using the ecovacs x2 for a couple of years. Honestly it did a solid job to keep up with dust, crumbs, and the usual mess around the house, so I never really felt the need to upgrade. That changed this year after we got a dog. The amount of hair and dirt coming into the house went up more than I thought, especially on the rugs, along the baseboards, and around the entryway. That's what finally pushed me to upgrade to the ecovacs x12.",robot vacuums
Which robot vacuum has the best battery life?,Which robot vacuum has the best battery life?,"We recently moved into a bigger house, and I think my old robot vacuum has finally reached its limits.",robot vacuums
The old dilemma!,The old dilemma!,"It finally happened, and my Roborock S5 died after many years of good vacuuming! Tried replacing the motherboard, but now the WiFi seems to be dead.",robot vacuums
My cat finally stopped hiding from the robot vacuum,My cat finally stopped hiding from the robot vacuum,"Our cat turned 12 this year, and she absolutely hated the robot vacuum the first time I turned it on.",robot vacuums
The Case Against Getting a Robovac - here's who shouldn't get one (IMO),The Case Against Getting a Robovac - here's who shouldn't get one (IMO),"Heya. I've tested a LOT of floorbots and I am someone with a lot of mess. I drop food in the kitchen. I have a big, shedding dog. Chickens that occasionally figure out the doggie door. Lots of mulch, mud and dirt that gets tracked in by everything w a heartbeat, and you know, general mess. I blame the ADHD. Here's the thing... I don't say this with judgement.",robot vacuums
"Long term longevity results Robot Vac & Mop results: Roborock, Eufy, Ecovacs Dreame","Long term longevity results Robot Vac & Mop results: Roborock, Eufy, Ecovacs Dreame","A little less than 2 years ago I decided to jump on the robot vac & mop train and upgrade all the vac only Roombas & mop only Braavas in the house.  I didn't know which brands to buy so I bought one of each at the time.  Roborock, Eufy & Ecovacs and a bit later a Dreame.  They are all the same design with the 2 spinning mops on the bottom.",robot vacuums
"Eufy, Roborock, or Dreame in the UK?","Eufy, Roborock, or Dreame in the UK?","Hi all, I am in the market for a robot vacuum and mop, and I admit that I am lost.",robot vacuums
Pull the trigger on a Costco Dreame Govac 508 for $499?,Pull the trigger on a Costco Dreame Govac 508 for $499?,"Looks like a solid choice? Lots of features. Reaching arms, hot wash and air dry, camera & lidar. Any need to avoid this model?I only have 1 room that has a 5x7 area rug. The rest is various solid flooring. Kids, a corgi & 2 poodly dogs, cats. I would run daily.",robot vacuums
"At this point, the countless options are causing me to not buy anything","At this point, the countless options are causing me to not buy anything","We got a Roborock in 2020, and loved it until dog poop ruined it two years ago. I cleaned it all out, but it just wasn't the same. I bought a Sebo bag vacuum, and while it's awesome, I miss the hands off approach of a robot vacuum to do daily work. But back in 2020, Roborock seemed like the hands down winner. Now, oh boy. I've spent hours trying to figure out which one to buy. This is a lot of money to spend, and I don't want buyers remorse. All these terms-flexiarm, flexibrush, duodivide, duo rollers, hot mopping. My head is spinning",robot vacuums
You never think it will happen to you 💩,You never think it will happen to you 💩,It happened.,robot vacuums
What's the most overrated robot vacuum feature that manufacturers keep pushing?,What's the most overrated robot vacuum feature that manufacturers keep pushing?,"Every new robot vacuum seems to introduce a ""disruptive"" feature—better obstacle-crossing ability, higher mopping temperature, AI cameras, robotic arms… every brand is vying to showcase new features. But honestly, many of these features feel more like ""icing on the cake"" than ""essential."" The more robots I test, the more I realize I care less about the fancy features and more about the ones that quietly make cleaning easier each time.",robot vacuums
What would you buy?,What would you buy?,"I'm replacing an older robot vacuum that's starting to show its age, and I'm trying to keep the budget around $500.",robot vacuums
Initial thoughts on a Roborock Qrevo Edge 2,Initial thoughts on a Roborock Qrevo Edge 2,"First off, these robot vacuums are the most confusing things in the entire world to buy. I spent a ton of hours looking through reddit, youtube, etc. I looked at all the brands/models and finally decided on the Roborock Qrevo Edge 2 based on a few positive reviews and I just had to be done with the research part of the process before I lost my mind.",robot vacuums
"Put a splash of bleach in the dirty water tank, game changer!","Put a splash of bleach in the dirty water tank, game changer!","I recently started putting a small splash of bleach in the dirty water tank every time I empty it and it’s totally a game changer, no more smelly stinky water and bacteria/gunk buildup on the inside. The water is still dark but smells like chlorine instead of sewage. It also doesn’t leave any residue behind.",robot vacuums
Roller mops vs spinning mops,Roller mops vs spinning mops,In general: Which will give a better clean around furniture and table and chair legs? I have kids and pets.,robot vacuums
Real talk. High end robovac worth it?,Real talk. High end robovac worth it?,"everyone's got different needs I get that, but for us yeah it made sense. I used to think all the mid-range stuff was basically the same. my old one had okay basic cleaning but the second it hit carpet or corners it just couldn't handle it. sometimes it would literally shake side to side before backing off from obstacles. then i upgraded to the x60 and realized that's not how this works at all.",robot vacuums
S8 MaxV ultra R&D in 2026,S8 MaxV ultra R&D in 2026,I am slowly looking for robot vacuum that can be connected to mains.My main contender is Roborock saros 20 r&d but it is quite expensive. As an alternative I am considering used S8 MaxV ultra r&d until newer constructions gets cheaper.,robot vacuums
ISO Drag name for RoboVac,ISO Drag name for RoboVac,"We just got a new robo vacuum and I'd love to give it a Draggy / clever name. Our previous ones were called Dusty and Meryl Sweeps.. we're not opposed to a vulgar name (current place holder is ""It won't suck itself"") but I'd rather go clever. It's a ""dreame"" if that helps.",robot vacuums
Are there any reviews for Xiaomi H50?,Are there any reviews for Xiaomi H50?,"It feels like to me this product is really similar to X20 Pro, not even sure about whats different.",robot vacuums
Best robotic vacuum mop combo?,Best robotic vacuum mop combo?,"Im looking for something with a self cleaning roller for the mop part. I have pets and kids, so pad options just seem like more work to me and not worth it. Also would like for it to self empty the mop and vacuum part. I know the eufy s1 pro is reccomended a lot but its not on market anymore. What do yall like best?",robot vacuums
Eufy C28 mopping performance disappointing / inconsistent?,Eufy C28 mopping performance disappointing / inconsistent?,"I have no been running the Eufy C28 for about a month. Its my first Robovac and i am not sure what to expect here and if my expectations were too high. Since its a roller mop, i expected a lot from the mopping specifically and it was one of the reasons, i bought the eufy in the first place.",robot vacuums
Dreame Matrix10 Ultra worth it for 899€ sold by Amazon Spain?,Dreame Matrix10 Ultra worth it for 899€ sold by Amazon Spain?,For comparison:,robot vacuums
"The ""Fan Error"" Trap: Disassembled my Xiaomi E5 (C108) only to find a $15 proprietary part locked behind industrial supply chains. Anyone know where to buy just ONE BL2010F-026?","The ""Fan Error"" Trap: Disassembled my Xiaomi E5 (C108) only to find a $15 proprietary part locked behind industrial supply chains. Anyone know where to buy just ONE BL2010F-026?","Hey guys,",robot vacuums
"TriCut brush constantly giving ""brushrolll wrapped"" error on Mova P10","TriCut brush constantly giving ""brushrolll wrapped"" error on Mova P10","I ordered the TriCut brush for my Mova P10 Pro but the vacuum pauses once or twice in every room due to ""main brush wrapped"" error. When I pull the brushroll off, there's little to no hair wrapped around the roll itself & the side bearings, but when I spin the small piece sticking out of the brush bearing it will spin freely for a few turns and then suddenly have a lot of resistance. When I use the brush roll that the vacuum came with, this does not happen.",robot vacuums
Dreame Reliability?,Dreame Reliability?,"In 2023 I bought my first Dreame off Amazon: L20 Ultra. After 10 months of use, it started losing the mop pads. Received a refund & went for a L40.Defective again after 11 months. Took the refund and got a X50. After 12 months …. defective again. This time I decided to go for a cheaper model and ordered the L40 Ultra A for 299€. Now 2 weeks later, defective again. WTH is wrong with the quality of this brand?!",robot vacuums
What's the worst mess your robot vacuum has ever had to clean?,What's the worst mess your robot vacuum has ever had to clean?,"A few friends came over yesterday to watch football. By the time everyone left, there were chip crumbs around the couch, footprints by the entry, and someone had spilled soda without noticing. My ecovacs T90 Pro had arrived just two days before, so this ended up being its first real test.",robot vacuums
Life with a toddler finally convinced me to get a robot vacuum,Life with a toddler finally convinced me to get a robot vacuum,"Spent a while comparing robots from eufy and ecovacs before Prime Day. Once the discounts went live, I pulled the trigger on the X12. I figured if I was replacing my old robot, I might as well buy something I'd be happy using for the next few years.",robot vacuums
What is the best robot vacuum & mop in 2026 – is a flagship actually worth it?,What is the best robot vacuum & mop in 2026 – is a flagship actually worth it?,"Hey,",robot vacuums
Upgrade from Q8 Max+,Upgrade from Q8 Max+,Just took my Q8 Max+ for warranty (which its somehow out of warranty after 1 year) since of sensor issues (mop mount removed installed error) and it kept me thinking how many great ones are out there for similiar price,robot vacuums
"Insects, bugs and pests- Have these robots helped create a hostile environment for them?","Insects, bugs and pests- Have these robots helped create a hostile environment for them?","My parents house is very cluttered and my room well I nest very hard so I like keeping a bunch of stuff as long as the floors as clear for the robot, but clutter makes a nice home for bugs.",robot vacuums
JONR P20 Pro issue,JONR P20 Pro issue,"Hello, I just realized under cleaning that the brush holder was broken in the end where the brush is fixed and rotating.",robot vacuums
Robo vac - help for large household,Robo vac - help for large household,"Have a robot vac and it's fantastic, however often gets jammed with a shoelace, phone cord etc.  I have it set to daily auto clean.",robot vacuums
It is time,It is time,I think it's finally time for me to accept defeat.,robot vacuums
Overwhelmed and at a loss.,Overwhelmed and at a loss.,"I can't recall the last time I had to spend so much time researching, to end up nowhere.",robot vacuums
Getting stuck under radiator,Getting stuck under radiator,"Hi all! I just moved out of my parents house and as a housewarming gift my mom got me a Lefant robot vacuum! I set it up yesterday and scheduled a run for 7 am today. At 7:33 I get a notification that it’s stuck somewhere. I was at work and no one else was home, so when I get home I found it stuck underneath the radiator in the living room. I probably should’ve let it run first with me in the house but I just didn’t think much of it. How do I prevent it from doing this? I’ve never lived with radiators before. Thanks in advance!",robot vacuums
Need a quiet robot vacuum for daily maintenance cleaning,Need a quiet robot vacuum for daily maintenance cleaning,"Okay WFH life has me staring at my floors way too much lately. Hair and dust everywhere and I'm just over vacuuming every few days. So looking at robot vac now, just need something for basic daytoday upkeep.",robot vacuums
Cheap option v- Vacuum and Mop,Cheap option v- Vacuum and Mop,"Hello, I'm looking to buy a cheap option for a mop and vacuum robot. I'm a university student and am moving into my new apartment, which is quite small. I would love to have a robot that cleans while I'm in class. I would likely say nothing over 300$.",robot vacuums
