absolute,block,md,topic
Which robotvacuum you suggest?,Which robotvacuum you suggest?,"I do not really want to spend a lot on this (max ~500 EUR), but want a model that is a safe pick, gets the job done, and has preplaceable parts I can purchase online. European market (Hungary) available models I'm thinking about, with price ranges (different sellers):",robot vacuums
Cat Allergy Recommendations for first time vacuum,Cat Allergy Recommendations for first time vacuum,"I purchased a Roborock Q10 S5+ on sale ($280) as it fits within my budget and I’ve seen good reviews, but now I’m second guessing. It hasn’t come in the mail yet so I haven’t even tested it but I see some sales currently on other vacuums so I want to do it right the first time. I’d like to spend less than $600 if possible but also want to ensure I get something effective in cleaning.",robot vacuums
Dreame L40 Ultra AE vs MOVA P50 Pro Ultra – Which would you buy?,Dreame L40 Ultra AE vs MOVA P50 Pro Ultra – Which would you buy?,My home is:,robot vacuums
What matters most for a robot vacuum in a pet home?,What matters most for a robot vacuum in a pet home?,"The floor doesn’t get crazy dirty, but there’s always something. Hair ends up under the sofa, dust collects under the bed, and after walks there are usually paw marks near the door. Sometimes he brings in little bits of grass or dirt too, and I usually only notice the mess under low furniture when the hair has already clumped up.",robot vacuums
Eufy E25 leaving chunks of fuzz behind (vacuum motor dying?),Eufy E25 leaving chunks of fuzz behind (vacuum motor dying?),"E25 is about 8 months old, and one day it started leaving substantial chunks of fuzz (pet hair) behind on all hardwood-floor areas. Replaced all the accessories just in case something had worn down (brush rollers, filter, etc) and cleaned it out really good (I also do regular cleaning of all areas, so it wasn't very dirty to begin with, ruling that out as a major issue).",robot vacuums
MOVA P50 Pro Ultra vs. Eufy E25?,MOVA P50 Pro Ultra vs. Eufy E25?,"Could someone help me decide between these two models? Both are discounted at 599€ where I live at the moment. Another option could also be the Eufy C28 at 499€, would that be a good deal?",robot vacuums
Best Costco purchase for mopping tile,Best Costco purchase for mopping tile,"I have a large tile area to clean, 2 Labrador retrievers, 1 teen and an 8 year old. I have some carpet, but I plan to get it replaced with LVP soon. I care about mopping the most. What is the best robot for mopping under $900 at Costco? I have been wanting one for months now and decided now is the time.",robot vacuums
"For a first robot vacuum, go mid-range or jump straight to a flagship?","For a first robot vacuum, go mid-range or jump straight to a flagship?","I've been looking into some flagship models like the Ecovacs X12, but there are also a few mid-range options, like Narwal Freo Z10, that seem capable for a lot less money.",robot vacuums
"A Korean review of LG RONi, LG’s newest robot vacuum with steam mopping","A Korean review of LG RONi, LG’s newest robot vacuum with steam mopping","Korean companies are now using wattage instead of pascals for marketing. The mopping pressure looks pretty low compared to other models, and the ‘smart cleaning mode’ doesn’t let it lift its main and side brushes. It looks like it’s made by Picea.",robot vacuums
PSA: Samsung’s claims of End-to-End encryption (E2EE) on its Bespoke AI Steam Ultra robot vacuum are misleading at best.,PSA: Samsung’s claims of End-to-End encryption (E2EE) on its Bespoke AI Steam Ultra robot vacuum are misleading at best.,"The majority of also stress their “Knox Matrix” security systems in nationalistic undertones, even as the majority of consumers, namely younger consumers, have because of their better quality and cost efficiency compared to domestic offerings.",robot vacuums
Bona Wood floor Cleaner for Mopping Robots,Bona Wood floor Cleaner for Mopping Robots,Anyone have experience with this stuff? Or what has been your experience with the Mova solution?,robot vacuums
Ecovacs T90 dust bag,Ecovacs T90 dust bag,"I'm a new Ecovacs T90 Omni Pro owner. My robot is already asking me to replace the dust bag, but when I checked, it looked pretty empty. I'm hesitant to replace it because it feels like a waste. I'm wondering if this could be another false positive since the station has already falsely claimed twice that the detergent tank was empty when it wasn't. I guess it's based on a counter rather than ""measuring"" if the bag is full.",robot vacuums
Eufy s1 pro vs saros 20 complete (vs?),Eufy s1 pro vs saros 20 complete (vs?),Any recommendation?I want only roborock btw.,robot vacuums
"Narwal India ₹1.6 Lakh Freo Service Nightmare, 45 Days Without My Device, & The Hypocrisy of Their ""Company Policy""","Narwal India ₹1.6 Lakh Freo Service Nightmare, 45 Days Without My Device, & The Hypocrisy of Their ""Company Policy""",Narwal India's,robot vacuums
Normal for robot vacuums to be slighlty warm when IDLE/not charging?,Normal for robot vacuums to be slighlty warm when IDLE/not charging?,Is this normal or no?,robot vacuums
"Can get a robot vacuum from work, have two choices...","Can get a robot vacuum from work, have two choices...",There is also a shark but my current shark has been nothing but problems and their customer service sucks so I am avoiding that one.,robot vacuums
T90 pro omni- keep it or return it,T90 pro omni- keep it or return it,"Lastly for the ones who use and test lots of robovacs, how would you rate this if you have used and what is your favourite any why?",robot vacuums
Narwal Freo Z10 Ultra and Pro Reviews?,Narwal Freo Z10 Ultra and Pro Reviews?,"Since it's costco, the return of one or both will be easy, but I'm curious how many people here are using one of them and happy with the purchase?",robot vacuums
Shark IQ can never find its dock,Shark IQ can never find its dock,"That was about 2-3 weeks ago. It runs every day, and for the most part it does everything perfectly. Avoids the No-Go zones, if I want it to do another room again I can use the Shark app and it navigates to that room without issue, everything. Except this past week, every time it starts to return to the dock, it gets lost and eventually stops in a random room. Then I get a notification of Error 23. It still vacuums every room and navigates just fine, it’s literally just on the return to the dock at the end of the cycle.",robot vacuums
Mova V50 Ultra and P10 Pro,Mova V50 Ultra and P10 Pro,"These would be my 3rd & 4th robot vacuums.  The first was an early generation Roomba that failed to impress, and the next was a Shark that perpetually needed attention or saving from situations of it's own creation.  Neither did more than vacuum.",robot vacuums
Shark EZ RV912S Flashing Red Battery 3 Times on Dock: New Battery Didn't Fix It,Shark EZ RV912S Flashing Red Battery 3 Times on Dock: New Battery Didn't Fix It,Background:,robot vacuums
Consiglio robot lavapavimenti per marmo,Consiglio robot lavapavimenti per marmo,"Avendo una scrivania con ciabatte, prese e cavi sottostanti avrei bisogno di evitare che il robot passi li sotto. Quali funzionano meglio con le zone rosse?",robot vacuums
I’m sick of trying to find reviews that are not sponsored. Please help me choose between these 3,I’m sick of trying to find reviews that are not sponsored. Please help me choose between these 3,Which would be best for me:Dreame L60 Ultra PEEcovacs T90 Pro OmniNarwal Flow 2,robot vacuums
Dockless Room/Multi-level Mapping limitations,Dockless Room/Multi-level Mapping limitations,"My house has several split levels, so each step creates what is effectively another floor. hit the four-map limit really quickly, and sometimes I just want to carry the robot into an unmapped room and just run a quick vacuum or mop. The problem is when it’s mopping and tries to wash the mop mid-clean, I carry it back to the dock, it washes, then it automatically undocks and tries to resume as if the dock is in that room. That ends up messing up the map.",robot vacuums
Too many robot vacuum brands... which one should I go for?,Too many robot vacuum brands... which one should I go for?,I'm not trying to squeeze the most performance out of every dollar. I'd rather pay a bit more for something that holds up and has decent support if anything goes wrong.,robot vacuums
Should I really avoid tap water in my robot vacuum?,Should I really avoid tap water in my robot vacuum?,I see many people that recommend using tap water and periodically doing a rinse using citric acid to remove limescale buildup.,robot vacuums
"Struggling to Decide with Flagships - Dreame X60 Max Ultra, Roborock Saros 20, and Mova V50","Struggling to Decide with Flagships - Dreame X60 Max Ultra, Roborock Saros 20, and Mova V50","Justadad says in many that a Mova V50 is great, especially for the price. But then says Saros 20 is better but at twice the price. He says it doesn't clean twice as well as the V50. So get the V50. I don't mind spending twice as much for a 25% increase in cleaning. It doesn't have to scale up equally in price and cleaning ability.",robot vacuums
Robot vacuum/mop for hardwood parquet + old dog that dribbles urine — recommendations?,Robot vacuum/mop for hardwood parquet + old dog that dribbles urine — recommendations?,Context:,robot vacuums
2 vacuums for 1 house,2 vacuums for 1 house,"Its rather big (2 floors, totaling 400m2/4 300ft2) and my first idea was to buy one robot and let it handle entry level at night and then carry it to the top floor for the day.",robot vacuums
Got a pool robot for the waterline feature. The AI debris detection surprised me.,Got a pool robot for the waterline feature. The AI debris detection surprised me.,My old robot would miss stuff and spend half its time cleaning areas that were already fine. The v3 seems to move on once an area is clean and goes looking for the problem spots. Watched it head straight over to a pile of leaves by the steps the other day.,robot vacuums
Robot vacuum/mop for hardwood parquet + old dog that dribbles urine — recommendations?,Robot vacuum/mop for hardwood parquet + old dog that dribbles urine — recommendations?,Context:,robot vacuums
Buying advice Eufy OMNI C28 or roborock Qrevo Edge 2?,Buying advice Eufy OMNI C28 or roborock Qrevo Edge 2?,There is an offer on Amazon for the roborock Qrevo Edge 2 at £549.99 should I cancel my Eufy OmniC28 order and spend the £120 more for the Edge 2?,robot vacuums
"Relatively New 705 Combo Owner, Disappointing Customer Service","Relatively New 705 Combo Owner, Disappointing Customer Service","However, despite trying many times to get a hold of anyone from iRobot, using the Chat bot, phoning the number provided, I haven't been able to get through to anyone to get this resolved.",robot vacuums
Help with Robot Vac not able to get onto rug,Help with Robot Vac not able to get onto rug,"My roomba works great all these years transitioning from hard floor to rugs. Suddenly, with rug mats added under the rugs, roomba isn’t able to get onto the rug anymore. It’s literally less than an inch high off the floor, so I’m wondering what gives.",robot vacuums
F25 Ultra Hot Wash Mode,F25 Ultra Hot Wash Mode,It doesn't give proper information about using the Hot Wash Mode.,robot vacuums
Banned,Banned,"I was happy to see recently that a Classic app update popped, only to be disappointed.  The update broke the app’s ability to detect WiFi on the device the app is installed on.  Although that was fixed relatively quickly, the end result did not fix my c181 errors.",robot vacuums
Which Roborock Prime Deal is the best?,Which Roborock Prime Deal is the best?,Buying my first robovac and don't mind splurging if it is actually worth it. This is solely for wood floors for Vac and Mop.,robot vacuums
Are you keeping your prime day robot vacuum or returning it?,Are you keeping your prime day robot vacuum or returning it?,"I was ready to return it if it felt like more trouble than it was worth, but after a few runs, I decided to keep it.",robot vacuums
Which to get?,Which to get?,Any reccomendations within my budget? Thanks!,robot vacuums
Just upgrade from Ecovacs X2 to X12,Just upgrade from Ecovacs X2 to X12,"Besides, the roller mop has probably been the other standout upgrade. Compared to the rotating mops on the x2, x12 feels much better at dealing with sticky messes. One feature I'm using a lot is the pre-treatment mode. If my dog tracks muddy paw prints on the floors or someone spills something sticky like yogurt or barbecue sauce, I can mark that area in the app and have the robot spray it first before scrubbing it. Those kinda messes take less effort than they did with my x2.",robot vacuums
Which robot vacuum has the best battery life?,Which robot vacuum has the best battery life?,"I'm looking for something with better battery life, or at least much faster charging so it doesn't spend half the day on the dock. What are people with larger homes using these days?",robot vacuums
The old dilemma!,The old dilemma!,"From what I’ve read, the Dreame may be better at mopping the floors, but maintenance on the station is worse than the Roborock?",robot vacuums
My cat finally stopped hiding from the robot vacuum,My cat finally stopped hiding from the robot vacuum,"She's a lot better now, but it definitely reminded me that not every pet is going to ignore a robot vacuum on day one.",robot vacuums
The Case Against Getting a Robovac - here's who shouldn't get one (IMO),The Case Against Getting a Robovac - here's who shouldn't get one (IMO),"The problem is this: there are no robots that can really handle the households that need robots the most. I frequently get asked questions like, ""I have 4 dogs and 6 cats and 3 rowdy kids. What robot? I have cats that scatter little and occasionally puke or small dogs that poop in the house. What robot? I have lots of clutter on the floor and cords everywhere. What robot?",robot vacuums
"Long term longevity results Robot Vac & Mop results: Roborock, Eufy, Ecovacs Dreame","Long term longevity results Robot Vac & Mop results: Roborock, Eufy, Ecovacs Dreame","Second one that failed was the Ecovacs Deebot t30S.  For some reason it thinks the bumper is stuck (it isn't). Doesn't work at all since it thinks it's bumped into something.  I looked and cleaned around the bumpers, and still does the same thing. I'm handy so taking it apart doesn't seem scary but no idea what to look for.  It's out of warranty of course, so it's my problem now.",robot vacuums
"Eufy, Roborock, or Dreame in the UK?","Eufy, Roborock, or Dreame in the UK?","Being in the UK, I also do not have access to most Costco vacuums that people suggest. I have also seen other people swear by Roborock and Dreame, and others damning these companies.",robot vacuums
"At this point, the countless options are causing me to not buy anything","At this point, the countless options are causing me to not buy anything",I want to pull the trigger asap. Any help you can provide is appreciated.,robot vacuums
You never think it will happen to you 💩,You never think it will happen to you 💩,It could have been worse but it also could have been much better had it just NOT.,robot vacuums
What's the most overrated robot vacuum feature that manufacturers keep pushing?,What's the most overrated robot vacuum feature that manufacturers keep pushing?,"This makes me think… If a robot vacuum lacks a feature you consider essential, would you not buy it? Conversely, what do you think are the most exaggerated ""innovative"" features that manufacturers advertise?",robot vacuums
What would you buy?,What would you buy?,"So far I've mainly been looking at the Eufy C28 and the Yeedi M16 since they're both around my budget, but it's hard to tell how much the specs actually translate into day to day use. Every review seems to recommend something different.",robot vacuums
Initial thoughts on a Roborock Qrevo Edge 2,Initial thoughts on a Roborock Qrevo Edge 2,"I did a full vacuuming & mop cleaning and when all was said and done, I think it did a great job. Not the the level of a cleaning crew and it didn't really pickup the cat hair, it left it in bunches that were almost woven together from the spinning of the vacuum. I'd have liked it to pick up the cat hair, but it was easy enough for me to grab it.",robot vacuums
"Put a splash of bleach in the dirty water tank, game changer!","Put a splash of bleach in the dirty water tank, game changer!","Also there’s no worries of it damaging anything in your machine because the bleach doesn’t actually go through any plumbing, it just stays at the bottom of the dirty water tank until you empty it.",robot vacuums
Real talk. High end robovac worth it?,Real talk. High end robovac worth it?,"we have 4 rooms, mostly hardwood floors, with tile in the kitchen and bathrooms. there’s a large area rug in the living room and another rug in my home office. the layout isn’t huge, but there are a lot of corners and edges, so if the robot misses those spots, the hair builds up pretty fast.",robot vacuums
Are there any reviews for Xiaomi H50?,Are there any reviews for Xiaomi H50?,Is there anyone who actually purchased it?,robot vacuums
Eufy C28 mopping performance disappointing / inconsistent?,Eufy C28 mopping performance disappointing / inconsistent?,After a couple of weeks i have now noticed a couple of things:,robot vacuums
Dreame Matrix10 Ultra worth it for 899€ sold by Amazon Spain?,Dreame Matrix10 Ultra worth it for 899€ sold by Amazon Spain?,the L40s Pro Ultra 549€,robot vacuums
"The ""Fan Error"" Trap: Disassembled my Xiaomi E5 (C108) only to find a $15 proprietary part locked behind industrial supply chains. Anyone know where to buy just ONE BL2010F-026?","The ""Fan Error"" Trap: Disassembled my Xiaomi E5 (C108) only to find a $15 proprietary part locked behind industrial supply chains. Anyone know where to buy just ONE BL2010F-026?","Instead of just throwing it into a landfill and buying another one, I decided to fix it myself.",robot vacuums
What's the worst mess your robot vacuum has ever had to clean?,What's the worst mess your robot vacuum has ever had to clean?,Just curious what's the worst mess your robot has had to deal with? how it handled it?,robot vacuums
Life with a toddler finally convinced me to get a robot vacuum,Life with a toddler finally convinced me to get a robot vacuum,So far it feels like I made the right call. I'll keep using it for a while and come back with an update once I've had more time with it.,robot vacuums
What is the best robot vacuum & mop in 2026 – is a flagship actually worth it?,What is the best robot vacuum & mop in 2026 – is a flagship actually worth it?,"~80 m² (860 sq ft)Mix of hardwood, vinyl, tile, and a few area rugsI live alone (no pets at the moment, but I may get a cat in the future)The apartment is generally kept pretty clean",robot vacuums
Upgrade from Q8 Max+,Upgrade from Q8 Max+,Is there any must buy mop mount that's better than Roborock Q8 Max+? It seems it does its job for 50m2/538 square feet apartments.,robot vacuums
"Insects, bugs and pests- Have these robots helped create a hostile environment for them?","Insects, bugs and pests- Have these robots helped create a hostile environment for them?","I have to replace my robot soon because it's falling apart so I'm hoping the new one will have more powerful suction to nab up ants, wandering spiders and earwigs.",robot vacuums
Robo vac - help for large household,Robo vac - help for large household,"I do a whip around the house to pick up things before I go to work, however I leave before the older kids.",robot vacuums
It is time,It is time,I'm ready to go all-in on a robot vacuum that will give me the help I desperately need!,robot vacuums
Overwhelmed and at a loss.,Overwhelmed and at a loss.,How does anyone make a decision these days?,robot vacuums
Need a quiet robot vacuum for daily maintenance cleaning,Need a quiet robot vacuum for daily maintenance cleaning,Anyone used either of these and can share how it's been?,robot vacuums
Roller mop or spinning mop？,Roller mop or spinning mop？,Budget is around $600. I want something with good value for the price and reliable cleaning.,robot vacuums
Looking for a new vacuum,Looking for a new vacuum,We have 2 ragdolls and a golden so LOTS of fur.,robot vacuums
What's the best robot vacuum for elderly people with a dog?,What's the best robot vacuum for elderly people with a dog?,No strict budget. I'm fine spending more if it makes life easier for my grandma :),robot vacuums
Saugroboter Dreame l10s Ultra Gen3 vs. l40s Pro Ultra,Saugroboter Dreame l10s Ultra Gen3 vs. l40s Pro Ultra,Dreame l10s Ultra Gen3 für 380 Euro,robot vacuums
Need recommendation dor vacuum.,Need recommendation dor vacuum.,"I have 2 cats,one long and one short hair so im looking for good obstacle avoidance and pet hair.",robot vacuums
FINALLY a robot vacuum that can get into my room!,FINALLY a robot vacuum that can get into my room!,"Three weeks in, it's cleared every threshold. I finally don't have to carry it into the bathroom anymore. Only the garage step stops it, but that's fair... that's not a threshold, that's a cliff lol.",robot vacuums
Bagless robot vacuums?,Bagless robot vacuums?,Anyone have a good experience and can recommend a great bagless robot vacuum?,robot vacuums
Roborock's QRevo Edge 2 Flow as successor to the QRevo Curv 2 Flow with a retractable LIDAR to be 8.98cm tall,Roborock's QRevo Edge 2 Flow as successor to the QRevo Curv 2 Flow with a retractable LIDAR to be 8.98cm tall,I wonder how well Roborock's reversible side brush will do for corner cleaning compared to Narwal's.,robot vacuums
"Mova V50 Ultra, Pet Failure / Return...","Mova V50 Ultra, Pet Failure / Return...","Unless I'm missing something, V50 has to go back to the store.",robot vacuums
Aus Amazon - robot vacuum for mopping recommendations,Aus Amazon - robot vacuum for mopping recommendations,Function I'm looking for: good mopping as I have a baby,robot vacuums
Mova V50 can't dock properly.,Mova V50 can't dock properly.,Much appreciated.,robot vacuums
Proven reliability/durability,Proven reliability/durability,"I value reliability/durability over fancy features, even if that means getting a model that's a few years old... And would love one that isn't dependent on any cloud services (although that might be a tall ask nowadays).",robot vacuums
Help me choose!! Roborock/ Dreame/ Mova,Help me choose!! Roborock/ Dreame/ Mova,I have a baby who will start to crawl soon and toys are bound to be around. I am happy to put these away before starting the robot. Multi level would be a plus but not a deal breaker.,robot vacuums
Ecovacs T80S Omni vs Roborock Qrevo S Pro,Ecovacs T80S Omni vs Roborock Qrevo S Pro,There's a 60€ difference (in favor of the Roborock priced at 389€) and I'm not sure of the pros/cons of each.,robot vacuums
I'm trying to figure out what actually makes a robot good at cleaning floor gaps.,I'm trying to figure out what actually makes a robot good at cleaning floor gaps.,"For those of you who own robot vacuums, have you noticed the same thing or have your own theory?",robot vacuums
Narwal Freo Z10 Turbo vs Flow (1st Gen),Narwal Freo Z10 Turbo vs Flow (1st Gen),Does it make sense to keep my Freo Z10 turbo or should I return it and get the Flow?  I’m worried the flow may be more susceptible to issues over time given the rolling mop technology.,robot vacuums
Buying Advice for vacuum/mop,Buying Advice for vacuum/mop,"Fast forward and I have a new kitchen floor that's pretty but needs REGULAR cleaning. So, what are my needs?",robot vacuums
"Incredibly overwhelmed by vacuum choices... Any guidance based on my specific, limited needs?","Incredibly overwhelmed by vacuum choices... Any guidance based on my specific, limited needs?","I live in a small ish single level space (700 sq ft) with laminate flooring and tile flooring only, and the main concern is pet hair and mopping.",robot vacuums
Prime Day Australia,Prime Day Australia,"Based in Australia,Looking at dreame x40 ultra ae but don’t know how good they are.Budget max 800Dog that shed a lot",robot vacuums
The Dreame X60 Pro Ultra with an extending mop arm reaching up to 18cm to be sold as the X60 Ultra Extreme in other markets such as Taiwan,The Dreame X60 Pro Ultra with an extending mop arm reaching up to 18cm to be sold as the X60 Ultra Extreme in other markets such as Taiwan,"Taiwan also has the X60 Track, which is the successor to the Aqua 10 Track with Proactive Light, and the upgraded anti-tangle HyperStream DuoBrush front roller",robot vacuums
Tiled floor only recommendation,Tiled floor only recommendation,Flooring is all on the same level & no thresholds.,robot vacuums
Did my Dreame Vac sabotage my Roborock??,Did my Dreame Vac sabotage my Roborock??,Did my new Dreame sabotage my old Roborock????,robot vacuums
is the MOVA E20 plus any good?,is the MOVA E20 plus any good?,"the mop is gravity-fed, but that doesn't seem like that big of a deal",robot vacuums
Problem on Xiaomi X20+,Problem on Xiaomi X20+,thank you all!,robot vacuums
Mova V50 wada nawigacji.,Mova V50 wada nawigacji.,"This situation perfectly illustrates how companies pass the buck at the customer’s expense, hoping you will simply give up.",robot vacuums
Which robotvacuum you suggest?,Which robotvacuum you suggest?,Xiaomi X20+ (340-400 EUR)Xiaomi X20 Max EU (440-480 EUR)Xiaomi H50 Pro EU (450-510 EUR)Xiaomi Robot Vacuum 5 (450-510 EUR),robot vacuums
Cat Allergy Recommendations for first time vacuum,Cat Allergy Recommendations for first time vacuum,I’ve had my eye on some of the sales on Costco lately and want to understand what the differences are and what would be best recommended for this? Any and all recommendations are welcome,robot vacuums
