"button href","button","absolute href","absolute","flex href","h-full src","whitespace-nowrap","inline-block","whitespace-nowrap 2","block","hover:no-underline href","md","md 2","md 3","overflow-hidden href","block 2","flex","md 4","md 5"
"https://www.reddit.com/submit?source_id=t3_1upu0ru&composer_entry=crosspost_post_action_bar","Repost","https://www.reddit.com/r/RobotVacuums/comments/1upu0ru/which_robotvacuum_you_suggest/","Which robotvacuum you suggest?","https://www.reddit.com/user/Awkward_Pineapple877/","https://styles.redditmedia.com/t5_2uelfc/styles/profileIcon_pnhu7dam9vde1.jpeg?width=64&height=64&frame=1&auto=webp&crop=64%3A64%2Csmart&s=d01ce95a5fbf05f9ec0b664a1e0c7a150d320f35","u/Awkward_Pineapple877","•","9 days ago","Which robotvacuum you suggest?","https://www.reddit.com/r/RobotVacuums/comments/1upu0ru/which_robotvacuum_you_suggest/","63 m2 area with a kitchen, 4 rooms and a hallway, no need for it to climb, floor tile (water-resistant) and laminate floor (not water-resistant), no carpet, long hair gf but no animal, lots of dust (daily vacuuming needed), would be good to have mop with clean water to run through (low water amount preferred) at least 1-2 times per week, a model with a station would be preferred.","I do not really want to spend a lot on this (max ~500 EUR), but want a model that is a safe pick, gets the job done, and has preplaceable parts I can purchase online. European market (Hungary) available models I'm thinking about, with price ranges (different sellers):","Xiaomi X20+ (340-400 EUR)Xiaomi X20 Max EU (440-480 EUR)Xiaomi H50 Pro EU (450-510 EUR)Xiaomi Robot Vacuum 5 (450-510 EUR)","","","","Dreame D20 Ultra (330-350 EUR)Dreame L40 Ultra AE (480-560 EUR)Dreame L50 Pro Ultra (690-870 EUR)Dreame X50 Ultra Complete (850-1160 EUR)","Roborock Q10 VF+ (360-450 EUR)Roborock Qrevo 798 (400-440 EUR)Roborock Qrevo Plus (570-590 EUR)"
"https://www.reddit.com/submit?source_id=t3_1upvhko&composer_entry=crosspost_post_action_bar","Repost","https://www.reddit.com/r/RobotVacuums/comments/1upvhko/cat_allergy_recommendations_for_first_time_vacuum/","Cat Allergy Recommendations for first time vacuum","https://www.reddit.com/user/throwaway3015845/","https://www.redditstatic.com/avatars/defaults/v2/avatar_default_3.png","u/throwaway3015845","•","9 days ago","Cat Allergy Recommendations for first time vacuum","https://www.reddit.com/r/RobotVacuums/comments/1upvhko/cat_allergy_recommendations_for_first_time_vacuum/","Hi Y’all! I’m looking into getting a robot vacuum to do daily cleaning of any cat hair & pet dander. Looking to move in with someone that has two cats & routine cleaning seems extremely beneficial for my allergies, so a robot can simplify that between deeper cleans.","I purchased a Roborock Q10 S5+ on sale ($280) as it fits within my budget and I’ve seen good reviews, but now I’m second guessing. It hasn’t come in the mail yet so I haven’t even tested it but I see some sales currently on other vacuums so I want to do it right the first time. I’d like to spend less than $600 if possible but also want to ensure I get something effective in cleaning.","I’ve had my eye on some of the sales on Costco lately and want to understand what the differences are and what would be best recommended for this? Any and all recommendations are welcome","","","","This would be an 2 bedroom 1000 sq foot apartment mostly hard wood with some area rugs & carpet in bedrooms.","Other options I’m looking at- Roborock QX Revo - $400 at costco- Roborock QX Revo Arc - $650 at costco- Roborock QX Revo Plus - $600 at costco- Dreame GoVac 508 - $500 at costco- Dreame GoVac 400 - $350 at Costco- iRobot Roomba Plus 507 - $400 at Costco- Shark Powerdetect 2 in 1 - $450 at Costco- Narwal Freo Z10 - $520 at Costco- Mova P10 Pro Ultra - $350 on amazon- Mova P10 Pro Ultra Gen 2 - $450 on Amazon"
"https://www.reddit.com/submit?source_id=t3_1uprbee&composer_entry=crosspost_post_action_bar","Repost","https://www.reddit.com/r/RobotVacuums/comments/1uprbee/roborock_s5v_not_vacuuming_efficiently/","Roborock s5v not vacuuming efficiently","https://www.reddit.com/user/Foreign_Penalty_6049/","https://www.redditstatic.com/avatars/defaults/v2/avatar_default_6.png","u/Foreign_Penalty_6049","•","9 days ago","Roborock s5v not vacuuming efficiently","","","","","","SML.load([""32D6UNXHci"",""7KgY-4t-bj"",""9l9CnJPXUX"",""Apklb-ulLM"",""B_NHAZUdqW"",""B65d8mZ9dk"",""BaeKfoZWFu"",""BbEbdxSSWP"",""BBVFbL9gTt"",""BDqLQYUXb2"",""BE_eRNLHde"",""BE3KWFvAgd"",""Bfk76jCzva"",""BgzRPq9TrY"",""BHxHI-jiY8"",""BL4AFWChm2"",""BqCxBJyWKP"",""BRR-WcxRPu"",""BT-RK55BKV"",""Bt9bCnZeE4"",""Btbd1Rlzrj"",""BVFvNgoGa3"",""BZ2_qUMvze"",""C5V-G3dhmR"",""C60kHV2aLi"",""C6i1azzdWJ"",""CB_reylV_c"",""CbhpgNHVKi"",""CbNqmNJ9ZB"",""CEvq12cbO2"",""Cf72vh6LG6"",""CJTuHLD6HH"",""CRpMPywSwN"",""CrXP_t2buz"",""CU1eEyKYo6"",""CWCOAGnsuZ"",""CWuClRIAPb"",""Cxj4rYqYlV"",""CymvsgY07C"",""CyodcBLUBi"",""D-tOoTkopZ"",""D0Pq5ES-zJ"",""D3zOLvL8jV"",""D7x3TCAE9T"",""D8aHHRjuby"",""D9DtoVVF6i"",""D9gjqLbbjQ"",""DA2r4_1OU1"",""Dag00w-zJ8"",""DAWbe3IpMr"",""Dba5_HGJbL"",""DbY_c8hZXg"",""De-r6IzqJA"",""DHMPn_y_v9"",""DhS9dAZhjq"",""DHzHlOJRFF"",""DIxBJjJd_K"",""Dl3s0VKard"",""DLF_4_tUTe"",""Dm3xL5MQs7"",""DMY8GyetUo"",""DnhB_hG7j0"",""DOy5NYM9Ep"",""DR8wAHG9t8"",""DrNS5yd8Ck"",""DRozBhqA5h"",""DSqCK5EWRj"",""DstzxuPuBF"",""DuMYOvD6fZ"",""DUOCnquoJh"",""HNKHNuLSLH"",""Ie5ylYRrC6"",""lXmtgL270o"",""NZ-CnbFGvr"",""rYEVoUfuLu"",""uede2U50tA"",""vivXUQq-Wz""], 'en-US/', 'auto');","","",""
"https://www.reddit.com/submit?source_id=t3_1ut2zno&composer_entry=crosspost_post_action_bar","Repost","https://www.reddit.com/r/RobotVacuums/comments/1ut2zno/dreame_l40_ultra_ae_vs_mova_p50_pro_ultra_which/","Dreame L40 Ultra AE vs MOVA P50 Pro Ultra – Which would you buy?","https://www.reddit.com/user/Christikfa/","https://www.redditstatic.com/avatars/defaults/v2/avatar_default_7.png","u/Christikfa","•","6 days ago","Dreame L40 Ultra AE vs MOVA P50 Pro Ultra – Which would you buy?","https://www.reddit.com/r/RobotVacuums/comments/1ut2zno/dreame_l40_ultra_ae_vs_mova_p50_pro_ultra_which/","I’ve narrowed my search down to these two robot vacuums and can’t decide which one to buy.","My home is:","Mostly vinyl flooring with a few rugsCarpet in the bedrooms1 Pet (minimal hair loss)Baby (Crawling)","","","","For anyone who’s owned either (or both), what has your experience been like?","Are there any common issues you’ve run into after a few months of ownership? Would you buy the same one again, or would you choose the other?"
"https://www.reddit.com/submit?source_id=t3_1u6vz7a&composer_entry=crosspost_post_action_bar","Repost","https://www.reddit.com/r/RobotVacuums/comments/1u6vz7a/my_mova_support_experience_p10_pro_ultra_gen_2/","My Mova Support Experience, P10 Pro Ultra Gen 2, and Amazon Prime Day Deals","https://www.reddit.com/user/NimecShady/","","u/NimecShady","•","1 mo. ago","My Mova Support Experience, P10 Pro Ultra Gen 2, and Amazon Prime Day Deals","","","","","[object Object]","SML.load([""32D6UNXHci"",""7KgY-4t-bj"",""9l9CnJPXUX"",""Apklb-ulLM"",""B_NHAZUdqW"",""B65d8mZ9dk"",""BaeKfoZWFu"",""BbEbdxSSWP"",""BBVFbL9gTt"",""BDqLQYUXb2"",""BE_eRNLHde"",""BE3KWFvAgd"",""Bfk76jCzva"",""BgzRPq9TrY"",""BHxHI-jiY8"",""BL4AFWChm2"",""BqCxBJyWKP"",""BRR-WcxRPu"",""BT-RK55BKV"",""Bt9bCnZeE4"",""Btbd1Rlzrj"",""BVFvNgoGa3"",""BZ2_qUMvze"",""C5V-G3dhmR"",""C60kHV2aLi"",""C6i1azzdWJ"",""CB_reylV_c"",""CbhpgNHVKi"",""CbNqmNJ9ZB"",""CEvq12cbO2"",""Cf72vh6LG6"",""CJTuHLD6HH"",""CRpMPywSwN"",""CrXP_t2buz"",""CU1eEyKYo6"",""CWCOAGnsuZ"",""CWuClRIAPb"",""Cxj4rYqYlV"",""CymvsgY07C"",""CyodcBLUBi"",""D-tOoTkopZ"",""D0Pq5ES-zJ"",""D3zOLvL8jV"",""D7x3TCAE9T"",""D8aHHRjuby"",""D9DtoVVF6i"",""D9gjqLbbjQ"",""DA2r4_1OU1"",""Dag00w-zJ8"",""DAWbe3IpMr"",""Dba5_HGJbL"",""DbY_c8hZXg"",""De-r6IzqJA"",""DHMPn_y_v9"",""DhS9dAZhjq"",""DHzHlOJRFF"",""DIxBJjJd_K"",""Dl3s0VKard"",""DLF_4_tUTe"",""Dm3xL5MQs7"",""DMY8GyetUo"",""DnhB_hG7j0"",""DOy5NYM9Ep"",""DR8wAHG9t8"",""DrNS5yd8Ck"",""DRozBhqA5h"",""DSqCK5EWRj"",""DstzxuPuBF"",""DuMYOvD6fZ"",""DUOCnquoJh"",""HNKHNuLSLH"",""Ie5ylYRrC6"",""lXmtgL270o"",""NZ-CnbFGvr"",""rYEVoUfuLu"",""uede2U50tA"",""vivXUQq-Wz""], 'en-US/', 'auto');","","",""
"https://www.reddit.com/submit?source_id=t3_1ukiiwe&composer_entry=crosspost_post_action_bar","Repost","https://www.reddit.com/r/RobotVacuums/comments/1ukiiwe/what_matters_most_for_a_robot_vacuum_in_a_pet_home/","What matters most for a robot vacuum in a pet home?","https://www.reddit.com/user/trwaters/","","u/trwaters","•","15 days ago","What matters most for a robot vacuum in a pet home?","https://www.reddit.com/r/RobotVacuums/comments/1ukiiwe/what_matters_most_for_a_robot_vacuum_in_a_pet_home/","We have a 3 year old golden retriever, so dog hair and paw prints are just part of daily life now. We’ve been cleaning by hand so far, and the space under the sofa is usually the part I don’t get to as often as I should.","The floor doesn’t get crazy dirty, but there’s always something. Hair ends up under the sofa, dust collects under the bed, and after walks there are usually paw marks near the door. Sometimes he brings in little bits of grass or dirt too, and I usually only notice the mess under low furniture when the hair has already clumped up.","I’m trying to find a robot vacuum that makes more sense for a house with a dog, so I’ve been looking at things like hot water mopping, lower height, and obstacle avoidance. I’m just not sure how much they actually matter in daily use, especially with dog toys or random things under the bed.","[object Object]","","","For people with dogs or cats, what actually made the biggest difference for you? Any recs?",""
"https://www.reddit.com/submit?source_id=t3_1upsisf&composer_entry=crosspost_post_action_bar","Repost","https://www.reddit.com/r/RobotVacuums/comments/1upsisf/eufy_e25_leaving_chunks_of_fuzz_behind_vacuum/","Eufy E25 leaving chunks of fuzz behind (vacuum motor dying?)","https://www.reddit.com/user/spengman/","https://www.redditstatic.com/avatars/defaults/v2/avatar_default_4.png","u/spengman","•","9 days ago","Eufy E25 leaving chunks of fuzz behind (vacuum motor dying?)","https://www.reddit.com/r/RobotVacuums/comments/1upsisf/eufy_e25_leaving_chunks_of_fuzz_behind_vacuum/","Mostly just curious if anyone had an experience like this (described below) with the E25? Not complaining about the customer support, since they are shipping me a replacement unit at no cost. But since I've got the old unit for awhile longer until the replacement arrives, starting to get curious if it's just totally blown or anyone had seen a similar issue and resolved it.","E25 is about 8 months old, and one day it started leaving substantial chunks of fuzz (pet hair) behind on all hardwood-floor areas. Replaced all the accessories just in case something had worn down (brush rollers, filter, etc) and cleaned it out really good (I also do regular cleaning of all areas, so it wasn't very dirty to begin with, ruling that out as a major issue).","The roller brush one side is now showing up with lots of pet hair or tangles left in it (only on one side of the two dual-rollers... other seems clean) whereas before they seemed to self-detangle almost perfectly and I never found any hair or fuzz to clean out by hand.","","","1","The vacuum hasn't totally stopped working as some debris and fuzz ends up in the bag, but I walk around each morning picking up these little chunks of fuzz it leaves behind and detangling the roller brush by hand.","My guess was maybe the roller brush motors on one or both sides are failing or (much more likely to me) the vacuum motor itself is failing and suction is just not enough to grab the debris anymore, which in turn causes the roller brushes which are otherwise working properly to eventually tangle & eject the fuzzballs simply because there is not enough suction to clear the debris from the roller assembly normally."
"https://www.reddit.com/submit?source_id=t3_1upnsn1&composer_entry=crosspost_post_action_bar","Repost","https://www.reddit.com/r/RobotVacuums/comments/1upnsn1/mova_p50_pro_ultra_vs_eufy_e25/","MOVA P50 Pro Ultra vs. Eufy E25?","https://www.reddit.com/user/Mylejandro/","https://styles.redditmedia.com/t5_dhlvu/styles/profileIcon_1btgifvptemg1.png?width=64&height=64&frame=1&auto=webp&crop=64%3A64%2Csmart&s=7d8397922ddafb5f27fca4e6ee88b2f1bc82b08f","u/Mylejandro","•","10 days ago","MOVA P50 Pro Ultra vs. Eufy E25?","https://www.reddit.com/r/RobotVacuums/comments/1upnsn1/mova_p50_pro_ultra_vs_eufy_e25/","The robovac market is a total hellscape with literally hundreds of models with almost identical names and features, not to mention the completely conflicting user reports. I’ve tried to research these for the past few days like a madman but still feel quite lost.","Could someone help me decide between these two models? Both are discounted at 599€ where I live at the moment. Another option could also be the Eufy C28 at 499€, would that be a good deal?","Use case:79m2 apartmentDogGirlfriend with long hair who sheds a lotMostly hardwood floors, maybe 20-25% carpets.","","","","",""
"https://www.reddit.com/submit?source_id=t3_1ue74hj&composer_entry=crosspost_post_action_bar","Repost","https://www.reddit.com/r/RobotVacuums/comments/1ue74hj/turns_out_my_robot_vacuum_is_quiet_enough_for/","Turns out my robot vacuum is quiet enough for work calls","https://www.reddit.com/user/formallyhuman/","","u/formallyhuman","•","23 days ago","Turns out my robot vacuum is quiet enough for work calls","https://www.reddit.com/r/RobotVacuums/comments/1ue74hj/turns_out_my_robot_vacuum_is_quiet_enough_for/","I used to mostly run my deebot robot vacuum when I wasn't actively around it but I've started working from home more lately and realized it's quieter than I expected.I've run it before, just not really while working or on calls, so I hadn't paid much attention to the noise in that context.Anyway, I'm still pretty to robot vacuums overall, and I'm slowly realizing it's more useful than I thought. Still figuring out the best way to use it everyday, but so far I'm impressed.","","","[object Object]","","","",""
"https://www.reddit.com/submit?source_id=t3_1upupjr&composer_entry=crosspost_post_action_bar","Repost","https://www.reddit.com/r/RobotVacuums/comments/1upupjr/my_shark_iq_robot_wont_connect_to_my_router/","My Shark IQ Robot won't connect to my router.","https://www.reddit.com/user/Admirl_Ossim06/","","u/Admirl_Ossim06","•","9 days ago","My Shark IQ Robot won't connect to my router.","https://www.reddit.com/r/RobotVacuums/comments/1upupjr/my_shark_iq_robot_wont_connect_to_my_router/","I just changed my router. Now my Shark won't connect. Does it have to be a secure connection? It asks for a password, but there is none. Can I get around this somehow? My real problem is that I don't know how to (or want to) set a password for my router. Or I could just push the button to start it every day.","","","[object Object]","","","",""
"","","","Advertisement: De goods zijn binnen!","","","","•","","","","","","","","","","",""
"https://www.reddit.com/submit?source_id=t3_1ux6vy8&composer_entry=crosspost_post_action_bar","Repost","https://www.reddit.com/r/RobotVacuums/comments/1ux6vy8/best_costco_purchase_for_mopping_tile/","Best Costco purchase for mopping tile","https://www.reddit.com/user/GenXMillenial/","","u/GenXMillenial","•","1 day ago","Best Costco purchase for mopping tile","https://www.reddit.com/r/RobotVacuums/comments/1ux6vy8/best_costco_purchase_for_mopping_tile/","I have scoured the posts and hesitated to post due to the many what should I buy posts here, but couldn’t get my specific questions answered.","I have a large tile area to clean, 2 Labrador retrievers, 1 teen and an 8 year old. I have some carpet, but I plan to get it replaced with LVP soon. I care about mopping the most. What is the best robot for mopping under $900 at Costco? I have been wanting one for months now and decided now is the time.","Thank you for any recommendations","[object Object]","","","",""
"https://www.reddit.com/submit?source_id=t3_1uuu8ry&composer_entry=crosspost_post_action_bar","Repost","https://www.reddit.com/r/RobotVacuums/comments/1uuu8ry/why_are_the_newer_generation_dreames_so_slow/","Why are the newer generation Dreames so slow?","https://www.reddit.com/user/EastButterscotch5144/","","u/EastButterscotch5144","•","4 days ago","Why are the newer generation Dreames so slow?","https://www.reddit.com/r/RobotVacuums/comments/1uuu8ry/why_are_the_newer_generation_dreames_so_slow/","I had an old MOVA S10 Plus a few years back, 7,000pa suction, no wash station etc, no camera for obstacle avoidance (so it sucked in that regard) but it cleaned very quickly. Fast forward today with the Dreame L50 Ultra I've had it for half a year. The suction more than doubled to 20,000pa it's a great vacuum and it does its job very well but it's just slow? It moves slowly, vacuums slowly, it's very very cautious. It's obstacle avoidance is fantastic of course it hasn't snagged a cable or pet toy during my time of owning it. But when it comes across an obstacle it'll stop, back up slowly, then slowly move around, turn it's body around to look at it, move back, move forward and repeat. Does it move slowly to avoid getting trapped on obstacles or is it something else? Because even in a room with no obstacles (carpeted) it moves slowly and yes the carpet deep clean, slower movement settings have been turned off. Not trying to complain because it is a fantastic vacuum but does anyone know why it's so slow?","","","[object Object]","","","",""
"https://www.reddit.com/submit?source_id=t3_1uptmf0&composer_entry=crosspost_post_action_bar","Repost","https://www.reddit.com/r/RobotVacuums/comments/1uptmf0/man_critically_injured_after_robotic_vacuum/","Man critically injured after robotic vacuum explodes","https://www.reddit.com/user/bitter-sweet77/","","u/bitter-sweet77","•","9 days ago","Man critically injured after robotic vacuum explodes","","","","","[object Object]","SML.load([""32D6UNXHci"",""7KgY-4t-bj"",""9l9CnJPXUX"",""Apklb-ulLM"",""B_NHAZUdqW"",""B65d8mZ9dk"",""BaeKfoZWFu"",""BbEbdxSSWP"",""BBVFbL9gTt"",""BDqLQYUXb2"",""BE_eRNLHde"",""BE3KWFvAgd"",""Bfk76jCzva"",""BgzRPq9TrY"",""BHxHI-jiY8"",""BL4AFWChm2"",""BqCxBJyWKP"",""BRR-WcxRPu"",""BT-RK55BKV"",""Bt9bCnZeE4"",""Btbd1Rlzrj"",""BVFvNgoGa3"",""BZ2_qUMvze"",""C5V-G3dhmR"",""C60kHV2aLi"",""C6i1azzdWJ"",""CB_reylV_c"",""CbhpgNHVKi"",""CbNqmNJ9ZB"",""CEvq12cbO2"",""Cf72vh6LG6"",""CJTuHLD6HH"",""CRpMPywSwN"",""CrXP_t2buz"",""CU1eEyKYo6"",""CWCOAGnsuZ"",""CWuClRIAPb"",""Cxj4rYqYlV"",""CymvsgY07C"",""CyodcBLUBi"",""D-tOoTkopZ"",""D0Pq5ES-zJ"",""D3zOLvL8jV"",""D7x3TCAE9T"",""D8aHHRjuby"",""D9DtoVVF6i"",""D9gjqLbbjQ"",""DA2r4_1OU1"",""Dag00w-zJ8"",""DAWbe3IpMr"",""Dba5_HGJbL"",""DbY_c8hZXg"",""De-r6IzqJA"",""DHMPn_y_v9"",""DhS9dAZhjq"",""DHzHlOJRFF"",""DIxBJjJd_K"",""Dl3s0VKard"",""DLF_4_tUTe"",""Dm3xL5MQs7"",""DMY8GyetUo"",""DnhB_hG7j0"",""DOy5NYM9Ep"",""DR8wAHG9t8"",""DrNS5yd8Ck"",""DRozBhqA5h"",""DSqCK5EWRj"",""DstzxuPuBF"",""DuMYOvD6fZ"",""DUOCnquoJh"",""HNKHNuLSLH"",""Ie5ylYRrC6"",""lXmtgL270o"",""NZ-CnbFGvr"",""rYEVoUfuLu"",""uede2U50tA"",""vivXUQq-Wz""], 'en-US/', 'auto');","1","",""
"https://www.reddit.com/submit?source_id=t3_1u7x2yk&composer_entry=crosspost_post_action_bar","Repost","https://www.reddit.com/r/RobotVacuums/comments/1u7x2yk/for_a_first_robot_vacuum_go_midrange_or_jump/","For a first robot vacuum, go mid-range or jump straight to a flagship?","https://www.reddit.com/user/formallyhuman/","","u/formallyhuman","•","1 mo. ago","For a first robot vacuum, go mid-range or jump straight to a flagship?","https://www.reddit.com/r/RobotVacuums/comments/1u7x2yk/for_a_first_robot_vacuum_go_midrange_or_jump/","My situation is a little complicated: we have a toddler and a cat, so there's always something on the floor. Most of the house is hardwood, but we also have a few area rugs throughout the house.","I've been looking into some flagship models like the Ecovacs X12, but there are also a few mid-range options, like Narwal Freo Z10, that seem capable for a lot less money.","The biggest messes in my house is things like food crumbs, sticky spots around the dining area, occasional spills, cat hair, and litter. At the same time, I don't want the rugs getting wet or needing a lot of manual intervention.","[object Object]","","","Is the extra money for a flagship actually worth it? Or would a good mid-range model work just fine?",""
"https://www.reddit.com/submit?source_id=t3_1upn7oe&composer_entry=crosspost_post_action_bar","Repost","https://www.reddit.com/r/RobotVacuums/comments/1upn7oe/a_korean_review_of_lg_roni_lgs_newest_robot/","A Korean review of LG RONi, LG’s newest robot vacuum with steam mopping","https://www.reddit.com/user/FarConcern2308/","https://styles.redditmedia.com/t5_b7ptdx/styles/profileIcon_lgs7jjq40l9h1.png?width=64&height=64&frame=1&auto=webp&crop=64%3A64%2Csmart&s=b6991456eb432640b4b796ff8c480c5b411726eb","u/FarConcern2308","•","10 days ago","A Korean review of LG RONi, LG’s newest robot vacuum with steam mopping","https://www.reddit.com/r/RobotVacuums/comments/1upn7oe/a_korean_review_of_lg_roni_lgs_newest_robot/","","Korean companies are now using wattage instead of pascals for marketing. The mopping pressure looks pretty low compared to other models, and the ‘smart cleaning mode’ doesn’t let it lift its main and side brushes. It looks like it’s made by Picea.","","","","","",""
"https://www.reddit.com/submit?source_id=t3_1upmvhq&composer_entry=crosspost_post_action_bar","Repost","https://www.reddit.com/r/RobotVacuums/comments/1upmvhq/intermittent_mop_spinning_dreame_l40s_ultra_ae/","intermittent mop spinning - Dreame L40S Ultra AE","https://www.reddit.com/user/Oneiros42/","https://www.redditstatic.com/avatars/defaults/v2/avatar_default_1.png","u/Oneiros42","•","10 days ago","intermittent mop spinning - Dreame L40S Ultra AE","","","","","","SML.load([""32D6UNXHci"",""7KgY-4t-bj"",""9l9CnJPXUX"",""Apklb-ulLM"",""B_NHAZUdqW"",""B65d8mZ9dk"",""BaeKfoZWFu"",""BbEbdxSSWP"",""BBVFbL9gTt"",""BDqLQYUXb2"",""BE_eRNLHde"",""BE3KWFvAgd"",""Bfk76jCzva"",""BgzRPq9TrY"",""BHxHI-jiY8"",""BL4AFWChm2"",""BqCxBJyWKP"",""BRR-WcxRPu"",""BT-RK55BKV"",""Bt9bCnZeE4"",""Btbd1Rlzrj"",""BVFvNgoGa3"",""BZ2_qUMvze"",""C5V-G3dhmR"",""C60kHV2aLi"",""C6i1azzdWJ"",""CB_reylV_c"",""CbhpgNHVKi"",""CbNqmNJ9ZB"",""CEvq12cbO2"",""Cf72vh6LG6"",""CJTuHLD6HH"",""CRpMPywSwN"",""CrXP_t2buz"",""CU1eEyKYo6"",""CWCOAGnsuZ"",""CWuClRIAPb"",""Cxj4rYqYlV"",""CymvsgY07C"",""CyodcBLUBi"",""D-tOoTkopZ"",""D0Pq5ES-zJ"",""D3zOLvL8jV"",""D7x3TCAE9T"",""D8aHHRjuby"",""D9DtoVVF6i"",""D9gjqLbbjQ"",""DA2r4_1OU1"",""Dag00w-zJ8"",""DAWbe3IpMr"",""Dba5_HGJbL"",""DbY_c8hZXg"",""De-r6IzqJA"",""DHMPn_y_v9"",""DhS9dAZhjq"",""DHzHlOJRFF"",""DIxBJjJd_K"",""Dl3s0VKard"",""DLF_4_tUTe"",""Dm3xL5MQs7"",""DMY8GyetUo"",""DnhB_hG7j0"",""DOy5NYM9Ep"",""DR8wAHG9t8"",""DrNS5yd8Ck"",""DRozBhqA5h"",""DSqCK5EWRj"",""DstzxuPuBF"",""DuMYOvD6fZ"",""DUOCnquoJh"",""HNKHNuLSLH"",""Ie5ylYRrC6"",""lXmtgL270o"",""NZ-CnbFGvr"",""rYEVoUfuLu"",""uede2U50tA"",""vivXUQq-Wz""], 'en-US/', 'auto');","1","",""
"https://www.reddit.com/submit?source_id=t3_1urqm9g&composer_entry=crosspost_post_action_bar","Repost","https://www.reddit.com/r/RobotVacuums/comments/1urqm9g/battery_life_ok_a_refurbished_euphy_x10/","Battery life ok a refurbished euphy X10..?","https://www.reddit.com/user/PuzzleheadedCarob921/","","u/PuzzleheadedCarob921","•","7 days ago","Battery life ok a refurbished euphy X10..?","","","","","[object Object]","SML.load([""32D6UNXHci"",""7KgY-4t-bj"",""9l9CnJPXUX"",""Apklb-ulLM"",""B_NHAZUdqW"",""B65d8mZ9dk"",""BaeKfoZWFu"",""BbEbdxSSWP"",""BBVFbL9gTt"",""BDqLQYUXb2"",""BE_eRNLHde"",""BE3KWFvAgd"",""Bfk76jCzva"",""BgzRPq9TrY"",""BHxHI-jiY8"",""BL4AFWChm2"",""BqCxBJyWKP"",""BRR-WcxRPu"",""BT-RK55BKV"",""Bt9bCnZeE4"",""Btbd1Rlzrj"",""BVFvNgoGa3"",""BZ2_qUMvze"",""C5V-G3dhmR"",""C60kHV2aLi"",""C6i1azzdWJ"",""CB_reylV_c"",""CbhpgNHVKi"",""CbNqmNJ9ZB"",""CEvq12cbO2"",""Cf72vh6LG6"",""CJTuHLD6HH"",""CRpMPywSwN"",""CrXP_t2buz"",""CU1eEyKYo6"",""CWCOAGnsuZ"",""CWuClRIAPb"",""Cxj4rYqYlV"",""CymvsgY07C"",""CyodcBLUBi"",""D-tOoTkopZ"",""D0Pq5ES-zJ"",""D3zOLvL8jV"",""D7x3TCAE9T"",""D8aHHRjuby"",""D9DtoVVF6i"",""D9gjqLbbjQ"",""DA2r4_1OU1"",""Dag00w-zJ8"",""DAWbe3IpMr"",""Dba5_HGJbL"",""DbY_c8hZXg"",""De-r6IzqJA"",""DHMPn_y_v9"",""DhS9dAZhjq"",""DHzHlOJRFF"",""DIxBJjJd_K"",""Dl3s0VKard"",""DLF_4_tUTe"",""Dm3xL5MQs7"",""DMY8GyetUo"",""DnhB_hG7j0"",""DOy5NYM9Ep"",""DR8wAHG9t8"",""DrNS5yd8Ck"",""DRozBhqA5h"",""DSqCK5EWRj"",""DstzxuPuBF"",""DuMYOvD6fZ"",""DUOCnquoJh"",""HNKHNuLSLH"",""Ie5ylYRrC6"",""lXmtgL270o"",""NZ-CnbFGvr"",""rYEVoUfuLu"",""uede2U50tA"",""vivXUQq-Wz""], 'en-US/', 'auto');","","",""
