"button href","button","absolute href","absolute","flex href","h-full src","whitespace-nowrap","inline-block","whitespace-nowrap 2","block","hover:no-underline href","md","md 2","md 3","overflow-hidden href","block 2","flex","md 4","md 5"
"https://www.reddit.com/submit?source_id=t3_1uydue7&composer_entry=crosspost_post_action_bar","Repost","https://www.reddit.com/r/RobotVacuums/comments/1uydue7/which_to_get/","Which to get?","https://www.reddit.com/user/Civil_Stomach_6230/","https://www.redditstatic.com/avatars/defaults/v2/avatar_default_0.png","u/Civil_Stomach_6230","•","2 hr. ago","Which to get?","https://www.reddit.com/r/RobotVacuums/comments/1uydue7/which_to_get/","I'm considering getting my first robot vacuum mop combo. Im just a student and will not be able to spend a lot, I would prefer to spend no more than $200-300.","My apartment is small, just 2 rooms. My main issue currently that has me considering getting a robot cleaner is because I have cats who shed a lot of hairs. I also have fairly long hair myself so it should be able to handle this well, as well as cat toys that are always all over the place in random places.","Any reccomendations within my budget? Thanks!","","","","",""
"","","","","","","","","","","","","","","","","","",""
"","","","","","","","","","","","","","","","","","",""
"https://www.reddit.com/submit?source_id=t3_1uw9b2e&composer_entry=crosspost_post_action_bar","Repost","https://www.reddit.com/r/RobotVacuums/comments/1uw9b2e/pov_after_my_niece_came_over/","POV: After my niece came over...","https://www.reddit.com/user/Competitive-Sun4527/","","u/Competitive-Sun4527","•","2 days ago","POV: After my niece came over...","","","","","[object Object]","SML.load([""-2kN0zEAc3"",""02Z6H7D-4q"",""0wCLNhlXP9"",""223TzO8dIv"",""9BhmxJRJEd"",""9kIvTK9SKY"",""amuR3GVeVi"",""B65d8mZ9dk"",""BaoXJcWNR4"",""BaSjRCgKCw"",""BDhTPBLVWY"",""BDqLQYUXb2"",""BEGBvv-aIC"",""BesM0G5O6e"",""BFPiE6ctee"",""Bho0_06RJc"",""bIFNwIm2UZ"",""bJFuBcsYfu"",""BN53zxDL88"",""BRg0_wv4fg"",""Bt-k_Tutdr"",""BTR6Gy0gR_"",""BtvhyG4FX2"",""BWTCMS3Arb"",""ByvvVtmtUa"",""Bz6yAJ3nD5"",""C54e9tu2KL"",""C9OPB9Mqkc"",""CB80VfWfwj"",""CcPxd1Z0lV"",""Ce_cBzIK7u"",""CEvq12cbO2"",""CF37bCFMIR"",""CFM-O_-gPY"",""CjCCE69LKi"",""CLjF6c-C6d"",""CoWKaiUpTS"",""CPHwDZFEhf"",""CPO1JnKDMJ"",""CpqCKKPyTL"",""CsQc3-4qT8"",""CVz73GtNFc"",""CWs3A7Tqma"",""CX9N2ErgJ0"",""CyodcBLUBi"",""D1vgVyfm4c"",""D2IaBYdkbH"",""D4D3Zn8Xya"",""D4vh-tITO1"",""D64xUqPghl"",""D9VWUf_mUu"",""Dag00w-zJ8"",""DCzvRBmFUS"",""DeB7aXBFwf"",""DoqT4eli_d"",""DOy1O6beiF"",""DpZtQyJfom"",""DRa2Z5H8NM"",""DrIQQFs_74"",""DvrSuLvx9R"",""DVRt_b9gU9"",""Dwsr8ArwO-"",""DYeabZ9Q5N"",""g82RYvphsK"",""jKhbjww7aQ"",""lhFbI2oh1s"",""lXmtgL270o"",""MYpQYmmMwg"",""OZok-VdJq4"",""PGONg0ilsA"",""qSO1B9CLnO"",""sWCTM5JB-b"",""TrgUOJw0hT"",""VIOdqpTu3V"",""XjMGsdiJH8"",""y7hLJUPUre"",""Z-XdSPRQqo""], 'en-US/', 'auto');","","",""
"","","","Advertisement: Soms voelt iets onmogelijk… totdat het wél lukt. Met die overtuiging wekken we fossielvrije stroom op uit wind en zon.","","","","•","","","","","","","","","","",""
"https://www.reddit.com/submit?source_id=t3_1uy3n7r&composer_entry=crosspost_post_action_bar","Repost","https://www.reddit.com/r/RobotVacuums/comments/1uy3n7r/roller_mop_or_spinning_mop_for_a_home_with_a/","Roller mop or spinning mop for a home with a toddler and a puppy?","https://www.reddit.com/user/Key_Review_7273/","https://www.redditstatic.com/avatars/defaults/v2/avatar_default_1.png","u/Key_Review_7273","•","9 hr. ago","Roller mop or spinning mop for a home with a toddler and a puppy?","https://www.reddit.com/r/RobotVacuums/comments/1uy3n7r/roller_mop_or_spinning_mop_for_a_home_with_a/","My kid is almost two now. He gets fidgety while eating, so crumbs and jam usually end up on the floor. Plus, we recently adopted a goldie puppy, so the cleaning has definitely gotten heavier.","I'm thinking of getting a robot, but I'm torn between a roller mop and a spinning one. Our place is about 900 sq ft. Most of the floors are tile and wood, with just a small blended rug. Any recommedation ?","","","","","",""
"https://www.reddit.com/submit?source_id=t3_1ubzbo4&composer_entry=crosspost_post_action_bar","Repost","https://www.reddit.com/r/RobotVacuums/comments/1ubzbo4/roboramp/","RoboRamp","https://www.reddit.com/user/Disastrous_Giraffe_/","","u/Disastrous_Giraffe_","•","25 days ago","RoboRamp","","","","","[object Object]","SML.load([""-2kN0zEAc3"",""02Z6H7D-4q"",""0wCLNhlXP9"",""223TzO8dIv"",""9BhmxJRJEd"",""9kIvTK9SKY"",""amuR3GVeVi"",""B65d8mZ9dk"",""BaoXJcWNR4"",""BaSjRCgKCw"",""BDhTPBLVWY"",""BDqLQYUXb2"",""BEGBvv-aIC"",""BesM0G5O6e"",""BFPiE6ctee"",""Bho0_06RJc"",""bIFNwIm2UZ"",""bJFuBcsYfu"",""BN53zxDL88"",""BRg0_wv4fg"",""Bt-k_Tutdr"",""BTR6Gy0gR_"",""BtvhyG4FX2"",""BWTCMS3Arb"",""ByvvVtmtUa"",""Bz6yAJ3nD5"",""C54e9tu2KL"",""C9OPB9Mqkc"",""CB80VfWfwj"",""CcPxd1Z0lV"",""Ce_cBzIK7u"",""CEvq12cbO2"",""CF37bCFMIR"",""CFM-O_-gPY"",""CjCCE69LKi"",""CLjF6c-C6d"",""CoWKaiUpTS"",""CPHwDZFEhf"",""CPO1JnKDMJ"",""CpqCKKPyTL"",""CsQc3-4qT8"",""CVz73GtNFc"",""CWs3A7Tqma"",""CX9N2ErgJ0"",""CyodcBLUBi"",""D1vgVyfm4c"",""D2IaBYdkbH"",""D4D3Zn8Xya"",""D4vh-tITO1"",""D64xUqPghl"",""D9VWUf_mUu"",""Dag00w-zJ8"",""DCzvRBmFUS"",""DeB7aXBFwf"",""DoqT4eli_d"",""DOy1O6beiF"",""DpZtQyJfom"",""DRa2Z5H8NM"",""DrIQQFs_74"",""DvrSuLvx9R"",""DVRt_b9gU9"",""Dwsr8ArwO-"",""DYeabZ9Q5N"",""g82RYvphsK"",""jKhbjww7aQ"",""lhFbI2oh1s"",""lXmtgL270o"",""MYpQYmmMwg"",""OZok-VdJq4"",""PGONg0ilsA"",""qSO1B9CLnO"",""sWCTM5JB-b"",""TrgUOJw0hT"",""VIOdqpTu3V"",""XjMGsdiJH8"",""y7hLJUPUre"",""Z-XdSPRQqo""], 'en-US/', 'auto');","1","",""
"https://www.reddit.com/submit?source_id=t3_1uxuobk&composer_entry=crosspost_post_action_bar","Repost","https://www.reddit.com/r/RobotVacuums/comments/1uxuobk/just_upgrade_from_ecovacs_x2_to_x12/","Just upgrade from Ecovacs X2 to X12","https://www.reddit.com/user/Darthrevanur/","https://www.redditstatic.com/avatars/defaults/v2/avatar_default_2.png","u/Darthrevanur","•","16 hr. ago","Just upgrade from Ecovacs X2 to X12","https://www.reddit.com/r/RobotVacuums/comments/1uxuobk/just_upgrade_from_ecovacs_x2_to_x12/","I've been using the ecovacs x2 for a couple of years. Honestly it did a solid job to keep up with dust, crumbs, and the usual mess around the house, so I never really felt the need to upgrade. That changed this year after we got a dog. The amount of hair and dirt coming into the house went up more than I thought, especially on the rugs, along the baseboards, and around the entryway. That's what finally pushed me to upgrade to the ecovacs x12.","The biggest difference for me has been the cleaning performance. The extra suction is noticeable. I'm finding a lot less hair left along the edges and corners after a cleaning run.","Besides, the roller mop has probably been the other standout upgrade. Compared to the rotating mops on the x2, x12 feels much better at dealing with sticky messes. One feature I'm using a lot is the pre-treatment mode. If my dog tracks muddy paw prints on the floors or someone spills something sticky like yogurt or barbecue sauce, I can mark that area in the app and have the robot spray it first before scrubbing it. Those kinda messes take less effort than they did with my x2.","","","","Hair tangle and obstacle avoidance have improved too. With a dog, there's always hair, toys, and random things on the floor, and I spend a lot less time checking whether the brush needs to be cleaned or worrying that the robot is going to get stuck.","My only real complaint is the price lol. It's definitely not cheap seriously, but for how much time and effort it's saved me, I'd still say it is worth its weight in gold."
"https://www.reddit.com/submit?source_id=t3_1urf4ai&composer_entry=crosspost_post_action_bar","Repost","https://www.reddit.com/r/RobotVacuums/comments/1urf4ai/fs09_floor_sanitation_rovot/","FS-09 Floor Sanitation Rovot","https://www.reddit.com/user/KevinGeeksTogether/","https://styles.redditmedia.com/t5_iwfbm1/styles/profileIcon_n93mztvn53ch1.png?width=64&height=64&frame=1&auto=webp&crop=64%3A64%2Csmart&s=fc6790cac44366f836acffa624a597b1ef12654d","u/KevinGeeksTogether","•","8 days ago","FS-09 Floor Sanitation Rovot","","","","","","SML.load([""-2kN0zEAc3"",""02Z6H7D-4q"",""0wCLNhlXP9"",""223TzO8dIv"",""9BhmxJRJEd"",""9kIvTK9SKY"",""amuR3GVeVi"",""B65d8mZ9dk"",""BaoXJcWNR4"",""BaSjRCgKCw"",""BDhTPBLVWY"",""BDqLQYUXb2"",""BEGBvv-aIC"",""BesM0G5O6e"",""BFPiE6ctee"",""Bho0_06RJc"",""bIFNwIm2UZ"",""bJFuBcsYfu"",""BN53zxDL88"",""BRg0_wv4fg"",""Bt-k_Tutdr"",""BTR6Gy0gR_"",""BtvhyG4FX2"",""BWTCMS3Arb"",""ByvvVtmtUa"",""Bz6yAJ3nD5"",""C54e9tu2KL"",""C9OPB9Mqkc"",""CB80VfWfwj"",""CcPxd1Z0lV"",""Ce_cBzIK7u"",""CEvq12cbO2"",""CF37bCFMIR"",""CFM-O_-gPY"",""CjCCE69LKi"",""CLjF6c-C6d"",""CoWKaiUpTS"",""CPHwDZFEhf"",""CPO1JnKDMJ"",""CpqCKKPyTL"",""CsQc3-4qT8"",""CVz73GtNFc"",""CWs3A7Tqma"",""CX9N2ErgJ0"",""CyodcBLUBi"",""D1vgVyfm4c"",""D2IaBYdkbH"",""D4D3Zn8Xya"",""D4vh-tITO1"",""D64xUqPghl"",""D9VWUf_mUu"",""Dag00w-zJ8"",""DCzvRBmFUS"",""DeB7aXBFwf"",""DoqT4eli_d"",""DOy1O6beiF"",""DpZtQyJfom"",""DRa2Z5H8NM"",""DrIQQFs_74"",""DvrSuLvx9R"",""DVRt_b9gU9"",""Dwsr8ArwO-"",""DYeabZ9Q5N"",""g82RYvphsK"",""jKhbjww7aQ"",""lhFbI2oh1s"",""lXmtgL270o"",""MYpQYmmMwg"",""OZok-VdJq4"",""PGONg0ilsA"",""qSO1B9CLnO"",""sWCTM5JB-b"",""TrgUOJw0hT"",""VIOdqpTu3V"",""XjMGsdiJH8"",""y7hLJUPUre"",""Z-XdSPRQqo""], 'en-US/', 'auto');","","",""
"https://www.reddit.com/submit?source_id=t3_1uy42oz&composer_entry=crosspost_post_action_bar","Repost","https://www.reddit.com/r/RobotVacuums/comments/1uy42oz/which_robot_vacuum_has_the_best_battery_life/","Which robot vacuum has the best battery life?","https://www.reddit.com/user/allcompanymobiles/","https://styles.redditmedia.com/t5_7hu3g/styles/profileIcon_i3gm7u86tum51.png?width=64&height=64&frame=1&auto=webp&crop=64%3A64%2Csmart&s=b053ca988c5636af5cdee9115db4924b07159792","u/allcompanymobiles","•","8 hr. ago","Which robot vacuum has the best battery life?","https://www.reddit.com/r/RobotVacuums/comments/1uy42oz/which_robot_vacuum_has_the_best_battery_life/","We recently moved into a bigger house, and I think my old robot vacuum has finally reached its limits.","It was fine in our old place, but now it usually runs out of battery before finishing the whole house. Then it has to sit on the dock for what feels like forever before it can get going again, which is getting frustrating.","I'm looking for something with better battery life, or at least much faster charging so it doesn't spend half the day on the dock. What are people with larger homes using these days?","","","","I've been narrowing down a few options within my budget, and I noticed some newer models, like yeedi, claim to recharge much faster during cleaning. Has anyone used one?",""
"https://www.reddit.com/submit?source_id=t3_1uyd2bx&composer_entry=crosspost_post_action_bar","Repost","https://www.reddit.com/r/RobotVacuums/comments/1uyd2bx/how_to_prime_the_water_pump_on_a_robotic_vacuum/","How to prime the water pump on a robotic vacuum & mop that is not getting water to the mop pads","https://www.reddit.com/user/mattsrobotics/","https://styles.redditmedia.com/t5_hqvwd6/styles/profileIcon_5zfzczdmcszg1.png?width=64&height=64&frame=1&auto=webp&crop=64%3A64%2Csmart&s=43e082abd7c5291135f0619f0613f2b76d830400","u/mattsrobotics","•","3 hr. ago","How to prime the water pump on a robotic vacuum & mop that is not getting water to the mop pads","","","","","","SML.load([""-2kN0zEAc3"",""02Z6H7D-4q"",""0wCLNhlXP9"",""223TzO8dIv"",""9BhmxJRJEd"",""9kIvTK9SKY"",""amuR3GVeVi"",""B65d8mZ9dk"",""BaoXJcWNR4"",""BaSjRCgKCw"",""BDhTPBLVWY"",""BDqLQYUXb2"",""BEGBvv-aIC"",""BesM0G5O6e"",""BFPiE6ctee"",""Bho0_06RJc"",""bIFNwIm2UZ"",""bJFuBcsYfu"",""BN53zxDL88"",""BRg0_wv4fg"",""Bt-k_Tutdr"",""BTR6Gy0gR_"",""BtvhyG4FX2"",""BWTCMS3Arb"",""ByvvVtmtUa"",""Bz6yAJ3nD5"",""C54e9tu2KL"",""C9OPB9Mqkc"",""CB80VfWfwj"",""CcPxd1Z0lV"",""Ce_cBzIK7u"",""CEvq12cbO2"",""CF37bCFMIR"",""CFM-O_-gPY"",""CjCCE69LKi"",""CLjF6c-C6d"",""CoWKaiUpTS"",""CPHwDZFEhf"",""CPO1JnKDMJ"",""CpqCKKPyTL"",""CsQc3-4qT8"",""CVz73GtNFc"",""CWs3A7Tqma"",""CX9N2ErgJ0"",""CyodcBLUBi"",""D1vgVyfm4c"",""D2IaBYdkbH"",""D4D3Zn8Xya"",""D4vh-tITO1"",""D64xUqPghl"",""D9VWUf_mUu"",""Dag00w-zJ8"",""DCzvRBmFUS"",""DeB7aXBFwf"",""DoqT4eli_d"",""DOy1O6beiF"",""DpZtQyJfom"",""DRa2Z5H8NM"",""DrIQQFs_74"",""DvrSuLvx9R"",""DVRt_b9gU9"",""Dwsr8ArwO-"",""DYeabZ9Q5N"",""g82RYvphsK"",""jKhbjww7aQ"",""lhFbI2oh1s"",""lXmtgL270o"",""MYpQYmmMwg"",""OZok-VdJq4"",""PGONg0ilsA"",""qSO1B9CLnO"",""sWCTM5JB-b"",""TrgUOJw0hT"",""VIOdqpTu3V"",""XjMGsdiJH8"",""y7hLJUPUre"",""Z-XdSPRQqo""], 'en-US/', 'auto');","2","",""
"","","","Advertisement: Hé klusser, hoeveel rondjes heb jij ooit door een bouwmarkt gelopen voor één product? Met de Product Locator van Praxis Klushulp vind je sneller wat je zoekt en houd je meer tijd over voor de klus zelf. Open de Praxis app voor alle Klushulp.","","","","•","","","","","","","","","","",""
"https://www.reddit.com/submit?source_id=t3_1udqka3&composer_entry=crosspost_post_action_bar","Repost","https://www.reddit.com/r/RobotVacuums/comments/1udqka3/pulled_the_price_history_on_every_big_prime_day/","Pulled the price history on every big Prime Day robot vac ""deal."" Which ones are real all-time lows vs. inflated.","https://www.reddit.com/user/Acrobatic_Inside3173/","","u/Acrobatic_Inside3173","•","23 days ago","Pulled the price history on every big Prime Day robot vac ""deal."" Which ones are real all-time lows vs. inflated.","","","","","[object Object]","SML.load([""-2kN0zEAc3"",""02Z6H7D-4q"",""0wCLNhlXP9"",""223TzO8dIv"",""9BhmxJRJEd"",""9kIvTK9SKY"",""amuR3GVeVi"",""B65d8mZ9dk"",""BaoXJcWNR4"",""BaSjRCgKCw"",""BDhTPBLVWY"",""BDqLQYUXb2"",""BEGBvv-aIC"",""BesM0G5O6e"",""BFPiE6ctee"",""Bho0_06RJc"",""bIFNwIm2UZ"",""bJFuBcsYfu"",""BN53zxDL88"",""BRg0_wv4fg"",""Bt-k_Tutdr"",""BTR6Gy0gR_"",""BtvhyG4FX2"",""BWTCMS3Arb"",""ByvvVtmtUa"",""Bz6yAJ3nD5"",""C54e9tu2KL"",""C9OPB9Mqkc"",""CB80VfWfwj"",""CcPxd1Z0lV"",""Ce_cBzIK7u"",""CEvq12cbO2"",""CF37bCFMIR"",""CFM-O_-gPY"",""CjCCE69LKi"",""CLjF6c-C6d"",""CoWKaiUpTS"",""CPHwDZFEhf"",""CPO1JnKDMJ"",""CpqCKKPyTL"",""CsQc3-4qT8"",""CVz73GtNFc"",""CWs3A7Tqma"",""CX9N2ErgJ0"",""CyodcBLUBi"",""D1vgVyfm4c"",""D2IaBYdkbH"",""D4D3Zn8Xya"",""D4vh-tITO1"",""D64xUqPghl"",""D9VWUf_mUu"",""Dag00w-zJ8"",""DCzvRBmFUS"",""DeB7aXBFwf"",""DoqT4eli_d"",""DOy1O6beiF"",""DpZtQyJfom"",""DRa2Z5H8NM"",""DrIQQFs_74"",""DvrSuLvx9R"",""DVRt_b9gU9"",""Dwsr8ArwO-"",""DYeabZ9Q5N"",""g82RYvphsK"",""jKhbjww7aQ"",""lhFbI2oh1s"",""lXmtgL270o"",""MYpQYmmMwg"",""OZok-VdJq4"",""PGONg0ilsA"",""qSO1B9CLnO"",""sWCTM5JB-b"",""TrgUOJw0hT"",""VIOdqpTu3V"",""XjMGsdiJH8"",""y7hLJUPUre"",""Z-XdSPRQqo""], 'en-US/', 'auto');","","",""
"https://www.reddit.com/submit?source_id=t3_1uy2fk7&composer_entry=crosspost_post_action_bar","Repost","https://www.reddit.com/r/RobotVacuums/comments/1uy2fk7/the_old_dilemma/","The old dilemma!","https://www.reddit.com/user/Getspmak/","https://www.redditstatic.com/avatars/defaults/v2/avatar_default_5.png","u/Getspmak","•","9 hr. ago","The old dilemma!","https://www.reddit.com/r/RobotVacuums/comments/1uy2fk7/the_old_dilemma/","It finally happened, and my Roborock S5 died after many years of good vacuuming! Tried replacing the motherboard, but now the WiFi seems to be dead.","I am very close to be throwing in the towel, and buy something new and better. ATM I’m torn between the Dreame X60 Ultra, or the Roborock Saros 20.We live in a house with tile and vinyl floors. There is no pets, but only two kids and a wife who makes a mess from time to time.","From what I’ve read, the Dreame may be better at mopping the floors, but maintenance on the station is worse than the Roborock?","","","","Any input, would be greatly appreciated.",""
"https://www.reddit.com/submit?source_id=t3_1uwsupn&composer_entry=crosspost_post_action_bar","Repost","https://www.reddit.com/r/RobotVacuums/comments/1uwsupn/never_ever_buy_mova_ever/","Never ever buy MOVA ever","https://www.reddit.com/user/Geminispace/","","u/Geminispace","•","2 days ago","Never ever buy MOVA ever","","","","","[object Object]","SML.load([""-2kN0zEAc3"",""02Z6H7D-4q"",""0wCLNhlXP9"",""223TzO8dIv"",""9BhmxJRJEd"",""9kIvTK9SKY"",""amuR3GVeVi"",""B65d8mZ9dk"",""BaoXJcWNR4"",""BaSjRCgKCw"",""BDhTPBLVWY"",""BDqLQYUXb2"",""BEGBvv-aIC"",""BesM0G5O6e"",""BFPiE6ctee"",""Bho0_06RJc"",""bIFNwIm2UZ"",""bJFuBcsYfu"",""BN53zxDL88"",""BRg0_wv4fg"",""Bt-k_Tutdr"",""BTR6Gy0gR_"",""BtvhyG4FX2"",""BWTCMS3Arb"",""ByvvVtmtUa"",""Bz6yAJ3nD5"",""C54e9tu2KL"",""C9OPB9Mqkc"",""CB80VfWfwj"",""CcPxd1Z0lV"",""Ce_cBzIK7u"",""CEvq12cbO2"",""CF37bCFMIR"",""CFM-O_-gPY"",""CjCCE69LKi"",""CLjF6c-C6d"",""CoWKaiUpTS"",""CPHwDZFEhf"",""CPO1JnKDMJ"",""CpqCKKPyTL"",""CsQc3-4qT8"",""CVz73GtNFc"",""CWs3A7Tqma"",""CX9N2ErgJ0"",""CyodcBLUBi"",""D1vgVyfm4c"",""D2IaBYdkbH"",""D4D3Zn8Xya"",""D4vh-tITO1"",""D64xUqPghl"",""D9VWUf_mUu"",""Dag00w-zJ8"",""DCzvRBmFUS"",""DeB7aXBFwf"",""DoqT4eli_d"",""DOy1O6beiF"",""DpZtQyJfom"",""DRa2Z5H8NM"",""DrIQQFs_74"",""DvrSuLvx9R"",""DVRt_b9gU9"",""Dwsr8ArwO-"",""DYeabZ9Q5N"",""g82RYvphsK"",""jKhbjww7aQ"",""lhFbI2oh1s"",""lXmtgL270o"",""MYpQYmmMwg"",""OZok-VdJq4"",""PGONg0ilsA"",""qSO1B9CLnO"",""sWCTM5JB-b"",""TrgUOJw0hT"",""VIOdqpTu3V"",""XjMGsdiJH8"",""y7hLJUPUre"",""Z-XdSPRQqo""], 'en-US/', 'auto');","1","",""
"https://www.reddit.com/submit?source_id=t3_1uxs05y&composer_entry=crosspost_post_action_bar","Repost","https://www.reddit.com/r/RobotVacuums/comments/1uxs05y/my_cat_finally_stopped_hiding_from_the_robot/","My cat finally stopped hiding from the robot vacuum","https://www.reddit.com/user/buenosdias99/","https://www.redditstatic.com/avatars/defaults/v2/avatar_default_5.png","u/buenosdias99","•","19 hr. ago","My cat finally stopped hiding from the robot vacuum","https://www.reddit.com/r/RobotVacuums/comments/1uxs05y/my_cat_finally_stopped_hiding_from_the_robot/","Our cat turned 12 this year, and she absolutely hated the robot vacuum the first time I turned it on.","She disappeared under the bed almost immediately and stayed there until it finished. I felt so bad for her, honestly.","She's a lot better now, but it definitely reminded me that not every pet is going to ignore a robot vacuum on day one.","","","","It also made me realize I cared a lot more about obstacle avoidance than I used to. I wanted something that wasn't constantly bumping into her if she decided to nap in the hallway, or pushing pet toys around the house.I usually have the living room run a little more often since that's where she sleeps most of the day. That way I don't really have to run the robot while she's already hanging out there.","She still notices when it starts, but definitely seems a lot less bothered by it now."
"https://www.reddit.com/submit?source_id=t3_1utpn3i&composer_entry=crosspost_post_action_bar","Repost","https://www.reddit.com/r/RobotVacuums/comments/1utpn3i/definitely_wasnt_expecting_this_when_i_got_the/","Definitely wasn't expecting this when I got the ""L20 Ultra is stuck on an obstacle"" notification...","https://www.reddit.com/user/TheChickenNuggetDude/","https://styles.redditmedia.com/t5_2m570g/styles/profileIcon_succz2xvdxyc1.jpeg?width=64&height=64&frame=1&auto=webp&crop=64%3A64%2Csmart&s=4bb90a17b8ae30f0e0a946b4e3459cab276131d9","u/TheChickenNuggetDude","•","5 days ago","Definitely wasn't expecting this when I got the ""L20 Ultra is stuck on an obstacle"" notification...","","","","","","SML.load([""-2kN0zEAc3"",""02Z6H7D-4q"",""0wCLNhlXP9"",""223TzO8dIv"",""9BhmxJRJEd"",""9kIvTK9SKY"",""amuR3GVeVi"",""B65d8mZ9dk"",""BaoXJcWNR4"",""BaSjRCgKCw"",""BDhTPBLVWY"",""BDqLQYUXb2"",""BEGBvv-aIC"",""BesM0G5O6e"",""BFPiE6ctee"",""Bho0_06RJc"",""bIFNwIm2UZ"",""bJFuBcsYfu"",""BN53zxDL88"",""BRg0_wv4fg"",""Bt-k_Tutdr"",""BTR6Gy0gR_"",""BtvhyG4FX2"",""BWTCMS3Arb"",""ByvvVtmtUa"",""Bz6yAJ3nD5"",""C54e9tu2KL"",""C9OPB9Mqkc"",""CB80VfWfwj"",""CcPxd1Z0lV"",""Ce_cBzIK7u"",""CEvq12cbO2"",""CF37bCFMIR"",""CFM-O_-gPY"",""CjCCE69LKi"",""CLjF6c-C6d"",""CoWKaiUpTS"",""CPHwDZFEhf"",""CPO1JnKDMJ"",""CpqCKKPyTL"",""CsQc3-4qT8"",""CVz73GtNFc"",""CWs3A7Tqma"",""CX9N2ErgJ0"",""CyodcBLUBi"",""D1vgVyfm4c"",""D2IaBYdkbH"",""D4D3Zn8Xya"",""D4vh-tITO1"",""D64xUqPghl"",""D9VWUf_mUu"",""Dag00w-zJ8"",""DCzvRBmFUS"",""DeB7aXBFwf"",""DoqT4eli_d"",""DOy1O6beiF"",""DpZtQyJfom"",""DRa2Z5H8NM"",""DrIQQFs_74"",""DvrSuLvx9R"",""DVRt_b9gU9"",""Dwsr8ArwO-"",""DYeabZ9Q5N"",""g82RYvphsK"",""jKhbjww7aQ"",""lhFbI2oh1s"",""lXmtgL270o"",""MYpQYmmMwg"",""OZok-VdJq4"",""PGONg0ilsA"",""qSO1B9CLnO"",""sWCTM5JB-b"",""TrgUOJw0hT"",""VIOdqpTu3V"",""XjMGsdiJH8"",""y7hLJUPUre"",""Z-XdSPRQqo""], 'en-US/', 'auto');","","",""
"https://www.reddit.com/submit?source_id=t3_1uxnshw&composer_entry=crosspost_post_action_bar","Repost","https://www.reddit.com/r/RobotVacuums/comments/1uxnshw/oops/","Oops.","https://www.reddit.com/user/wastedkarma/","","u/wastedkarma","•","22 hr. ago","Oops.","","","","","[object Object]","SML.load([""-2kN0zEAc3"",""02Z6H7D-4q"",""0wCLNhlXP9"",""223TzO8dIv"",""9BhmxJRJEd"",""9kIvTK9SKY"",""amuR3GVeVi"",""B65d8mZ9dk"",""BaoXJcWNR4"",""BaSjRCgKCw"",""BDhTPBLVWY"",""BDqLQYUXb2"",""BEGBvv-aIC"",""BesM0G5O6e"",""BFPiE6ctee"",""Bho0_06RJc"",""bIFNwIm2UZ"",""bJFuBcsYfu"",""BN53zxDL88"",""BRg0_wv4fg"",""Bt-k_Tutdr"",""BTR6Gy0gR_"",""BtvhyG4FX2"",""BWTCMS3Arb"",""ByvvVtmtUa"",""Bz6yAJ3nD5"",""C54e9tu2KL"",""C9OPB9Mqkc"",""CB80VfWfwj"",""CcPxd1Z0lV"",""Ce_cBzIK7u"",""CEvq12cbO2"",""CF37bCFMIR"",""CFM-O_-gPY"",""CjCCE69LKi"",""CLjF6c-C6d"",""CoWKaiUpTS"",""CPHwDZFEhf"",""CPO1JnKDMJ"",""CpqCKKPyTL"",""CsQc3-4qT8"",""CVz73GtNFc"",""CWs3A7Tqma"",""CX9N2ErgJ0"",""CyodcBLUBi"",""D1vgVyfm4c"",""D2IaBYdkbH"",""D4D3Zn8Xya"",""D4vh-tITO1"",""D64xUqPghl"",""D9VWUf_mUu"",""Dag00w-zJ8"",""DCzvRBmFUS"",""DeB7aXBFwf"",""DoqT4eli_d"",""DOy1O6beiF"",""DpZtQyJfom"",""DRa2Z5H8NM"",""DrIQQFs_74"",""DvrSuLvx9R"",""DVRt_b9gU9"",""Dwsr8ArwO-"",""DYeabZ9Q5N"",""g82RYvphsK"",""jKhbjww7aQ"",""lhFbI2oh1s"",""lXmtgL270o"",""MYpQYmmMwg"",""OZok-VdJq4"",""PGONg0ilsA"",""qSO1B9CLnO"",""sWCTM5JB-b"",""TrgUOJw0hT"",""VIOdqpTu3V"",""XjMGsdiJH8"",""y7hLJUPUre"",""Z-XdSPRQqo""], 'en-US/', 'auto');","","",""
"https://www.reddit.com/submit?source_id=t3_1ud7qkp&composer_entry=crosspost_post_action_bar","Repost","https://www.reddit.com/r/RobotVacuums/comments/1ud7qkp/the_case_against_getting_a_robovac_heres_who/","The Case Against Getting a Robovac - here's who shouldn't get one (IMO)","https://www.reddit.com/user/amandainpdx/","https://www.redditstatic.com/avatars/defaults/v2/avatar_default_7.png","u/amandainpdx","•","24 days ago","The Case Against Getting a Robovac - here's who shouldn't get one (IMO)","https://www.reddit.com/r/RobotVacuums/comments/1ud7qkp/the_case_against_getting_a_robovac_heres_who/","Heya. I've tested a LOT of floorbots and I am someone with a lot of mess. I drop food in the kitchen. I have a big, shedding dog. Chickens that occasionally figure out the doggie door. Lots of mulch, mud and dirt that gets tracked in by everything w a heartbeat, and you know, general mess. I blame the ADHD. Here's the thing... I don't say this with judgement.","I came to robots because i desperately wanted a helping hand. Like, if a robot just constantly vacuums and mops, then the mess will be less, and I won't always feel like I live in a zoo, right?","The problem is this: there are no robots that can really handle the households that need robots the most. I frequently get asked questions like, ""I have 4 dogs and 6 cats and 3 rowdy kids. What robot? I have cats that scatter little and occasionally puke or small dogs that poop in the house. What robot? I have lots of clutter on the floor and cords everywhere. What robot?","","","","Yeah. No robot. No robot is going to handle that for you. I wish that wasn't the case. One reason I was just besotted with the 3i S10 was that it actually DID handle most of that, hands off. (But don't buy one now, 3i is dead AFAIK).","Let me explain. Robots are good at vacuuming up dust, microdirt, and small, light stuff. Cheerios. If you've got tiny slips of paper or mulch or legos.... those are robot killers. The robot gets caught on them, rattles around and then you've got to clean the whole thing out. If you've got anything above cat litter size, your robot is going to struggle."
"","","","Advertisement: Klik&Klaar Internet van Odido.","","","","•","","","","","","","","","","",""
