"button href","button","absolute href","absolute","flex href","h-full src","whitespace-nowrap","inline-block","whitespace-nowrap 2","block","hover:no-underline href","md","md 2","md 3","overflow-hidden href","block 2","flex","md 4","md 5"
"https://www.reddit.com/submit?source_id=t3_1uuv34r&composer_entry=crosspost_post_action_bar","Repost","https://www.reddit.com/r/RobotVacuums/comments/1uuv34r/got_a_s1_pro_for_250_super_happy/","Got a S1 Pro for $250 | Super Happy","https://www.reddit.com/user/LSDBunnos/","","u/LSDBunnos","•","4 days ago","Got a S1 Pro for $250 | Super Happy","","","","","[object Object]","SML.load([""32D6UNXHci"",""7KgY-4t-bj"",""9l9CnJPXUX"",""Apklb-ulLM"",""B_NHAZUdqW"",""B65d8mZ9dk"",""BaeKfoZWFu"",""BbEbdxSSWP"",""BBVFbL9gTt"",""BDqLQYUXb2"",""BE_eRNLHde"",""BE3KWFvAgd"",""Bfk76jCzva"",""BgzRPq9TrY"",""BHxHI-jiY8"",""BL4AFWChm2"",""BqCxBJyWKP"",""BRR-WcxRPu"",""BT-RK55BKV"",""Bt9bCnZeE4"",""Btbd1Rlzrj"",""BVFvNgoGa3"",""BZ2_qUMvze"",""C5V-G3dhmR"",""C60kHV2aLi"",""C6i1azzdWJ"",""CB_reylV_c"",""CbhpgNHVKi"",""CbNqmNJ9ZB"",""CEvq12cbO2"",""Cf72vh6LG6"",""CJTuHLD6HH"",""CRpMPywSwN"",""CrXP_t2buz"",""CU1eEyKYo6"",""CWCOAGnsuZ"",""CWuClRIAPb"",""Cxj4rYqYlV"",""CymvsgY07C"",""CyodcBLUBi"",""D-tOoTkopZ"",""D0Pq5ES-zJ"",""D3zOLvL8jV"",""D7x3TCAE9T"",""D8aHHRjuby"",""D9DtoVVF6i"",""D9gjqLbbjQ"",""DA2r4_1OU1"",""Dag00w-zJ8"",""DAWbe3IpMr"",""Dba5_HGJbL"",""DbY_c8hZXg"",""De-r6IzqJA"",""DHMPn_y_v9"",""DhS9dAZhjq"",""DHzHlOJRFF"",""DIxBJjJd_K"",""Dl3s0VKard"",""DLF_4_tUTe"",""Dm3xL5MQs7"",""DMY8GyetUo"",""DnhB_hG7j0"",""DOy5NYM9Ep"",""DR8wAHG9t8"",""DrNS5yd8Ck"",""DRozBhqA5h"",""DSqCK5EWRj"",""DstzxuPuBF"",""DuMYOvD6fZ"",""DUOCnquoJh"",""HNKHNuLSLH"",""Ie5ylYRrC6"",""lXmtgL270o"",""NZ-CnbFGvr"",""rYEVoUfuLu"",""uede2U50tA"",""vivXUQq-Wz""], 'en-US/', 'auto');","","",""
"https://www.reddit.com/submit?source_id=t3_1uqpq5o&composer_entry=crosspost_post_action_bar","Repost","https://www.reddit.com/r/RobotVacuums/comments/1uqpq5o/help_me_pick_out_a_vacuum/","Help me pick out a vacuum","https://www.reddit.com/user/Big-Instance-4777/","https://www.redditstatic.com/avatars/defaults/v2/avatar_default_2.png","u/Big-Instance-4777","•","8 days ago","Help me pick out a vacuum","","","","","","SML.load([""32D6UNXHci"",""7KgY-4t-bj"",""9l9CnJPXUX"",""Apklb-ulLM"",""B_NHAZUdqW"",""B65d8mZ9dk"",""BaeKfoZWFu"",""BbEbdxSSWP"",""BBVFbL9gTt"",""BDqLQYUXb2"",""BE_eRNLHde"",""BE3KWFvAgd"",""Bfk76jCzva"",""BgzRPq9TrY"",""BHxHI-jiY8"",""BL4AFWChm2"",""BqCxBJyWKP"",""BRR-WcxRPu"",""BT-RK55BKV"",""Bt9bCnZeE4"",""Btbd1Rlzrj"",""BVFvNgoGa3"",""BZ2_qUMvze"",""C5V-G3dhmR"",""C60kHV2aLi"",""C6i1azzdWJ"",""CB_reylV_c"",""CbhpgNHVKi"",""CbNqmNJ9ZB"",""CEvq12cbO2"",""Cf72vh6LG6"",""CJTuHLD6HH"",""CRpMPywSwN"",""CrXP_t2buz"",""CU1eEyKYo6"",""CWCOAGnsuZ"",""CWuClRIAPb"",""Cxj4rYqYlV"",""CymvsgY07C"",""CyodcBLUBi"",""D-tOoTkopZ"",""D0Pq5ES-zJ"",""D3zOLvL8jV"",""D7x3TCAE9T"",""D8aHHRjuby"",""D9DtoVVF6i"",""D9gjqLbbjQ"",""DA2r4_1OU1"",""Dag00w-zJ8"",""DAWbe3IpMr"",""Dba5_HGJbL"",""DbY_c8hZXg"",""De-r6IzqJA"",""DHMPn_y_v9"",""DhS9dAZhjq"",""DHzHlOJRFF"",""DIxBJjJd_K"",""Dl3s0VKard"",""DLF_4_tUTe"",""Dm3xL5MQs7"",""DMY8GyetUo"",""DnhB_hG7j0"",""DOy5NYM9Ep"",""DR8wAHG9t8"",""DrNS5yd8Ck"",""DRozBhqA5h"",""DSqCK5EWRj"",""DstzxuPuBF"",""DuMYOvD6fZ"",""DUOCnquoJh"",""HNKHNuLSLH"",""Ie5ylYRrC6"",""lXmtgL270o"",""NZ-CnbFGvr"",""rYEVoUfuLu"",""uede2U50tA"",""vivXUQq-Wz""], 'en-US/', 'auto');","3","","I need help picking out a vacuum. Either a Robo vacuum only or if it is a VAC mop combo I want a roller mop. It is for 1200 ft.² of tile only. Also, I have a very large heavy shedding dog. I have been doing OK with my Roomba 750. However, it doesn’t always get near the edges of the room and sometimes forgets where it’s going. I tried the shark but the app was terrible and it didn’t vacuum the hair at all. My budget is less than $1k."
"https://www.reddit.com/submit?source_id=t3_1uxokux&composer_entry=crosspost_post_action_bar","Repost","https://www.reddit.com/r/RobotVacuums/comments/1uxokux/the_australian_robot_vacuum_fire_is_a_reminder/","The Australian robot vacuum fire is a reminder about electrical safety — not a reason to panic","https://www.reddit.com/user/SweeperLab0311/","https://styles.redditmedia.com/t5_hxc9ww/styles/profileIcon_19zs87ik1k3h1.jpg?width=64&height=64&frame=1&auto=webp&crop=64%3A64%2Csmart&s=1e4bed6a2028673f79e24d505f7eaa48d07e4402","u/SweeperLab0311","•","21 hr. ago","The Australian robot vacuum fire is a reminder about electrical safety — not a reason to panic","https://www.reddit.com/r/RobotVacuums/comments/1uxokux/the_australian_robot_vacuum_fire_is_a_reminder/","I’ve been following the latest news from Australia: According to reports, a 25-year-old man suffered severe burns after a residential fire was caused by a malfunctioning robot vacuum cleaner. First of all, I sincerely hope he makes a full recovery.As far as I know, the exact cause is still under investigation. It could be the battery, the charging system, the internal wiring, or something else entirely, so I think it’s too early to draw any conclusions.What I’ve been thinking about is this: the greatest danger may not be the robot itself “exploding,” but rather what would happen if an electrical malfunction caused a fire that spread to everything around it.I don’t think anyone needs to panic over this, because electrical safety deserves more attention than the safety of the robot vacuum’s battery itself. For example, we should regularly check the battery for signs of swelling, overheating, or strange odors, and make sure to use the original charging equipment, avoiding cheap replacement parts.Has this incident made you think more deeply about how to use robot vacuums safely? Or has it made you more cautious about electrical safety in your home?","","","","","1","",""
"https://www.reddit.com/submit?source_id=t3_1ut6uir&composer_entry=crosspost_post_action_bar","Repost","https://www.reddit.com/r/RobotVacuums/comments/1ut6uir/schedule_cleaning_for_house_with_3_long_hair_cats/","Schedule cleaning for house with 3 long hair cats","https://www.reddit.com/user/Super-Cheesecake-600/","","u/Super-Cheesecake-600","•","6 days ago","Schedule cleaning for house with 3 long hair cats","https://www.reddit.com/r/RobotVacuums/comments/1ut6uir/schedule_cleaning_for_house_with_3_long_hair_cats/","What’s your schedule like? I don’t wanna set it to daily as I think it will wear out the robot…","","","[object Object]","","","",""
"https://www.reddit.com/submit?source_id=t3_1uqppvt&composer_entry=crosspost_post_action_bar","Repost","https://www.reddit.com/r/RobotVacuums/comments/1uqppvt/help_me_pick_out_a_vacuum/","Help me pick out a vacuum","https://www.reddit.com/user/Big-Instance-4777/","https://www.redditstatic.com/avatars/defaults/v2/avatar_default_2.png","u/Big-Instance-4777","•","8 days ago","Help me pick out a vacuum","","","","","","SML.load([""32D6UNXHci"",""7KgY-4t-bj"",""9l9CnJPXUX"",""Apklb-ulLM"",""B_NHAZUdqW"",""B65d8mZ9dk"",""BaeKfoZWFu"",""BbEbdxSSWP"",""BBVFbL9gTt"",""BDqLQYUXb2"",""BE_eRNLHde"",""BE3KWFvAgd"",""Bfk76jCzva"",""BgzRPq9TrY"",""BHxHI-jiY8"",""BL4AFWChm2"",""BqCxBJyWKP"",""BRR-WcxRPu"",""BT-RK55BKV"",""Bt9bCnZeE4"",""Btbd1Rlzrj"",""BVFvNgoGa3"",""BZ2_qUMvze"",""C5V-G3dhmR"",""C60kHV2aLi"",""C6i1azzdWJ"",""CB_reylV_c"",""CbhpgNHVKi"",""CbNqmNJ9ZB"",""CEvq12cbO2"",""Cf72vh6LG6"",""CJTuHLD6HH"",""CRpMPywSwN"",""CrXP_t2buz"",""CU1eEyKYo6"",""CWCOAGnsuZ"",""CWuClRIAPb"",""Cxj4rYqYlV"",""CymvsgY07C"",""CyodcBLUBi"",""D-tOoTkopZ"",""D0Pq5ES-zJ"",""D3zOLvL8jV"",""D7x3TCAE9T"",""D8aHHRjuby"",""D9DtoVVF6i"",""D9gjqLbbjQ"",""DA2r4_1OU1"",""Dag00w-zJ8"",""DAWbe3IpMr"",""Dba5_HGJbL"",""DbY_c8hZXg"",""De-r6IzqJA"",""DHMPn_y_v9"",""DhS9dAZhjq"",""DHzHlOJRFF"",""DIxBJjJd_K"",""Dl3s0VKard"",""DLF_4_tUTe"",""Dm3xL5MQs7"",""DMY8GyetUo"",""DnhB_hG7j0"",""DOy5NYM9Ep"",""DR8wAHG9t8"",""DrNS5yd8Ck"",""DRozBhqA5h"",""DSqCK5EWRj"",""DstzxuPuBF"",""DuMYOvD6fZ"",""DUOCnquoJh"",""HNKHNuLSLH"",""Ie5ylYRrC6"",""lXmtgL270o"",""NZ-CnbFGvr"",""rYEVoUfuLu"",""uede2U50tA"",""vivXUQq-Wz""], 'en-US/', 'auto');","3","","I need help picking out a vacuum. Either a Robo vacuum only or if it is a VAC mop combo I want a roller mop. It is for 1200 ft.² of tile only. Also, I have a very large heavy shedding dog. I have been doing OK with my Roomba 750. However, it doesn’t always get near the edges of the room and sometimes forgets where it’s going. I tried the shark but the app was terrible and it didn’t vacuum the hair at all. My budget is less than $1k."
"","","","Advertisement: De zonoplossingen van Vattenfall helpen je om de stroom die je opwekt zoveel mogelijk zelf te verbruiken, slim en passend bij jouw situatie. Met een thuisbatterij of zonnestroomboiler is de zon weer welkom. Voelt als nieuwe energie.","","","","•","","","","","","","","","","",""
"https://www.reddit.com/submit?source_id=t3_1uqlbsn&composer_entry=crosspost_post_action_bar","Repost","https://www.reddit.com/r/RobotVacuums/comments/1uqlbsn/proven_reliabilitydurability/","Proven reliability/durability","https://www.reddit.com/user/Salt_Locksmith_9858/","https://www.redditstatic.com/avatars/defaults/v2/avatar_default_5.png","u/Salt_Locksmith_9858","•","9 days ago","Proven reliability/durability","https://www.reddit.com/r/RobotVacuums/comments/1uqlbsn/proven_reliabilitydurability/","My 15 year old iLife vac has served me well!","It's still going strong but with a daughter and a dog it's struggling to keep up so I want a new one.","I value reliability/durability over fancy features, even if that means getting a model that's a few years old... And would love one that isn't dependent on any cloud services (although that might be a tall ask nowadays).","","","","Does such a robot exist?",""
"https://www.reddit.com/submit?source_id=t3_1uv32us&composer_entry=crosspost_post_action_bar","Repost","https://www.reddit.com/r/RobotVacuums/comments/1uv32us/help_me_choose_roborock_dreame_mova/","Help me choose!! Roborock/ Dreame/ Mova","https://www.reddit.com/user/rawrrunicorn/","","u/rawrrunicorn","•","4 days ago","Help me choose!! Roborock/ Dreame/ Mova","https://www.reddit.com/r/RobotVacuums/comments/1uv32us/help_me_choose_roborock_dreame_mova/","Definately a lot of posts similar to this around but please help me choose.","I am after a robot vacuum without RGB camera. Infrared is ok.","I have a baby who will start to crawl soon and toys are bound to be around. I am happy to put these away before starting the robot. Multi level would be a plus but not a deal breaker.","[object Object]","","","Living, kitchen and hallways are tiles with hardwood in bedroom and only one rug.","I have narrowed down to:Roborock Qrevo LDreame L40 UltraMova P50"
"https://www.reddit.com/submit?source_id=t3_1uxn3v5&composer_entry=crosspost_post_action_bar","Repost","https://www.reddit.com/r/RobotVacuums/comments/1uxn3v5/dreame_x60_noise_when_driving_and_turning/","Dreame X60 - Noise when driving and turning","https://www.reddit.com/user/tommiyoung/","","u/tommiyoung","•","22 hr. ago","Dreame X60 - Noise when driving and turning","https://www.reddit.com/r/RobotVacuums/comments/1uxn3v5/dreame_x60_noise_when_driving_and_turning/","Noise when driving and turning","Hi all. Can you tell me if this noise is normal for a new X60 Ultra? It’s very loud I think. It’s only mopping in this video. It’s loud when it’s driving and turning.","","[object Object]","SML.load([""32D6UNXHci"",""7KgY-4t-bj"",""9l9CnJPXUX"",""Apklb-ulLM"",""B_NHAZUdqW"",""B65d8mZ9dk"",""BaeKfoZWFu"",""BbEbdxSSWP"",""BBVFbL9gTt"",""BDqLQYUXb2"",""BE_eRNLHde"",""BE3KWFvAgd"",""Bfk76jCzva"",""BgzRPq9TrY"",""BHxHI-jiY8"",""BL4AFWChm2"",""BqCxBJyWKP"",""BRR-WcxRPu"",""BT-RK55BKV"",""Bt9bCnZeE4"",""Btbd1Rlzrj"",""BVFvNgoGa3"",""BZ2_qUMvze"",""C5V-G3dhmR"",""C60kHV2aLi"",""C6i1azzdWJ"",""CB_reylV_c"",""CbhpgNHVKi"",""CbNqmNJ9ZB"",""CEvq12cbO2"",""Cf72vh6LG6"",""CJTuHLD6HH"",""CRpMPywSwN"",""CrXP_t2buz"",""CU1eEyKYo6"",""CWCOAGnsuZ"",""CWuClRIAPb"",""Cxj4rYqYlV"",""CymvsgY07C"",""CyodcBLUBi"",""D-tOoTkopZ"",""D0Pq5ES-zJ"",""D3zOLvL8jV"",""D7x3TCAE9T"",""D8aHHRjuby"",""D9DtoVVF6i"",""D9gjqLbbjQ"",""DA2r4_1OU1"",""Dag00w-zJ8"",""DAWbe3IpMr"",""Dba5_HGJbL"",""DbY_c8hZXg"",""De-r6IzqJA"",""DHMPn_y_v9"",""DhS9dAZhjq"",""DHzHlOJRFF"",""DIxBJjJd_K"",""Dl3s0VKard"",""DLF_4_tUTe"",""Dm3xL5MQs7"",""DMY8GyetUo"",""DnhB_hG7j0"",""DOy5NYM9Ep"",""DR8wAHG9t8"",""DrNS5yd8Ck"",""DRozBhqA5h"",""DSqCK5EWRj"",""DstzxuPuBF"",""DuMYOvD6fZ"",""DUOCnquoJh"",""HNKHNuLSLH"",""Ie5ylYRrC6"",""lXmtgL270o"",""NZ-CnbFGvr"",""rYEVoUfuLu"",""uede2U50tA"",""vivXUQq-Wz""], 'en-US/', 'auto');","1","",""
"https://www.reddit.com/submit?source_id=t3_1uqezx7&composer_entry=crosspost_post_action_bar","Repost","https://www.reddit.com/r/RobotVacuums/comments/1uqezx7/just_trashed_my_month_old_roborock_q7_l5/","Just trashed my month old Roborock Q7 L5","https://www.reddit.com/user/thefordmccord/","","u/thefordmccord","•","9 days ago","Just trashed my month old Roborock Q7 L5","https://www.reddit.com/r/RobotVacuums/comments/1uqezx7/just_trashed_my_month_old_roborock_q7_l5/","Just wanted to let everyone know to avoid this model.  Had a wheel motor fail 1 month after purchase.  Roborock support will not respond and the Amazon return window ended July 5th. Not sure if this model is junk, or if I just have bad luck.  Really missing my Neato D3 right now.  It lasted almost a decade.","","","[object Object]","","","",""
"https://www.reddit.com/submit?source_id=t3_1urh1iv&composer_entry=crosspost_post_action_bar","Repost","https://www.reddit.com/r/RobotVacuums/comments/1urh1iv/best_robot_for_uneven_floors/","Best robot for uneven floors?","https://www.reddit.com/user/torenvalk/","","u/torenvalk","•","8 days ago","Best robot for uneven floors?","https://www.reddit.com/r/RobotVacuums/comments/1urh1iv/best_robot_for_uneven_floors/","I live in a fisherman's cottage built in 1899. It has the original, dark painted wood floors with rope buried between the floorboards that is quite wobbly and uneven. We have had a roomba of the 700 era for years and years but it has finally given out and refuses to charge even with a new battery, cleaning of the charger etc. It worked perfectly to help keep up with two cats and long human hair in between proper vacuums.","I accept that we probably can't get one that can also mop because of this floor, but does anyone have suggestions for a newer vacuum that would be best for my historic home? Thanks very much in advance.","","[object Object]","","","",""
"https://www.reddit.com/submit?source_id=t3_1uxhw47&composer_entry=crosspost_post_action_bar","Repost","https://www.reddit.com/r/RobotVacuums/comments/1uxhw47/ecovacs_t80s_omni_vs_roborock_qrevo_s_pro/","Ecovacs T80S Omni vs Roborock Qrevo S Pro","https://www.reddit.com/user/Zyrcon_/","https://www.redditstatic.com/avatars/defaults/v2/avatar_default_6.png","u/Zyrcon_","•","1 day ago","Ecovacs T80S Omni vs Roborock Qrevo S Pro","https://www.reddit.com/r/RobotVacuums/comments/1uxhw47/ecovacs_t80s_omni_vs_roborock_qrevo_s_pro/","Hi, first timer here","I'm looking for a budget-midrange and so far the two in the title have caught my attention.","There's a 60€ difference (in favor of the Roborock priced at 389€) and I'm not sure of the pros/cons of each.","","","1","From what I gather the T80s has a roller mop, which is reportedly better but also more complicated to maintain (if true, how much?) and better edge cleaning, self cleaning dock (?). On the other hand I've only seen solid reviews of Roborock as a brand and not so much for Ecovacs (neither positively nor negatively).","Another product that was recommended to me by a friend is the Dreame L40 Ultra AE, which would cost the same as the T80s."
"https://www.reddit.com/submit?source_id=t3_1uqfwqc&composer_entry=crosspost_post_action_bar","Repost","https://www.reddit.com/r/RobotVacuums/comments/1uqfwqc/im_trying_to_figure_out_what_actually_makes_a/","I'm trying to figure out what actually makes a robot good at cleaning floor gaps.","https://www.reddit.com/user/SweeperLab0311/","https://styles.redditmedia.com/t5_hxc9ww/styles/profileIcon_19zs87ik1k3h1.jpg?width=64&height=64&frame=1&auto=webp&crop=64%3A64%2Csmart&s=1e4bed6a2028673f79e24d505f7eaa48d07e4402","u/SweeperLab0311","•","9 days ago","I'm trying to figure out what actually makes a robot good at cleaning floor gaps.","https://www.reddit.com/r/RobotVacuums/comments/1uqfwqc/im_trying_to_figure_out_what_actually_makes_a/","I was testing how different robot vacuums handled coffee grounds in floor gaps today, and something caught my attention. On open floors, almost every robot picked them up without much trouble. But once the coffee grounds settled into the gaps, the results started looking completely different. A few robots drove over the same spot multiple times and still left quite a bit behind. Others pulled most of the debris out on the first or second pass—even though they weren't the ones with the highest advertised suction.","That made me realize I might have been focusing on the wrong spec all along. What actually makes a robot good at crevice cleaning? Is it: Suction? Airflow? Brush design? Side brushes? The height of the main brush? Or how close does the chassis sit to the floor?","For those of you who own robot vacuums, have you noticed the same thing or have your own theory?","","","","",""
"https://www.reddit.com/submit?source_id=t3_1utyhrb&composer_entry=crosspost_post_action_bar","Repost","https://www.reddit.com/r/RobotVacuums/comments/1utyhrb/does_floor_color_affect_efficiency_of_robot/","Does floor color affect efficiency of robot vacuums?","https://www.reddit.com/user/Typical-Watercress79/","https://www.redditstatic.com/avatars/defaults/v2/avatar_default_4.png","u/Typical-Watercress79","•","5 days ago","Does floor color affect efficiency of robot vacuums?","https://www.reddit.com/r/RobotVacuums/comments/1utyhrb/does_floor_color_affect_efficiency_of_robot/","I’m planning on buying or asking for a robot vacuum for Christmas in a few years from now. I was just sitting eating dinner and seeing crumbs on the floor which made me think, does the color of the floor affect the robot vacuums ability to see and pick up stuff off the floor? I currently have Life-proof Walton Oak vinyl flooring through out the apartment. Will the dark color of my vinyl flooring hinder a robot vacuum from finding any dirt on the floor?","","","","","","",""
"https://www.reddit.com/submit?source_id=t3_1uqfoaz&composer_entry=crosspost_post_action_bar","Repost","https://www.reddit.com/r/RobotVacuums/comments/1uqfoaz/best_robot_vacuum_no_fuss/","Best Robot Vacuum No Fuss","https://www.reddit.com/user/Reasonable_Fun244/","https://www.redditstatic.com/avatars/defaults/v2/avatar_default_6.png","u/Reasonable_Fun244","•","9 days ago","Best Robot Vacuum No Fuss","https://www.reddit.com/r/RobotVacuums/comments/1uqfoaz/best_robot_vacuum_no_fuss/","I am looking for a Robot vacuum/mop that will just be set and forget. My budget is $500-1000. I used to have ecovacs T50 Pro Omni and was so disappointed, it would drag its mop on the carpet floor in my room and constantly needed to be remapped. The vacuums I have tried always get confused on the huge oriental rug I have in my apartment aswell. I mostly have hardwood though. I don’t want to go through the Vacuum Wars rabbit hole again either. I would rather get some anecdotal evidence from real users.","","","","","","",""
"https://www.reddit.com/submit?source_id=t3_1uqbax9&composer_entry=crosspost_post_action_bar","Repost","https://www.reddit.com/r/RobotVacuums/comments/1uqbax9/narwal_freo_z10_turbo_vs_flow_1st_gen/","Narwal Freo Z10 Turbo vs Flow (1st Gen)","https://www.reddit.com/user/Mental-Let7004/","https://www.redditstatic.com/avatars/defaults/v2/avatar_default_7.png","u/Mental-Let7004","•","9 days ago","Narwal Freo Z10 Turbo vs Flow (1st Gen)","https://www.reddit.com/r/RobotVacuums/comments/1uqbax9/narwal_freo_z10_turbo_vs_flow_1st_gen/","hey everyone, so I got the narwal freoZ10 turbo a few weeks ago and I am really happy with it! it is doing such a great job at keeping my house clean. the only thing I don’t like is the fact it doesn’t carry water to keep the mops continually wet and that it needs to go to the dock for that. However vacuuming ability is much more important than mopping for me and it has been doing great with that.","The Narwal Flow (1st gen) is now $1300 off so I can get it at the same price as what I paid for the Freo Z10 Turbo.","Does it make sense to keep my Freo Z10 turbo or should I return it and get the Flow?  I’m worried the flow may be more susceptible to issues over time given the rolling mop technology.","","","1","please let me know, thanks!",""
"","","","Advertisement: De goods zijn binnen!","","","","•","","","","","","","","","","",""
"https://www.reddit.com/submit?source_id=t3_1urgl14&composer_entry=crosspost_post_action_bar","Repost","https://www.reddit.com/r/RobotVacuums/comments/1urgl14/buying_advice_for_vacuummop/","Buying Advice for vacuum/mop","https://www.reddit.com/user/WayNorth49/","https://www.redditstatic.com/avatars/defaults/v2/avatar_default_0.png","u/WayNorth49","•","8 days ago","Buying Advice for vacuum/mop","https://www.reddit.com/r/RobotVacuums/comments/1urgl14/buying_advice_for_vacuummop/","I'd really appreciate some hand holding. I am struggling to figure out what features I need to do what I'd like a new beastie to do.","Some years ago I bought an inexpensive Eufy vacuum robot. It's mostly gone unused as it required me to remove most of the chairs in my main living room or it would just get stuck under the table, get stuck munching the edge of my oriental rugs, or pin itself under the toe-kicks of my kitchen cabinets. The whole point for me of one of these devices is that they should work without needing 10 minutes of room preparation, and without a lot of babysitting. A man wants to let the thing loose during the night and wake up to a full-room improvement.","Fast forward and I have a new kitchen floor that's pretty but needs REGULAR cleaning. So, what are my needs?","","","","Thanks in advance for your thoughts. I'm most grateful. Not mentioning price point on purpose. If there are significant differences in performance with regard to the above criteria I'd probably pay for the them. But I also probably am not searching for bells and whistles beyond the foregoing.","I would really like for the robot to not get stuck and/or confused by chair legs around the dining room table!"
"https://www.reddit.com/submit?source_id=t3_1uqda34&composer_entry=crosspost_post_action_bar","Repost","https://www.reddit.com/r/RobotVacuums/comments/1uqda34/roomba_400_series_cant_find_dock_no_matter_what_i/","Roomba 400 series can’t find dock no matter what I do!","https://www.reddit.com/user/BatSilver4588/","","u/BatSilver4588","•","9 days ago","Roomba 400 series can’t find dock no matter what I do!","","","","","[object Object]","SML.load([""32D6UNXHci"",""7KgY-4t-bj"",""9l9CnJPXUX"",""Apklb-ulLM"",""B_NHAZUdqW"",""B65d8mZ9dk"",""BaeKfoZWFu"",""BbEbdxSSWP"",""BBVFbL9gTt"",""BDqLQYUXb2"",""BE_eRNLHde"",""BE3KWFvAgd"",""Bfk76jCzva"",""BgzRPq9TrY"",""BHxHI-jiY8"",""BL4AFWChm2"",""BqCxBJyWKP"",""BRR-WcxRPu"",""BT-RK55BKV"",""Bt9bCnZeE4"",""Btbd1Rlzrj"",""BVFvNgoGa3"",""BZ2_qUMvze"",""C5V-G3dhmR"",""C60kHV2aLi"",""C6i1azzdWJ"",""CB_reylV_c"",""CbhpgNHVKi"",""CbNqmNJ9ZB"",""CEvq12cbO2"",""Cf72vh6LG6"",""CJTuHLD6HH"",""CRpMPywSwN"",""CrXP_t2buz"",""CU1eEyKYo6"",""CWCOAGnsuZ"",""CWuClRIAPb"",""Cxj4rYqYlV"",""CymvsgY07C"",""CyodcBLUBi"",""D-tOoTkopZ"",""D0Pq5ES-zJ"",""D3zOLvL8jV"",""D7x3TCAE9T"",""D8aHHRjuby"",""D9DtoVVF6i"",""D9gjqLbbjQ"",""DA2r4_1OU1"",""Dag00w-zJ8"",""DAWbe3IpMr"",""Dba5_HGJbL"",""DbY_c8hZXg"",""De-r6IzqJA"",""DHMPn_y_v9"",""DhS9dAZhjq"",""DHzHlOJRFF"",""DIxBJjJd_K"",""Dl3s0VKard"",""DLF_4_tUTe"",""Dm3xL5MQs7"",""DMY8GyetUo"",""DnhB_hG7j0"",""DOy5NYM9Ep"",""DR8wAHG9t8"",""DrNS5yd8Ck"",""DRozBhqA5h"",""DSqCK5EWRj"",""DstzxuPuBF"",""DuMYOvD6fZ"",""DUOCnquoJh"",""HNKHNuLSLH"",""Ie5ylYRrC6"",""lXmtgL270o"",""NZ-CnbFGvr"",""rYEVoUfuLu"",""uede2U50tA"",""vivXUQq-Wz""], 'en-US/', 'auto');","1","","Help! Have had my roomba for almost a year with no issues at all. Recently she stopped finding the dock, constantly saying “recalibrating location” over and over. I have done everything I can’t think of, and what google suggests and she still can’t seem to find it/dock properly."
"https://www.reddit.com/submit?source_id=t3_1ut4ofc&composer_entry=crosspost_post_action_bar","Repost","https://www.reddit.com/r/RobotVacuums/comments/1ut4ofc/incredibly_overwhelmed_by_vacuum_choices_any/","Incredibly overwhelmed by vacuum choices... Any guidance based on my specific, limited needs?","https://www.reddit.com/user/MooManMilk/","","u/MooManMilk","•","6 days ago","Incredibly overwhelmed by vacuum choices... Any guidance based on my specific, limited needs?","https://www.reddit.com/r/RobotVacuums/comments/1ut4ofc/incredibly_overwhelmed_by_vacuum_choices_any/","I'm fairly sure I have settled on Dreame, Roborock, Narwal, Eufy, or Ecovacs as the most consistently reliable brands, but do let me know if I'm wrong here.","The issue is simply how many models there are! They have so many features and even the review sites will tell you which ones are good, but a lot of them mention carpets, which I categorically do not have.","I live in a small ish single level space (700 sq ft) with laminate flooring and tile flooring only, and the main concern is pet hair and mopping.","[object Object]","","","Is it worth springing for the flagships? Do I settle for mid range? What type of mop makes sense for these floors?","Any guidance would be GREATLY appreciated"
