"button href","button","absolute href","absolute","flex href","h-full src","whitespace-nowrap","inline-block","whitespace-nowrap 2","block","hover:no-underline href","md","md 2","md 3","overflow-hidden href","block 2","flex","md 4","md 5"
"https://www.reddit.com/submit?source_id=t3_1uihptk&composer_entry=crosspost_post_action_bar","Repost","https://www.reddit.com/r/RobotVacuums/comments/1uihptk/i_gave_my_deebot_a_sock_so_he_is_free_now/","I gave my deebot a sock, so he is free now","https://www.reddit.com/user/36-Noodles/","","u/36-Noodles","•","18 days ago","I gave my deebot a sock, so he is free now","","","","","[object Object]","SML.load([""32D6UNXHci"",""7KgY-4t-bj"",""9l9CnJPXUX"",""Apklb-ulLM"",""B_NHAZUdqW"",""B65d8mZ9dk"",""BaeKfoZWFu"",""BbEbdxSSWP"",""BBVFbL9gTt"",""BDqLQYUXb2"",""BE_eRNLHde"",""BE3KWFvAgd"",""Bfk76jCzva"",""BgzRPq9TrY"",""BHxHI-jiY8"",""BL4AFWChm2"",""BqCxBJyWKP"",""BRR-WcxRPu"",""BT-RK55BKV"",""Bt9bCnZeE4"",""Btbd1Rlzrj"",""BVFvNgoGa3"",""BZ2_qUMvze"",""C5V-G3dhmR"",""C60kHV2aLi"",""C6i1azzdWJ"",""CB_reylV_c"",""CbhpgNHVKi"",""CbNqmNJ9ZB"",""CEvq12cbO2"",""Cf72vh6LG6"",""CJTuHLD6HH"",""CRpMPywSwN"",""CrXP_t2buz"",""CU1eEyKYo6"",""CWCOAGnsuZ"",""CWuClRIAPb"",""Cxj4rYqYlV"",""CymvsgY07C"",""CyodcBLUBi"",""D-tOoTkopZ"",""D0Pq5ES-zJ"",""D3zOLvL8jV"",""D7x3TCAE9T"",""D8aHHRjuby"",""D9DtoVVF6i"",""D9gjqLbbjQ"",""DA2r4_1OU1"",""Dag00w-zJ8"",""DAWbe3IpMr"",""Dba5_HGJbL"",""DbY_c8hZXg"",""De-r6IzqJA"",""DHMPn_y_v9"",""DhS9dAZhjq"",""DHzHlOJRFF"",""DIxBJjJd_K"",""Dl3s0VKard"",""DLF_4_tUTe"",""Dm3xL5MQs7"",""DMY8GyetUo"",""DnhB_hG7j0"",""DOy5NYM9Ep"",""DR8wAHG9t8"",""DrNS5yd8Ck"",""DRozBhqA5h"",""DSqCK5EWRj"",""DstzxuPuBF"",""DuMYOvD6fZ"",""DUOCnquoJh"",""HNKHNuLSLH"",""Ie5ylYRrC6"",""lXmtgL270o"",""NZ-CnbFGvr"",""rYEVoUfuLu"",""uede2U50tA"",""vivXUQq-Wz""], 'en-US/', 'auto');","","",""
"https://www.reddit.com/submit?source_id=t3_1ut1d4y&composer_entry=crosspost_post_action_bar","Repost","https://www.reddit.com/r/RobotVacuums/comments/1ut1d4y/eufy_s2_maintenance_check_in/","Eufy S2 - Maintenance Check In","https://www.reddit.com/user/joeshmoe4414/","https://styles.redditmedia.com/t5_1rt6er/styles/profileIcon_kckm2iexgecg1.jpeg?width=64&height=64&frame=1&auto=webp&crop=64%3A64%2Csmart&s=34c919df91f7502df592b2e7742218e0d911adfc","u/joeshmoe4414","•","6 days ago","Eufy S2 - Maintenance Check In","","","","","","SML.load([""32D6UNXHci"",""7KgY-4t-bj"",""9l9CnJPXUX"",""Apklb-ulLM"",""B_NHAZUdqW"",""B65d8mZ9dk"",""BaeKfoZWFu"",""BbEbdxSSWP"",""BBVFbL9gTt"",""BDqLQYUXb2"",""BE_eRNLHde"",""BE3KWFvAgd"",""Bfk76jCzva"",""BgzRPq9TrY"",""BHxHI-jiY8"",""BL4AFWChm2"",""BqCxBJyWKP"",""BRR-WcxRPu"",""BT-RK55BKV"",""Bt9bCnZeE4"",""Btbd1Rlzrj"",""BVFvNgoGa3"",""BZ2_qUMvze"",""C5V-G3dhmR"",""C60kHV2aLi"",""C6i1azzdWJ"",""CB_reylV_c"",""CbhpgNHVKi"",""CbNqmNJ9ZB"",""CEvq12cbO2"",""Cf72vh6LG6"",""CJTuHLD6HH"",""CRpMPywSwN"",""CrXP_t2buz"",""CU1eEyKYo6"",""CWCOAGnsuZ"",""CWuClRIAPb"",""Cxj4rYqYlV"",""CymvsgY07C"",""CyodcBLUBi"",""D-tOoTkopZ"",""D0Pq5ES-zJ"",""D3zOLvL8jV"",""D7x3TCAE9T"",""D8aHHRjuby"",""D9DtoVVF6i"",""D9gjqLbbjQ"",""DA2r4_1OU1"",""Dag00w-zJ8"",""DAWbe3IpMr"",""Dba5_HGJbL"",""DbY_c8hZXg"",""De-r6IzqJA"",""DHMPn_y_v9"",""DhS9dAZhjq"",""DHzHlOJRFF"",""DIxBJjJd_K"",""Dl3s0VKard"",""DLF_4_tUTe"",""Dm3xL5MQs7"",""DMY8GyetUo"",""DnhB_hG7j0"",""DOy5NYM9Ep"",""DR8wAHG9t8"",""DrNS5yd8Ck"",""DRozBhqA5h"",""DSqCK5EWRj"",""DstzxuPuBF"",""DuMYOvD6fZ"",""DUOCnquoJh"",""HNKHNuLSLH"",""Ie5ylYRrC6"",""lXmtgL270o"",""NZ-CnbFGvr"",""rYEVoUfuLu"",""uede2U50tA"",""vivXUQq-Wz""], 'en-US/', 'auto');","1","",""
"https://www.reddit.com/submit?source_id=t3_1uwykkd&composer_entry=crosspost_post_action_bar","Repost","https://www.reddit.com/r/RobotVacuums/comments/1uwykkd/dreame_reliability/","Dreame Reliability?","https://www.reddit.com/user/Certain-Trip-9065/","https://www.redditstatic.com/avatars/defaults/v2/avatar_default_2.png","u/Certain-Trip-9065","•","2 days ago","Dreame Reliability?","https://www.reddit.com/r/RobotVacuums/comments/1uwykkd/dreame_reliability/","In 2023 I bought my first Dreame off Amazon: L20 Ultra. After 10 months of use, it started losing the mop pads. Received a refund & went for a L40.Defective again after 11 months. Took the refund and got a X50. After 12 months …. defective again. This time I decided to go for a cheaper model and ordered the L40 Ultra A for 299€. Now 2 weeks later, defective again. WTH is wrong with the quality of this brand?!","","","","","","",""
"https://www.reddit.com/submit?source_id=t3_1u6rvpy&composer_entry=crosspost_post_action_bar","Repost","https://www.reddit.com/r/RobotVacuums/comments/1u6rvpy/our_dreame_x40_is_designed_to_be_not_repairable/","Our Dreame X40 is designed to be not repairable","https://www.reddit.com/user/gsenroc/","","u/gsenroc","•","1 mo. ago","Our Dreame X40 is designed to be not repairable","","","","","[object Object]","SML.load([""32D6UNXHci"",""7KgY-4t-bj"",""9l9CnJPXUX"",""Apklb-ulLM"",""B_NHAZUdqW"",""B65d8mZ9dk"",""BaeKfoZWFu"",""BbEbdxSSWP"",""BBVFbL9gTt"",""BDqLQYUXb2"",""BE_eRNLHde"",""BE3KWFvAgd"",""Bfk76jCzva"",""BgzRPq9TrY"",""BHxHI-jiY8"",""BL4AFWChm2"",""BqCxBJyWKP"",""BRR-WcxRPu"",""BT-RK55BKV"",""Bt9bCnZeE4"",""Btbd1Rlzrj"",""BVFvNgoGa3"",""BZ2_qUMvze"",""C5V-G3dhmR"",""C60kHV2aLi"",""C6i1azzdWJ"",""CB_reylV_c"",""CbhpgNHVKi"",""CbNqmNJ9ZB"",""CEvq12cbO2"",""Cf72vh6LG6"",""CJTuHLD6HH"",""CRpMPywSwN"",""CrXP_t2buz"",""CU1eEyKYo6"",""CWCOAGnsuZ"",""CWuClRIAPb"",""Cxj4rYqYlV"",""CymvsgY07C"",""CyodcBLUBi"",""D-tOoTkopZ"",""D0Pq5ES-zJ"",""D3zOLvL8jV"",""D7x3TCAE9T"",""D8aHHRjuby"",""D9DtoVVF6i"",""D9gjqLbbjQ"",""DA2r4_1OU1"",""Dag00w-zJ8"",""DAWbe3IpMr"",""Dba5_HGJbL"",""DbY_c8hZXg"",""De-r6IzqJA"",""DHMPn_y_v9"",""DhS9dAZhjq"",""DHzHlOJRFF"",""DIxBJjJd_K"",""Dl3s0VKard"",""DLF_4_tUTe"",""Dm3xL5MQs7"",""DMY8GyetUo"",""DnhB_hG7j0"",""DOy5NYM9Ep"",""DR8wAHG9t8"",""DrNS5yd8Ck"",""DRozBhqA5h"",""DSqCK5EWRj"",""DstzxuPuBF"",""DuMYOvD6fZ"",""DUOCnquoJh"",""HNKHNuLSLH"",""Ie5ylYRrC6"",""lXmtgL270o"",""NZ-CnbFGvr"",""rYEVoUfuLu"",""uede2U50tA"",""vivXUQq-Wz""], 'en-US/', 'auto');","2","",""
"https://www.reddit.com/submit?source_id=t3_1uv0ek6&composer_entry=crosspost_post_action_bar","Repost","https://www.reddit.com/r/RobotVacuums/comments/1uv0ek6/what_kind_of_brush_can_solve_pet_hair_tangles/","what kind of brush can solve pet hair tangles?","https://www.reddit.com/user/TheDTYP/","https://www.redditstatic.com/avatars/defaults/v2/avatar_default_2.png","u/TheDTYP","•","4 days ago","what kind of brush can solve pet hair tangles?","","","","","","SML.load([""32D6UNXHci"",""7KgY-4t-bj"",""9l9CnJPXUX"",""Apklb-ulLM"",""B_NHAZUdqW"",""B65d8mZ9dk"",""BaeKfoZWFu"",""BbEbdxSSWP"",""BBVFbL9gTt"",""BDqLQYUXb2"",""BE_eRNLHde"",""BE3KWFvAgd"",""Bfk76jCzva"",""BgzRPq9TrY"",""BHxHI-jiY8"",""BL4AFWChm2"",""BqCxBJyWKP"",""BRR-WcxRPu"",""BT-RK55BKV"",""Bt9bCnZeE4"",""Btbd1Rlzrj"",""BVFvNgoGa3"",""BZ2_qUMvze"",""C5V-G3dhmR"",""C60kHV2aLi"",""C6i1azzdWJ"",""CB_reylV_c"",""CbhpgNHVKi"",""CbNqmNJ9ZB"",""CEvq12cbO2"",""Cf72vh6LG6"",""CJTuHLD6HH"",""CRpMPywSwN"",""CrXP_t2buz"",""CU1eEyKYo6"",""CWCOAGnsuZ"",""CWuClRIAPb"",""Cxj4rYqYlV"",""CymvsgY07C"",""CyodcBLUBi"",""D-tOoTkopZ"",""D0Pq5ES-zJ"",""D3zOLvL8jV"",""D7x3TCAE9T"",""D8aHHRjuby"",""D9DtoVVF6i"",""D9gjqLbbjQ"",""DA2r4_1OU1"",""Dag00w-zJ8"",""DAWbe3IpMr"",""Dba5_HGJbL"",""DbY_c8hZXg"",""De-r6IzqJA"",""DHMPn_y_v9"",""DhS9dAZhjq"",""DHzHlOJRFF"",""DIxBJjJd_K"",""Dl3s0VKard"",""DLF_4_tUTe"",""Dm3xL5MQs7"",""DMY8GyetUo"",""DnhB_hG7j0"",""DOy5NYM9Ep"",""DR8wAHG9t8"",""DrNS5yd8Ck"",""DRozBhqA5h"",""DSqCK5EWRj"",""DstzxuPuBF"",""DuMYOvD6fZ"",""DUOCnquoJh"",""HNKHNuLSLH"",""Ie5ylYRrC6"",""lXmtgL270o"",""NZ-CnbFGvr"",""rYEVoUfuLu"",""uede2U50tA"",""vivXUQq-Wz""], 'en-US/', 'auto');","","",""
"https://www.reddit.com/submit?source_id=t3_1uv095d&composer_entry=crosspost_post_action_bar","Repost","https://www.reddit.com/r/RobotVacuums/comments/1uv095d/whats_the_worst_mess_your_robot_vacuum_has_ever/","What's the worst mess your robot vacuum has ever had to clean?","https://www.reddit.com/user/shortandtubby/","https://www.redditstatic.com/avatars/defaults/v2/avatar_default_0.png","u/shortandtubby","•","4 days ago","What's the worst mess your robot vacuum has ever had to clean?","https://www.reddit.com/r/RobotVacuums/comments/1uv095d/whats_the_worst_mess_your_robot_vacuum_has_ever/","A few friends came over yesterday to watch football. By the time everyone left, there were chip crumbs around the couch, footprints by the entry, and someone had spilled soda without noticing. My ecovacs T90 Pro had arrived just two days before, so this ended up being its first real test.","Turned out it wasn't as bad as it sounds. T90 Pro cleaned it all up without a problem.","Just curious what's the worst mess your robot has had to deal with? how it handled it?","","","","",""
"https://www.reddit.com/submit?source_id=t3_1uy6zpb&composer_entry=crosspost_post_action_bar","Repost","https://www.reddit.com/r/RobotVacuums/comments/1uy6zpb/auto_resume_off/","Auto Resume off!","https://www.reddit.com/user/Future-Comb-4784/","https://www.redditstatic.com/avatars/defaults/v2/avatar_default_7.png","u/Future-Comb-4784","•","7 hr. ago","Auto Resume off!","","","","","","SML.load([""32D6UNXHci"",""7KgY-4t-bj"",""9l9CnJPXUX"",""Apklb-ulLM"",""B_NHAZUdqW"",""B65d8mZ9dk"",""BaeKfoZWFu"",""BbEbdxSSWP"",""BBVFbL9gTt"",""BDqLQYUXb2"",""BE_eRNLHde"",""BE3KWFvAgd"",""Bfk76jCzva"",""BgzRPq9TrY"",""BHxHI-jiY8"",""BL4AFWChm2"",""BqCxBJyWKP"",""BRR-WcxRPu"",""BT-RK55BKV"",""Bt9bCnZeE4"",""Btbd1Rlzrj"",""BVFvNgoGa3"",""BZ2_qUMvze"",""C5V-G3dhmR"",""C60kHV2aLi"",""C6i1azzdWJ"",""CB_reylV_c"",""CbhpgNHVKi"",""CbNqmNJ9ZB"",""CEvq12cbO2"",""Cf72vh6LG6"",""CJTuHLD6HH"",""CRpMPywSwN"",""CrXP_t2buz"",""CU1eEyKYo6"",""CWCOAGnsuZ"",""CWuClRIAPb"",""Cxj4rYqYlV"",""CymvsgY07C"",""CyodcBLUBi"",""D-tOoTkopZ"",""D0Pq5ES-zJ"",""D3zOLvL8jV"",""D7x3TCAE9T"",""D8aHHRjuby"",""D9DtoVVF6i"",""D9gjqLbbjQ"",""DA2r4_1OU1"",""Dag00w-zJ8"",""DAWbe3IpMr"",""Dba5_HGJbL"",""DbY_c8hZXg"",""De-r6IzqJA"",""DHMPn_y_v9"",""DhS9dAZhjq"",""DHzHlOJRFF"",""DIxBJjJd_K"",""Dl3s0VKard"",""DLF_4_tUTe"",""Dm3xL5MQs7"",""DMY8GyetUo"",""DnhB_hG7j0"",""DOy5NYM9Ep"",""DR8wAHG9t8"",""DrNS5yd8Ck"",""DRozBhqA5h"",""DSqCK5EWRj"",""DstzxuPuBF"",""DuMYOvD6fZ"",""DUOCnquoJh"",""HNKHNuLSLH"",""Ie5ylYRrC6"",""lXmtgL270o"",""NZ-CnbFGvr"",""rYEVoUfuLu"",""uede2U50tA"",""vivXUQq-Wz""], 'en-US/', 'auto');","1","","So I have auto resume checked and ran the whole apartment today, the battery level was low and the machine went to charge, but despite auto resume it only charged 50% which was nowhere near enough to complete the cleaning, it started cleaning at 50% and then had to go and charge again,and this time too it only charged to 50%, the cleaning took an unnecessarily long time because of this."
"https://www.reddit.com/submit?source_id=t3_1urfecn&composer_entry=crosspost_post_action_bar","Repost","https://www.reddit.com/r/RobotVacuums/comments/1urfecn/life_with_a_toddler_finally_convinced_me_to_get_a/","Life with a toddler finally convinced me to get a robot vacuum","https://www.reddit.com/user/Chvprice/","https://www.redditstatic.com/avatars/defaults/v2/avatar_default_2.png","u/Chvprice","•","8 days ago","Life with a toddler finally convinced me to get a robot vacuum","https://www.reddit.com/r/RobotVacuums/comments/1urfecn/life_with_a_toddler_finally_convinced_me_to_get_a/","Spent a while comparing robots from eufy and ecovacs before Prime Day. Once the discounts went live, I pulled the trigger on the X12. I figured if I was replacing my old robot, I might as well buy something I'd be happy using for the next few years.","I have young kids, so the floor gets messy fast. Crumbs under the dining table, dried juice in the kitchen, and random sticky spots seem to appear every day. One thing that pushed me toward the X12 was how it deals with these kinda messes. It doesn't just roll over them. It sprays a little water first, then goes back over the area with the roller. I checked a few of the worst spots after the first run and they were gone. The longer roller has been noticeable too. It covers a wider path, and when the cleaning cycle finishes I don't find many areas that need a second wipe.","So far it feels like I made the right call. I'll keep using it for a while and come back with an update once I've had more time with it.","","","","",""
"https://www.reddit.com/submit?source_id=t3_1uebjm1&composer_entry=crosspost_post_action_bar","Repost","https://www.reddit.com/r/RobotVacuums/comments/1uebjm1/ecovacs_t90_pro_omni_499/","Ecovacs T90 Pro Omni $499","https://www.reddit.com/user/Wonderful-Shoulder85/","https://www.redditstatic.com/avatars/defaults/v2/avatar_default_3.png","u/Wonderful-Shoulder85","•","22 days ago","Ecovacs T90 Pro Omni $499","","","","","","SML.load([""32D6UNXHci"",""7KgY-4t-bj"",""9l9CnJPXUX"",""Apklb-ulLM"",""B_NHAZUdqW"",""B65d8mZ9dk"",""BaeKfoZWFu"",""BbEbdxSSWP"",""BBVFbL9gTt"",""BDqLQYUXb2"",""BE_eRNLHde"",""BE3KWFvAgd"",""Bfk76jCzva"",""BgzRPq9TrY"",""BHxHI-jiY8"",""BL4AFWChm2"",""BqCxBJyWKP"",""BRR-WcxRPu"",""BT-RK55BKV"",""Bt9bCnZeE4"",""Btbd1Rlzrj"",""BVFvNgoGa3"",""BZ2_qUMvze"",""C5V-G3dhmR"",""C60kHV2aLi"",""C6i1azzdWJ"",""CB_reylV_c"",""CbhpgNHVKi"",""CbNqmNJ9ZB"",""CEvq12cbO2"",""Cf72vh6LG6"",""CJTuHLD6HH"",""CRpMPywSwN"",""CrXP_t2buz"",""CU1eEyKYo6"",""CWCOAGnsuZ"",""CWuClRIAPb"",""Cxj4rYqYlV"",""CymvsgY07C"",""CyodcBLUBi"",""D-tOoTkopZ"",""D0Pq5ES-zJ"",""D3zOLvL8jV"",""D7x3TCAE9T"",""D8aHHRjuby"",""D9DtoVVF6i"",""D9gjqLbbjQ"",""DA2r4_1OU1"",""Dag00w-zJ8"",""DAWbe3IpMr"",""Dba5_HGJbL"",""DbY_c8hZXg"",""De-r6IzqJA"",""DHMPn_y_v9"",""DhS9dAZhjq"",""DHzHlOJRFF"",""DIxBJjJd_K"",""Dl3s0VKard"",""DLF_4_tUTe"",""Dm3xL5MQs7"",""DMY8GyetUo"",""DnhB_hG7j0"",""DOy5NYM9Ep"",""DR8wAHG9t8"",""DrNS5yd8Ck"",""DRozBhqA5h"",""DSqCK5EWRj"",""DstzxuPuBF"",""DuMYOvD6fZ"",""DUOCnquoJh"",""HNKHNuLSLH"",""Ie5ylYRrC6"",""lXmtgL270o"",""NZ-CnbFGvr"",""rYEVoUfuLu"",""uede2U50tA"",""vivXUQq-Wz""], 'en-US/', 'auto');","","",""
"","","","Advertisement: Soms voelt iets onmogelijk… totdat het wél lukt. Met die overtuiging wekken we fossielvrije stroom op uit wind en zon.","","","","•","","","","","","","","","","",""
"https://www.reddit.com/submit?source_id=t3_1uszvhl&composer_entry=crosspost_post_action_bar","Repost","https://www.reddit.com/r/RobotVacuums/comments/1uszvhl/what_is_the_best_robot_vacuum_mop_in_2026_is_a/","What is the best robot vacuum & mop in 2026 – is a flagship actually worth it?","https://www.reddit.com/user/Open_Flatworm683/","https://www.redditstatic.com/avatars/defaults/v2/avatar_default_0.png","u/Open_Flatworm683","•","6 days ago","What is the best robot vacuum & mop in 2026 – is a flagship actually worth it?","https://www.reddit.com/r/RobotVacuums/comments/1uszvhl/what_is_the_best_robot_vacuum_mop_in_2026_is_a/","Hey,","I’m looking for the best all-around robot vacuum and mop for my apartment.","~80 m² (860 sq ft)Mix of hardwood, vinyl, tile, and a few area rugsI live alone (no pets at the moment, but I may get a cat in the future)The apartment is generally kept pretty clean","","","","Goog vacuuming and mopping performanceVery good navigationGreat obstacle avoidance (chairs, table legs, furniture, etc.)Able to clean under couches and other furniture where possibleGood edge and corner cleaningReliable carpet detection","One feature that’s especially important to me is . I have a walk-in shower, so the bathroom floor can sometimes still be wet. I’d like the robot to recognize water and avoid vacuuming it (or switch to mopping only), rather than sucking up water into the vacuum."
"https://www.reddit.com/submit?source_id=t3_1uy1tcw&composer_entry=crosspost_post_action_bar","Repost","https://www.reddit.com/r/RobotVacuums/comments/1uy1tcw/upgrade_from_q8_max/","Upgrade from Q8 Max+","https://www.reddit.com/user/AmbitiousYoutuber/","","u/AmbitiousYoutuber","•","10 hr. ago","Upgrade from Q8 Max+","https://www.reddit.com/r/RobotVacuums/comments/1uy1tcw/upgrade_from_q8_max/","Just took my Q8 Max+ for warranty (which its somehow out of warranty after 1 year) since of sensor issues (mop mount removed installed error) and it kept me thinking how many great ones are out there for similiar price","is said to be greater power suction and everything else for same price?","Is there any must buy mop mount that's better than Roborock Q8 Max+? It seems it does its job for 50m2/538 square feet apartments.","[object Object]","","","Did Robot Vacuums get really advanced past year for its price?","I see ones for 1000 USD and not sure if they are worth it and some for $377"
"https://www.reddit.com/submit?source_id=t3_1ur724y&composer_entry=crosspost_post_action_bar","Repost","https://www.reddit.com/r/RobotVacuums/comments/1ur724y/insects_bugs_and_pests_have_these_robots_helped/","Insects, bugs and pests- Have these robots helped create a hostile environment for them?","https://www.reddit.com/user/owls_exist/","https://www.redditstatic.com/avatars/defaults/v2/avatar_default_6.png","u/owls_exist","•","8 days ago","Insects, bugs and pests- Have these robots helped create a hostile environment for them?","https://www.reddit.com/r/RobotVacuums/comments/1ur724y/insects_bugs_and_pests_have_these_robots_helped/","My parents house is very cluttered and my room well I nest very hard so I like keeping a bunch of stuff as long as the floors as clear for the robot, but clutter makes a nice home for bugs.","Have these robots helped deter any spiders and other pests from staying in your home? Maybe not the flying ones for obvious reasons but the floor dwellers.","I have to replace my robot soon because it's falling apart so I'm hoping the new one will have more powerful suction to nab up ants, wandering spiders and earwigs.","","","","",""
"https://www.reddit.com/submit?source_id=t3_1uy03km&composer_entry=crosspost_post_action_bar","Repost","https://www.reddit.com/r/RobotVacuums/comments/1uy03km/jonr_p20_pro_issue/","JONR P20 Pro issue","https://www.reddit.com/user/pgl0001/","https://www.redditstatic.com/avatars/defaults/v2/avatar_default_5.png","u/pgl0001","•","11 hr. ago","JONR P20 Pro issue","https://www.reddit.com/r/RobotVacuums/comments/1uy03km/jonr_p20_pro_issue/","Hello, I just realized under cleaning that the brush holder was broken in the end where the brush is fixed and rotating.","It still works but is that normal after less than a year of use ?","","","","","",""
"https://www.reddit.com/submit?source_id=t3_1ur6vfn&composer_entry=crosspost_post_action_bar","Repost","https://www.reddit.com/r/RobotVacuums/comments/1ur6vfn/robo_vac_help_for_large_household/","Robo vac - help for large household","https://www.reddit.com/user/Extension_Coat3702/","https://www.redditstatic.com/avatars/defaults/v2/avatar_default_7.png","u/Extension_Coat3702","•","8 days ago","Robo vac - help for large household","https://www.reddit.com/r/RobotVacuums/comments/1ur6vfn/robo_vac_help_for_large_household/","Have a robot vac and it's fantastic, however often gets jammed with a shoelace, phone cord etc.  I have it set to daily auto clean.","I am a mother of five who works full-time. Our house is relatively clutter free, however kids are kids and leave a shoe on the ground or a sock etc which current robo vac eats and then shuts down.","I do a whip around the house to pick up things before I go to work, however I leave before the older kids.","","","","Can anyone recommend a robot vac with excellent object awareness? Happy to pay premium if needed.",""
"https://www.reddit.com/submit?source_id=t3_1ux4wyl&composer_entry=crosspost_post_action_bar","Repost","https://www.reddit.com/r/RobotVacuums/comments/1ux4wyl/it_is_time/","It is time","https://www.reddit.com/user/PetiteAigle/","","u/PetiteAigle","•","1 day ago","It is time","https://www.reddit.com/r/RobotVacuums/comments/1ux4wyl/it_is_time/","I think it's finally time for me to accept defeat.","After two years of vacuuming and mopping the floors every single day with twins and a dog at home, I officially concede. 😅 I need a break...","I'm ready to go all-in on a robot vacuum that will give me the help I desperately need!","[object Object]","","","Can you guys help me choose my new helper? Here's what I'm looking for:","I don't really have a budget.. I’m willing to pay whatever it takes to help keep my sanity. 😂"
"https://www.reddit.com/submit?source_id=t3_1uvnah3&composer_entry=crosspost_post_action_bar","Repost","https://www.reddit.com/r/RobotVacuums/comments/1uvnah3/overwhelmed_and_at_a_loss/","Overwhelmed and at a loss.","https://www.reddit.com/user/Wild-Source-6743/","","u/Wild-Source-6743","•","3 days ago","Overwhelmed and at a loss.","https://www.reddit.com/r/RobotVacuums/comments/1uvnah3/overwhelmed_and_at_a_loss/","I can't recall the last time I had to spend so much time researching, to end up nowhere.","So many models, with sub models and whichever you find never matches the exact description online. Reviews are ni help since half is sponsored and the other half a divide between the best thing since sliced bread or worse than cholera.","How does anyone make a decision these days?","[object Object]","","","- EU based","- €400 price range"
"https://www.reddit.com/submit?source_id=t3_1ur4w34&composer_entry=crosspost_post_action_bar","Repost","https://www.reddit.com/r/RobotVacuums/comments/1ur4w34/roomba_705_max_combo_streaks/","Roomba 705 Max Combo streaks","https://www.reddit.com/user/Independent-Role1562/","https://www.redditstatic.com/avatars/defaults/v2/avatar_default_4.png","u/Independent-Role1562","•","8 days ago","Roomba 705 Max Combo streaks","","","","","","SML.load([""32D6UNXHci"",""7KgY-4t-bj"",""9l9CnJPXUX"",""Apklb-ulLM"",""B_NHAZUdqW"",""B65d8mZ9dk"",""BaeKfoZWFu"",""BbEbdxSSWP"",""BBVFbL9gTt"",""BDqLQYUXb2"",""BE_eRNLHde"",""BE3KWFvAgd"",""Bfk76jCzva"",""BgzRPq9TrY"",""BHxHI-jiY8"",""BL4AFWChm2"",""BqCxBJyWKP"",""BRR-WcxRPu"",""BT-RK55BKV"",""Bt9bCnZeE4"",""Btbd1Rlzrj"",""BVFvNgoGa3"",""BZ2_qUMvze"",""C5V-G3dhmR"",""C60kHV2aLi"",""C6i1azzdWJ"",""CB_reylV_c"",""CbhpgNHVKi"",""CbNqmNJ9ZB"",""CEvq12cbO2"",""Cf72vh6LG6"",""CJTuHLD6HH"",""CRpMPywSwN"",""CrXP_t2buz"",""CU1eEyKYo6"",""CWCOAGnsuZ"",""CWuClRIAPb"",""Cxj4rYqYlV"",""CymvsgY07C"",""CyodcBLUBi"",""D-tOoTkopZ"",""D0Pq5ES-zJ"",""D3zOLvL8jV"",""D7x3TCAE9T"",""D8aHHRjuby"",""D9DtoVVF6i"",""D9gjqLbbjQ"",""DA2r4_1OU1"",""Dag00w-zJ8"",""DAWbe3IpMr"",""Dba5_HGJbL"",""DbY_c8hZXg"",""De-r6IzqJA"",""DHMPn_y_v9"",""DhS9dAZhjq"",""DHzHlOJRFF"",""DIxBJjJd_K"",""Dl3s0VKard"",""DLF_4_tUTe"",""Dm3xL5MQs7"",""DMY8GyetUo"",""DnhB_hG7j0"",""DOy5NYM9Ep"",""DR8wAHG9t8"",""DrNS5yd8Ck"",""DRozBhqA5h"",""DSqCK5EWRj"",""DstzxuPuBF"",""DuMYOvD6fZ"",""DUOCnquoJh"",""HNKHNuLSLH"",""Ie5ylYRrC6"",""lXmtgL270o"",""NZ-CnbFGvr"",""rYEVoUfuLu"",""uede2U50tA"",""vivXUQq-Wz""], 'en-US/', 'auto');","1","",""
"https://www.reddit.com/submit?source_id=t3_1uxzjy2&composer_entry=crosspost_post_action_bar","Repost","https://www.reddit.com/r/RobotVacuums/comments/1uxzjy2/buying_a_robot/","Buying a robot","https://www.reddit.com/user/skylair96/","","u/skylair96","•","12 hr. ago","Buying a robot","","","","","[object Object]","SML.load([""32D6UNXHci"",""7KgY-4t-bj"",""9l9CnJPXUX"",""Apklb-ulLM"",""B_NHAZUdqW"",""B65d8mZ9dk"",""BaeKfoZWFu"",""BbEbdxSSWP"",""BBVFbL9gTt"",""BDqLQYUXb2"",""BE_eRNLHde"",""BE3KWFvAgd"",""Bfk76jCzva"",""BgzRPq9TrY"",""BHxHI-jiY8"",""BL4AFWChm2"",""BqCxBJyWKP"",""BRR-WcxRPu"",""BT-RK55BKV"",""Bt9bCnZeE4"",""Btbd1Rlzrj"",""BVFvNgoGa3"",""BZ2_qUMvze"",""C5V-G3dhmR"",""C60kHV2aLi"",""C6i1azzdWJ"",""CB_reylV_c"",""CbhpgNHVKi"",""CbNqmNJ9ZB"",""CEvq12cbO2"",""Cf72vh6LG6"",""CJTuHLD6HH"",""CRpMPywSwN"",""CrXP_t2buz"",""CU1eEyKYo6"",""CWCOAGnsuZ"",""CWuClRIAPb"",""Cxj4rYqYlV"",""CymvsgY07C"",""CyodcBLUBi"",""D-tOoTkopZ"",""D0Pq5ES-zJ"",""D3zOLvL8jV"",""D7x3TCAE9T"",""D8aHHRjuby"",""D9DtoVVF6i"",""D9gjqLbbjQ"",""DA2r4_1OU1"",""Dag00w-zJ8"",""DAWbe3IpMr"",""Dba5_HGJbL"",""DbY_c8hZXg"",""De-r6IzqJA"",""DHMPn_y_v9"",""DhS9dAZhjq"",""DHzHlOJRFF"",""DIxBJjJd_K"",""Dl3s0VKard"",""DLF_4_tUTe"",""Dm3xL5MQs7"",""DMY8GyetUo"",""DnhB_hG7j0"",""DOy5NYM9Ep"",""DR8wAHG9t8"",""DrNS5yd8Ck"",""DRozBhqA5h"",""DSqCK5EWRj"",""DstzxuPuBF"",""DuMYOvD6fZ"",""DUOCnquoJh"",""HNKHNuLSLH"",""Ie5ylYRrC6"",""lXmtgL270o"",""NZ-CnbFGvr"",""rYEVoUfuLu"",""uede2U50tA"",""vivXUQq-Wz""], 'en-US/', 'auto');","1","","Can you recommend which self cleaning robot to purchase please?"
